1.1.1	Res a mundi exordio sacris litteris editas breuiter constringere et cum distinctione temporum usque ad nostram memoriam carptim dicere aggressus sum, multis id a me et studiose efflagitantibus, qui diuina compendiosa lectione cognoscere properabant, 
1.1.2	quorum ego uoluntatem secutus non peperci labori meo, quin ea, quae permultis uoluminibus perscripta continebantur, duobus libellis concluderem, ita breuitati studens, ut paene nihil gestis subduxerim. 
1.1.3	uisum autem mihi est non absurdum, cum usque ad Christi crucem Apostolorumque actus per sacram historiam cucurrissem, etiam post gesta conectere: excidium Hierosolymae uexationesque populi Christiani et mox pacis tempora, ac rursum ecclesiarum intestinis periculis turbata omnia locuturus. 
1.1.4	ceterum illud non pigebit fateri, me, sicubi ratio exegit, ad distinguenda tempora continuandamque seriem usum esse historicis mundialibus atque ex his, quae ad supplementum cognitionis deerant, usurpasse, ut et imperitos docerem et litteratos conuincerem. 
1.1.5	 uerumtamen ea quae de sacris uoluminibus breuiata digessimus, non ita legentibus auctor accesserim, ut praetermissis his, unde INCIPIT PHOLOGVS SVLPITII SEVERI IN CHKONICA. QVAE IPSE FECIT AB EXORDIO MVNDI VSQ. AD TEMPVS SVVM P, uerbis usq. ad tempus suum su- per ab exordio mundi scriptis 3 a me studiose b 10 conectere P, ut coniecit Giselinus: conuertere b II hierusolimae P 12 locuturo Hieron. Mercerus; \'magisplaceret, si hoc uerbum penitus deesset\' de Prato; cf. tamen I, 28, 5: erat Allophylis moris .. Samson quasi in pompam publicum producere, capto insultantes et 1, 38, 6 Huius eum facti mox piguit paenituitque, ueniam a Deo petens etc . 14 hystoricis P II mundialibus P, add. sup. lm. manu saec. XVvel XVIothnicis, ut est in b; cf, 2, 14, 6 18 acutor P II praetermissis his unde P: praetermissis illis unde haec b 1* deriuata sunt, appetantur: nisi cum illa quis familiariter nouerit, hic recognoscat quae ibi legerit: 
1.1.6	etenim uniuersa diuinarum rerum mysteria non nisi ex ipsis fontibus hauriri queunt. nunc initium narrandi faciam. 
1.2.1	 Mundus a Deo constitutus est abhinc annos iam paene sex milia, sicut processu uoluminis istius digeremus: quamquam inter se parum consentiant, qui rationem temporum inuestigatam ediderunt. 
1.2.2	quod cum uel Dei nutu uel uitio uetustatis eueniat, calumnia carere debebit. mundo autem condito homo factus est: uiro Adam, mulieri Eua nomen fuit. sed constituti in paradiso, cum interdicta sibi arbore degustassent, in nostram uelut exules terram eiecti sunt. 
1.2.3	deinde ex his Cain atque Abel nascitur: sed Cain impius fratrem interemit. filium Enoch habuit, a quo primum ciuitas condita est, auctoris nomine uocitata. 
1.2.4	ex hoc Irad atque ex eo Mauiahel nascitur. hic Mathusalam filium habuit isque Lamech genuit, a quo iuuenis occisus traditur, nec tamen nomen refertur occisi: quod quidem futuro mysterio fuisse praemissum a prudentibus aestimatur. 
1.2.5	igitur Adam post necem filii minoris Seth filium procreauit, cum iam trigesimum et ducentesimum annum aetatis implesset, uixit autem annos DCCCCXXX. Seth uero Enos, Enos Kainan, Kainan Malaleel, Malaleel Iared, Iared Enoch genuit: qui ob iustitiam translatus a Deo traditur. huius filius Mathusalam dictus est, qui Lamech genuit: 
1.2.6	ex quo Noe natus, iustitia egregius et prae ceteris mortalibus Deo carus acceptusque. 
1.2.7	qua tempestate cum iam humanum genus abundaret, angeli, quibus caelum sedes erat, speciosarum forma uirginum 5 Gen. 1. 9 Gen. 2. 18 Gen. 4. 19 Gen. 5. 1 diriuata P 4 faciam INCIPIT LIBER P 5 a Deo P et SigoniUlJ: a Domino b II annorum malebat Giselinus 6 millia b 8 uenustatis P 10 constutiti P 11 interdicta sibi arbore seripsi: interdicti sibi arboro P, interdictam sibi arborem b 12 nascitur P: nascuntur b 13 Is filium Vonck (inLectionumLatinarum libris II. Traiecti1745) II enoc P 14 ex eo Irad atque ex hoc malebat de Prato 15 mauiahel P: Mamahel b II hic Mathusael Vorstius 16 iuuenis P: iuuenis quidam b 17 pmissum P (non pmissum, ut ait de Prato) 20 ducentesimum] sic LXX, contra textus hebr. et vulg . centesimum 21 Kainan P (bis), ut coni. Gelasinius: Nainan b j) Maleleel LXX et Lucas 24 iustitiS P II deo P: Domino b 26 sedis P, sed eadeni manu sedes corr . II spetiosarum P capti illicitas cupiditates appetierunt: ac naturae suae originisque degeneres, relictis superioribus, quorum incolae erant, matrimoniis se mortalibus miscuerunt. 
1.2.8	hi paulatim mores noxios conserentes humanam corrupere progeniem, exque eorum coitu Gigantes editi esse dicuntur, cum diuersae inter se naturae permixtio monstra gigneret. 
1.3.1	Quibus rebus offensus Deus maximeque malitia hominum, quae ultra modum processerat, delere penitus humanum genus decreuerat. sed No6 , uirum iustum, uita innocens destinatae exemit sententiae. 
1.3.2	idem admonitus a Deo diluuium terris imminere, aream inmensae magnitudinis ex lignis contexuit ac bitumine illitam inpenetrabilem aquis reddidit, qua ille cum uxore ac filiis tribus et totidem nuribus clausus: uolucrum etiam paria itidemque diuersi generis bestiarum eodem claustro recepta, reliqua omnia diluuio absumpta. 
1.3.3	igitur Noe, cum iam imbrium uim destitisse et quieto in salo arcam circumferri intellegeret, ratus, id quod erat, aquas decedere, coruum primum explorandae rei gratia, eoque non reuertente — ut ego conicio, cadaueribus detentum — emisit columbam: quae cum consistendi locum non repperisset, reuersa est. 
1.3.4	rursum emissa folium oliuae retulit, manifestum indicium, nudari cacumina arborum. tertio demum emissa non rediit: unde animadversum aquas destitisse. 
1.3.5	ita Noe aream egressus est. id gestum a mundi exordio post annos, ut ego comperio, n cc duos et quadraginta. 
1.4.1	Ac primum Noe aram Deo statuit hostiasque ex uolucribus immolauit. mox a Deo cum filiis benedicitur, praeceptumque accepit, ne sanguine uesceretur aut sanguinem hominis effunderet, quia mundi primordia mandati, istius liber Cain maculauerat. igitur uacuo tum saeculo ex filiis Noe semen fuit: 
1.4.2	tres enim 9 Gen. 7. 26 Gen. 9. 4 humanum P II exque eorum Vonck: ex quS eorum P, ex quorum b 10 a deo P: a Domino b 13 nuribus ost clausus b 14 uniyeni generis malebat de Prato 15 imbrium uim scripsi: imbrium P, imbrem b 16 et P: ac b II intelleret P 17 decedere P corr. 1 m. ex decerere 18 conitioP II deteuttlP: detento b 19 reperiisset b 20 emissa Qiselinus: remisuPb 21 iudiciumP 22 desedisse Vonck 24.11. (i.e. II milia) P: II b 25 et 26 deoP. Domino b 26 accipit coni de Prato 29 semen amicus Vonckii et de Prato: Sem Pbpro sedi, ut vox in P scribi solet habuit, Sem, Cham, Iaphet. sed Cham, quod sopitum uino patremriserat , maledictum a patre meruit. 
1.4.3	huius filius, Chus nomine, Nebroth gigantem genuit,. a quo Babylon ciuitas constructa traditur. pleraque etiam oppida ea tempestate condita mmorantur , quae nominatim persequi animus non fuit. sed cum 
1.4.4	 multiplicaretur humanum genus diuersaque loca atque insulas mortales haberent, una tamen omnes lingua utebantur, donec se in unum dispergenda per totum orbem multitudo contraxit. 
1.4.5	his more humani ingenii consilium fuit, insigni aliquo opere famam quaerere, priusquam a se inuicem deducerentur. 
1.4.6	ita turrim facere aggressi, quae caelo accederet, nutu Dei, ut officia operantium praepedirentur, a sueto sermonis genere multa diuerso neque ulli inuicem intellecto linguarum ritu loquebantur: quo promptius dispersi sunt, quia alter alterum uelut alienigenam facile relinquebat. 
1.4.7	sed filiis Noe ita diuisus orbis fuit, ut Sem intra Orientem, Iaphet Occidentem, Cham mediis contineretur. ita usque Abraham ducta successio nihil sane insigne aut memorabile in se habuit. 
1.5.1	 Abraham autem patre Thara natus post diluuium anno millesimo et septuagesimo. Abraham uxor Sara dicta est, primaque eius in regione Chaldaeorum habitatio fuit. inde apud Charras una cum patre diuersatus est. 
1.5.2	qua tempestate admonitus a Deo, domum patriam ac patrem relinquens, assumpto Loth fratris filio in terram Chananaeorum profectus in loco, cui Sychem nomen est, consedit. 
1.5.3	mox annonae inopia Aegyptum concessit, ac rursum reversus. Loth, prae multitudine familiae a patruo digressus, ut laxioribus uacuae tum regionis spatiis uterentur, in 5 Gen. 10. 10 Gen. 11. 21 Gen. 12, 3 Nebrod b II meruit P, sed ead. m . genuit corr . II babylllon P 7 tamen P: tantum b || omis P 10 diducerentur Hornius 12 assueto P, inassueto b 14 quia P: quum b 16 iaphe P 18 natus P: natus est b 19 septuagesimo secundo H. Mercier II Sarai Io. Arcerius, cuius emendationes Vonckius in Lectt. latt. publicauit 20 eius nos: eis Pb, ei de Prato II Carras Drusius 21 a Domino b 22 domum, patriam edd . 23 chananeorum P II sychem P ut est inLXX: Sichem b 24concessit, ac rarsum reuersus Loth b; uerborum distinctionem mutauit de Prato (concessit. ac rursum reuersis, Loth Sigonius 26 aacui P; de scriptura uacuae Drusius in notis p. 45 suspicionem mouit, nec tamen uacui lectio ferenda uidetur Sodomis consedit. id oppidum infame incolis, uiris in uiros irruentibus, atque ob id inuisum Deo fuisse traditur. 
1.5.4	ea tempestate reges uicinarum gentium in annis erant, cum antea nullum inter mortales certamen fuisset. sed aduersum hos, qui bello uicina temptabant, reges Sodomorum et Gomorrae uicinarumque regionum in proelium erumpunt, primoque impetu fusi uictoriam concessere. tum a uictoribus Sodoma direpta praedae hostibus fuit, ductusque Loth in captiuitatem. 
1.5.5	quod cum Abraham comperisset, propere armatis semis suis, numero trecentis decem et octo, reges uictoria feroces exutos praeda armisque in fugam compulit. 
1.5.6	tum a Melchisedech sacerdote benedictus est, eidemque praedae decimas dedit. reliqua his, quibus erepta erant, reddidit. 
1.6.1	Per idem tempus Abrahae Deus locutus est, multiplicandumque semen eius, sicut arenas maris stellasque caeli, spopondit: peregrinumque eius semen futurum praedictum ac posteros in hostili solo per quadringentos annos laturos seruitium, post libertati restituendos. 
1.6.2	tunc ei atque uxori eius adiectione unius: litterae nomen inmutatum: ita nunc ex Abram Abraham, ex Sara Sarra dicitur. cuius quidem rei non inane mysterium non est huius operis exponere. 
1.6.3	eodem tempore Abrahae lex circumcisionis imposita est, erat ei autem ex ancilla filius Ismahel. et cum ipse esset annorum centum, uxor autem eius nonaginta, futurum eis filium Isaac Deus pollicetur, qui cum duobus angelis ad eum uenerat. 
1.6.4	inde Sodomam missi angeli Loth in porta sedentem reppererunt. quos cum ille, homines existimans, hospitio receptos 2 Gen. 14. 13 Gen. 15 et 17. 23 Gen. 18. 25 Gen. 19. 2 Domino b 3 erant cum b: erant inmortales cum P 5 sodomum et gomorrumP; Sodomorum, Gommoreorum b; Gomorrhae coni. Vorstius, coll. interprete Graeco: βασιλεὺς ∑ οδ ó μωυ , βασιλεὺς Γομ ó ρρας (Sodomitarum et Gomorrhaeorum coni. de Prato) II uicinarumque urbium coni. Drusius 6 uictoria P; at cf. 1, 34, 5 11 decimas b sed ante praedae: om. P 13 Dominus b 15 praedictum futurum b 16 post P: postea b 18 inmutatum P corr . \\I ex Abram Abraam Drusius II ex Sara Sarra Sigonius: ex sarai sara Pb; cf. Genes. 17, 5 et 15 ex interpret. LXX, August. de ciu. Dei XVI, 26, 25 21 Ismael b || ipse esse P 22 annorum fere (uel prope) centum coni. de Prato 23 Dominus b 1\\ cum duobus b: duobus P, at u. Gen. 18, 2 apparuerunt ei tres uiri stantes propc eum. 24 sedente P II reperierunt b cenatosque domi haberet, iuuentus improba ex oppido nouos hospites ad stuprum flagitabant. Loth pro hospitibus filias offerens, non adquiescentibus, quibus illicita potius desiderio erant, ipse ad stuprum trahebatur. 
1.6.5	quem angeli propere ab iniuria uindicantes luminibus impudicorum caecitatem offuderunt. tum Loth ab hospitibus edoctus perdendum oppidum, propere cum uxore et filiabus egressus: interdictum tamen est, ne retrorsum respicerent. 
1.6.6	 sed mulier parum dicto audiens – humano malo quo aegre uetitis abstinetur –, reflexit oculos statimque inmolem conuersa traditur. at Sodoma diuinis ignibus conflagrauit. 
1.6.7	Loth autem filiae existimantes humanum genus interisse concubitum inebriati patris appetiuerunt, unde Moab et Ammon nati sunt. 
1.7.1	 Per idem tempus fere, cum Abraham esset iam! centum annorum, Isaac filius natus est. tum ancillam, de qua Abraham filium susceperat, Sara expulit: quae habitasse in deserto una cum filio et praesidio Dei defensa traditur. 
1.7.2	nec multum post Deus Abrahae fidem temptans immolandum sibi a patre filium Isaac poscit. quem ille non cunctatus offerre, cum arae puerum superposuisset gladiumque educeret, uox missa de caelo est, puero parceret: uictimae aries praesto fuit. consummatoque sacrificio Abrahae Deus locutus est, promittens ea quae iam spoponderat. 
1.7.3	 at Sara, cum septimum et uigesimum et centesimum annum ageret, decessit: corpus cura uiri sepultum in Chebron, Chananaeorum oppido, etenim illic Abraham commorabatur. 
1.7.4	tum Abraham Isaac filium iuuenilis aetatis uidens, siquidem cum quadragesimum annum aetatis ageret, seruo suo imperauit uxorem ei quaereret, ex ea tamen tribu atque terra, de qua ipse oriundus uidebatur: modo ut inuentam puellam in regionem Chananaeorum 14 Gten. 21. 16 Gen. 22. 22 Gen. 23. 24 Gen. 24. 1 coenatosque b 4 «trahebatnr P 7 egressus P: est egressus b II tamen eis est b 1\\ respicerent P: conspicerent b 8 aegre nos: aeger P, aegriua b 9 immolem P 11 interiisse b 13 esset iam Wopkens(lect. Tull. I, 9): esset etiam Pb 14 habraham P 16 Domini b II nec P: Non b; immo nec multo post, ut est I, 21, 2 et 3. 50, 6. II, 18, 5 II Dominus b 17 habrahae P 19 puero ut parceret b 21 abrehae P II Dominus b 22 et cent. P: supra centesimum b 23 Hebron b II chananeorum P 25 iam uiriiis aetatis coni. de Prato \\I cum - ageret P: tum — agebat b 28 chananeorum P dednceret , nec putaret is causa coniugis in solum patrium rediturum. atque ut ea strenue mandata exequeretur, contacto domini femine sacramentum dedit. 
1.7.5	ita seruus profectus mMesopotamiam ad oppidum Nachor, Abrahae fratris, deuenit. successitque in domum Bathuelis Syri, Nachore patre geniti: huius filiam Rebeccam, speciosam uirginem, conspicatus poposcit atque ad dominum adduxit. 
1.7.6	post id Abraham accepit uxorem Cethuram nomine, quae in Paralipomenis concubina dicitur, suscepitque ex ea filios. sed Isaac Sara edito substantiam tradidit, his autem, quos ex concubinis susceperat, dona distribuit. atque ita ab Isaac separati sunt. 
1.7.7	Abraham diem functus est, impletis annis centum et quinque et septuaginta: corpus sepulcro Sarae uxoris appositum. 
1.8.1	At Rebecca, diu sterilis, assiduis mariti ad Dominum precibus a die matrimonii uigesimo fere anno geminos edidit: qui in matris aluo exultasse saepius traduntur, dictumque responso Dei est, duos in his populos praenuntiari, et maiorem minoris subdendum esse principio. sed prius editus, asper saetis, Esau uocatus, minori Iacob nomen fuit. 
1.8.2	ea tempestate grauis annonae inopia incesserat. qua necessitate Isaac in Geraris ad regem Abimelech cessit, admonitus a Domino, ne in Aegyptum descenderet: eidemque uniuersae terrae illius possessio promittitur ibique benedicitur, multiplicatusque pecore atque omni substantia agente inuidia ab incolis pellitur: pulsus apud puteum iuramenti consedit. 
1.8.3	igitur annis grauior, luminibus obductis, cum Esau filium benedicere pararet, consilio Rebeccae matris Iacob se benedicendum pro fratre obtulit. ita Iacob adorandus principibus et gentibus fratri praeponitur. 
1.8.4	quis rebus Esau accensus fratri necem moliebatur. quo metu Iacob hortante matre in Mesopotamiam confugit, admonitus a patre ut ex domo Laban, fratris Rebeccae, uxorem acciperet: tanta illis cura fuit, cum in alienis terris 7 Gen. 25. 8 I Paral. 1, 32. 13 Gen. 25. 19 Gen. 26. 23Gen.27. 28 Gen. 28. 1 is P: eum b 2 exequerentur b 5 Nahore b 7 Ceturam Drusius 8 paralipomenonis concnbina edicitur P 12 sepulcro P, sed ead. m . sepulchro corr . 15 Domini b 16 minoris Barthius: minori Pb 17 setis Pb 19 incesserat P: terras incesserat b \\I Gerara Sigonius 20 concessit malebat Vorstius 25 se b: om. P 27 queis b 29 amonitus P consisterent, genus tamen intra familiam suam ducere. 
1.8.5	ita Iacob profectus in Mesopotamiam, per soporem Dominum uidisse traditur: atque ob id locum somnii sacratum habens, lapidem ex eo sumpsit: uouitque, si rebus prosperis reuertisset, titulum sibi domus Dei futurum decimasque omnium, quae adquisita sibi forent, Deo daturum. 
1.8.6	inde se ad Laban fratrem matris contulit: quem ille sororis filium agnitum in hospitium benigne recepit. 
1.9.1	 Erant Laban duae filiae, Lia et Rachel: sed Lia oculis deformior, Rachel pulchra traditur. cuius specie Iacob captus amore uirginis conflagrabat, eamque sibi in matrimonio a patre postulans septem annorum seruitio se mancipauit. 
1.9.2	sed impleto tempore, Lia ei supponitur: ac rursum septennii seruitio subditur, atque ei Rachel traditur. sed hanc diu sterilem, Liam fecundam fuisse accepimus. 
1.9.3	filiorum, quos ex Lia Iacob habuit, haec sunt nomina: Ruben, Symeon, Leui, ludas, Isachar, Zabulon, Dina: ex ancilla uero Liae Gad et Aser, ex ancilla Rachel Dan et Nephtalin nati sunt. at Rachel desperata iam partitudine Ioseph edidit. 
1.9.4	 tum Iacob redire ad patrem cupiens, cum ei Laban socer partem pecorum mercedem seruitii dedisset, obque id parum sibi eum aequum gener Iacob ratus, dolum ab eo suspectans, clam profectus est uigesimopostfereanno , quam aduenerat. Rachel uiro inscio patris idola furto abstulit: qua iniuria Laban generum persecutus, non repertis idolis, pace facta regressus est, multum obtestatus generum, ne uxores filiabus suis superduceret. 
1.9.5	inde digressus Iacob uidisse angelos et castra Dei traditur. sed cum 6 Gen. 29. 15 Gen. 29. 30. 18 Gen. 31. 24 Gen. 32. 33. 1 suam in P deesse falso tradidit de Prato 4 properis P 5 domfi P, addita s sup . 11 ead. manu II dei P, ut coni. Drusius: Domini b\' 6 Domino b 9 pulchra P: pulchra fuisse b 10 in matrimonium Vorstius coil. I, 11. 34. 35; at cf. I, 43 11 mancipatil P 12 septennii P, ut coni. G. Fabricius: septem in b 15 Symeon P: Simeon edd. cf. LXX 16 lię P, ut coni. Giselinus: hae b II neptalin Pb 17 desperato iam partu b 19 in mercedem malebat Vonck j) obque id P: ob quae b 20 gener Iacob glossema uidetur 21 p\' (i. e . post) P: primo b || uiro 6: uero P 23 pace facta b: patefacta P 24 obtestus P II superduceret de Prato: perduceret P, superinduceret b; cf. Capitolini Anton. phil. c. 29 extr . ne tot liberis superduccret nouercam, Sulp. Viet. inst. rhet. 36 (Rhett. lat. p . 333 ed. Lips.) nouercam filio superduxit 25 Domini b praeter regionem Edom, quam Esau frater incolebat, iter destinaret, missis prius legatis et muneribus suspectum sibi fratrem explorauit. tum ille obuiam fratri processit: nec tamen Iacob se ultra fratri credidit. 
1.9.6	sed pridie, quam inter se fratres conuenirent, Deus humana specie assumpta, colluctatus cum Iacob refertur. et cum aduersus Deum praeualuisset, tamen non esse mortalem non ignorauit: benedici se ab eo flagitabat. 
1.9.7	tum a Deo ei immutatum nomen est, ut ex Iacob Israel diceretur. sed cum ille uicissim a Deo nomen Dei quaereret, non esse quaerendum, quia admirabile esset, responsum. ex colluctatione autem latitudo feminis Iacob obtorpuit. 
1.10.1	Igitur Israel declinans fratris domum, promouit agmen in Salem Sicimorum oppidum, atque ibi loco pretio accepto tabernaculum statuit sibi. huic oppido Emor, Chorraeus princeps, praeferat. 
1.10.2	huius filius Sychem Dinam filiam Iacob ex Lia genitam stupro subdidit. quo comperto Symeon et Leui, Dinae fratres, omnes in oppido sexus uirilis dolo peremerunt atque impigre sororis ulti iniuriam : oppidum a filiis Iacob direptum praedaque omnis abducta. id factum aegre admodum tulisse Iacob traditur. 
1.10.3	 mox a Deo monitus Bethel petiit ibique altarium Deo statuit. inde in parte turris Gader tabernaculum fixit. Rachel ex partu obiit: puer Beniamin uocatus est. Isaac decessit annos natus centum et octoginta. 
1.10.4	at Esau potens diuitiis erat, uxoribus sibi etiam e Chananaeorum gente assumptis: cuius progeniem in hoc tam praeciso opere inserendam non putaui. si quis studiosior erit, ad originem reuertatur. 
1.10.5	post excessum patris Iacob in solo eo, in quo 12 Gen. 33. 16 Gen. 34. 20 Gon. 35. 22 Gen. 36. 3 fratri Vonchio glossa uidetur 5 Dominus b II asumpta P 6 Dominum b 7 ignorans Fabricius; contra de Prato malebat ideoque benedici uel et ben. II se P: sibi b II a Deo b: abeo Pilei P: illi b 9 a Domino nomen Domini b 10 responsum est b 11 femoris b 14 Chorreus Sigonius : chorrens P (rrens in rasura, sed prima m. ita scriptum): Chemo- reus b; LXX in Gen. 34, 2: \' Εμμὼρ ὁ Εὐαιος , ὁ ἄρχ a ωυ τής τής cf. tamen de Prato ad h. l . 15 Sichem b, at cf. LXX 16 Simeon edd . 17 atq. nos: at P, ac b 18 ulti sunt b 19 est abducta b 20 Domino b II Bethel Drwrius: Bethleem Pb; cf. Genes . 35 II altare Domino b 23 octaginta P II diuitiis b: diuinitus P 24 chananeorum gentS P 25 miserendam P 26 originem P: origines b Isaac uixerat, commorabatur. filii eius aliquando ab eo pascui gratia cum gregibus secesserunt, Ioseph tamen et Beniamin paruus domi resederant. 
1.10.6	carus admodum Ioseph patri obque id inuisus fratribus, simul quia frequentibus eius somniis maiorem eum omnibus futurum portendi uidebatur. igitur ad inspiciendos greges reuisendosque fratres a patre missus oportunus iniuriae fuit. namque uiso fratre consilium necis eius ceperunt. 
1.10.7	sed obsistente Ruben, cui a tanto facinore abhorrebat animus, in lacum demissus: mox suadente Iuda deducti ad mitius consilium negotiatoribus eum, qui tum Aegyptum petebant, uendiderunt. atque ab his Petefrae, praeposito Pharaonis, traditus est. 
1.11.1	 Per idem tempus ludas, Iacob filius, Sauam Chananaeam in matrimonium assumpsit. ex qua tres filios sustulit, Her, Onan, Selam. sed Her Thamar concubio sociatur. quo mortuo Onan fratris uxorem accepit: qui, quia spermata in terram effunderet, extinctus a Deo refertur. 
1.11.2	tum Thamar meretricio habitu assumpto socero mixta est, exque eo geminos edidit. 
1.11.3	in partu autem illo mirabile fuit, quod cum prodeunti puero, ad dinoscendum qui prius nasceretur, obstetrix manum eius cocco illigasset, reductus in aluum matris puer posterior editus est. nomen infantibus Pares et Zara inditum. 
1.11.4	at Ioseph, cum benigne a curatore regio, qui eum pretio acceperat, haberetur domumque eius et familiam procuraret, decorus ipse insigni specie uxoris domini oculos in se conuerterat. cumque amore turpi deperiret, appetitum saepius nec adquiescentem sibi falso scelere infamat, ac uiro queritur stuprum sibi intentatum. ita Ioseph in carcerem coniectus. erant in 2 Gen. 37. 12 Gen. 38. 20 Gen. 39. 26 Gen. 40. 1 aliquando nos: aliquanto P, aliquantum b 2 cum] oum P II seces- serant b II et P: ac b 6 opportunus b 7 coeperunt P llpetefre P Potifari b; illud reponendum esse docuit de Prato coll. LXX atque Hieronymo in Quaestt. hebr. etAuguat. in Quaestt. in Gen . 1\\ praeposito coquorum Phar. coni. de Prato cum LXX et Aug. Q. in Gen . 77 12 Sanam Drusius: suam Pb, cf. LXX et August. Q. 128 in Gen . II chananeam P 13 Ἤρ , Avvav, ∑ ηλὼμ LXX 14 concubio P: connubio b 15 quia spermata b: qui afer uasta P 16 a Domino b 17 illud malebat de Prato, ac paulo post prodeunte 20 posterior edituR Drusius: postero die reductus P, postero die editus b 23 decorfls P 24 turpi P: ipsius b 26 est coniectus b II erant P ead. m. ex irati corr . eadem custodia ministri regii duo: 
1.11.5	qui cum somnia sua ad Ioseph retulissent, futura ex somnio coniectans, unum eorum poenas capite luiturum, alium absoluendum pronuntiauit. atque ita accidit. igitur post biennium somnium regi obiectum est. 
1.11.6	quod cum a prudentibus Aegyptiorum non posset absolui, minister regis ille carcere exemptus regem admonet, Ioseph esse mirum somniorum interpretem. 
1.11.7	ita Ioseph soluitur interpretatusque est regi somnium: septem annis proximis maximam frugum ubertatem futuram, consequentibus inopiam. quo metu rex perculsus, uidens diuinum in Ioseph spiritum, rei eum annonariae praefecit, aequato secum imperio. 
1.11.8	tum Ioseph abundantibus per totam Aegyptum frumentis magnam copiam congessit: multiplicatisque horreis aduersus futuram famem consuluerat. ea tempestate spes atque salus Aegypti in illo sita erat. 
1.11.9	per idem tempus duos ex Asenet filios genuit, Manassen et Ephraem: ipse autem, cum summam a rege potestatem accepit, erat annorum xxx: nam a fratribus septem decem annos natus uenundatus est. 
1.12.1	Interea rebus in Aegypto aduersus famem bene compositis, orbem terrae grauis frumenti inopia quatiebat. qua necessitate compulsus Iaeob filios in Aegyptum misit, Beniamin tantum secum domi retento. 
1.12.2	igitur Ioseph rerum potentem, penes quem annonae arbitrium erat, fratres adeunt et more regio adorant. quibus ille uisis callide agnitionem dissimulans, hostiliter eos uenisse et subdole loca explorare arguebat. 
1.12.3	angebatur autem, quod Beniamin fratrem non uidebat. res ergo in id deducitur, ut praesentiam eius pollicerentur, nimirum ut ex eo quaereretur, an isti explorandi causa Aegyptum intrassent. ad promissi autem fidem Symeon obses traditur: ipsis frumentum gratis datum. rursum igitur reuertentes Beniamin, ut conuenerat, deduxerunt. 
1.12.4	tum se , cognoscendum Ioseph fratribus praebuit, non sine pudore male merentium. ita eos oneratos frumento multisque donatos domum 3 Gen. 41. 19 Gen. 42. 28 Gen. 43-45. 1 regii nos: regio P, regis b 2 peonas p . 13 consulerat P 14 erat b: est P 1\\ tempus P: tempus vero b 1\\ Asenec Pb 15 Manassem b \\I effi-em Pb 16 septemdecim b 21 Ioseph Pb: casu excidit in edd. plerisque 23 agnicionem P 25 deducitur P: deducta b 28 Simeon edd . remisit, praemonens quinque adhuc annos famem futuram: cum patre atque omni progenie et familia commigrarent. 
