1.44.4	et cum iam omnium desperata esset salus, propheta a Deo missus regem adit, hortatur ut in proelium exeat, cunctantem multis confirmat. ita eruptione facta fusi hostes copiosaque praeda reperta. 
1.44.5	 sed post annum reparatis uiribus Syrus in Samariam regressus, acceptam cladem ultum ire cupiens, rursum uictus est. eo proelio cxx milia Syrorum interiere: regi uenia data, regnum ei et pristinus status concessus. 
1.44.6	tum Achab uerbis Dei a propheta increpitus, cur abusus diuino munere hosti sibi tradito pepercisset. igitur Syrus post triennium bellum Hebraeis intulit. aduersum hunc Achab pseudoprophetarum impulsu in proelium descendit, spreto Michea propheta et in uincula coniecto, cur ei exitiabilem fore pugnam denuntiasset. ita eo proelio Achab interfectus, Ochoziae filio imperium reliquit. 
1.45.1	Is aeger corpore cum ex ministris, qui idolum pro salute eius consulerent, misisset, Elias a Deo monitus obuiam se eis optulit increpitosque renuntiare regi iubet, mortem eius consecuturam. 
1.45.2	tum rex comprehendi eum ac deduci ad se iubet, sed missi caelesti igne absumpti. rex, ut propheta praedixerat, obiit. successit autem Ioram ei frater eius: isque duodecim annis imperium potitus est. at in parte duarum tribuum Iosaphat rege defuncto Ioram filius regnum tenuit annos duodeuiginti. is Achab filiam uxorem habuit, socero quam patri propior. 
1.45.3	post hunc Ochozias filius imperium adeptus est. hoc regnante Elias translatus refertur. eodem tempore Helisaeus, discipulus eius, multis signis potens extitit: quae omnia notiora sunt quam ut stilo egeant. 
1.45.4	ab eo uiduae filius 14 III Reg. 22. 19 IV Reg. 1. 28 IV Reg. 2. sqq. 2 cam rege orbem b 3 artis P, ut coni . Druaius: actis b; cf. b 23, 2. II, 16,1 4 et argentom b 6 a Domino b 16 Michaea b tt cur P: quod b 21 consecuram P, conBequuturam b 24 imperium P: imperio b 25 iora (pro iora) P 26 annos VIII Sigonius 28 ademptus P 29 heliseuB P, Eliseus b 30 stiio P: nostro stylo b II ab eo P: ab eo eat b .. resuscitatus, vel Syrus lepra purgatus, uel famis tempore omnium rerum copia fugatis hostibus inuecta, uel in usum trium exercituum aquae praebitae, uel de exiguo olei inmodicis incrementis solutum mulieris debitum et ipsi sufficiens uiuendi substantia data. 
1.45.5	huius temporibus, ut diximus, Ochozias duarum tribuum erat rex, decem uero loram, ut supra retulimus, imperabat: interque eos foedus ictum. nam et aduersum Syros iunctis uiribus bellatum, et aduersum leu , qui per prophetam in regem decem tribuum unctus fuerat, pariter in proelium egressi eadem pugna interiere. 
1.46.1	 Sed regnum Ioram Ieu tenuit. postOchoziam in Iudaea regem, qui uno anno regnauit, mater eius Gotholia imperium occupauit, adempto nepoti imperio, etiam tum paruo puero, cui Ioas nomen fuit. sed huic ab auia praereptum imperium post octo fere annos per sacerdotes et populum depulsa auia redditum. 
1.46.2	hic initio regni obseruantissimus diuini cultus fuit magnisque sumptibus templum exomauit: post adulatione principum deprauatus adoratusque ab eis iram meruit. namque ei Azahel rex Syriae bellum intulit: inclinatisque rebus suis auro templi pacem redemit. nec tamen ea potitus est, facti inuidia a suis interfectus anno imperii quadragesimo. huic Amassia filius successit. 
1.46.8	at in parte decem tribuum defuncto Ieu Ioachas filius eius regnauit, inuisus Deo malis operibus, ob quae regnum eius Syris praedae fuit, donec Dei misericordia depulsis hostibus pristinum habere statum coeperunt. 
1.46.4	Ioachas diem functus Ioae filio reliquit regnum. is Amassiae regi duarum tribuum ciuile bellum intulit: uictoriam potitus multam praedam in regnum suum conuertit. id Amassiae ob delictum 10 IV Reg. 9. 13 IV Reg. 11. 20 IV Rcg. 13. 23 IV Reg. 14. II Par. 23. 26 II Par. 25. 1 resuscitatus b: om. P II uel quater P (scil . f, non et, ut ait de Prato): om. b; cf. Ind. uerb . 3 aquae praebitae b: aquis praebitis P 7 aduersus Syros b 8 ieu P (ut ex LXX\'Irjov coni. Drusius): Jehu b, et sic deinceps 10 post Ochoziam in I. regem G. Bichter: posito Ochozia (ochozozia P) in Judaea (iudea P) rege Pb 14 sacerdotes P: sacerdotem b; cf. 1, 50, 1 15 diuni P 16 post adulationem Pb, em. Giselinus 17 iram P: Dei iram b; cf . Chron. II, 24,18: et facta est ira contra Judam et Jerusalem II Hazael Drusius 20 Amessia (uel Amesaias) Dru- sim 22 ob que in regnum eius siris praeda fuit P, tn in b 24 Joae de Prato: Johae Pb 24 amessiae P 25 uictoriam P: uictoriaque b 26 id nos: is P, idque b j) ob Amassiae b accidisse traditur, siquidem Idumaeorum fines uictor ingressus idola gentis eius assumpserat. 
1.46.5	hic nouem annos regnasse scribitur, quantum in libris Regnorum repperi. Sed in Paralipomenis atque etiam in Chronicis nouem et uiginti annos imperium tenuisse annotatus est, ea nimirum id persuadente ratione, quae in his [Regnorum] libris facile perspici potest. Ieroboam enim rex decem tribuum octauo anno imperii Amassiae traditur regnare coepisse unumque et quadraginta annos imperium tenuisse: regnante demum Ozia, Amassiae filio, quarto imperii eius anno esse defunctus. 
1.46.6	qua ratione xx et VIIII annos regi Amassiae effecit. itaque nos hoc ipsum secuti, quia rationem temporum persequi placet, Chronicoram auctoritati accessimus. 
1.47.1	Igitur Amassiae Ozias filius successit. nam in parte decem tribuum Ioas diem functus Ieroboae filio locum fecerat, postque hunc Zacharias filius eius regnauit. 
1.47.2	horum nos regum omniumque, qui in parte decem tribuum Samariae praefuerunt, annotanda esse tempora non putauimus, quia breuitati studentes superflua omisimus, et ad cognitionem temporum eius potissimum partis annos credidimus persequendos, quae in captiuitatem posterius abducta prolixius tempus in regno habuit. 
1.47.3	igitur Ozias regnum Iudae, adeptus praecipuam curam Domini cognoscendi habuit, Zacharia . propheta plurimum usus: (Isaias etiam sub hoc primum prophetasse traditur) quo merito prosperis euentibus aduersum finitimos bella gessit, Arabas etiam deuicit. 
1.47.4	iamque Aegyptum terrore nominis sui concusserat, elatusque secundis rebus, illicita praesumens, incensum Deo obtulit, quod solis facere sacerdotibus mos erat. itaque per Azariam sacerdotem increpitus cum loco decedere 13 IV Reg. 15. 20 n Par. 26. 2 nouem] immo xxvnir, ut libri etiam IV Reg. 14, 2 habent; cf. de Prato ad h. I . 5 aimotatas est. Ea P: annotatum est. Et b 6 regnormn] Chronicorum de Prato, nos regnorum inclusimus II Jeroboam P, ut coni. Hornius: Joram b 7 octauo] xviii de Prato cum Eusebio (xv Reg. IV, 14, 23) 9 quarto] at u. de Prato II esse defonctas P: defanctas est b 10 efficit (scil. Eusebius in ahron.) coni. de Prato 12 auctoritate P 13 Ozias (ut est infra) de Prato: Otia Pb 14 ieroboae P: Joram b 15 eius filius b 19 credimus Pb, em. de Prato 22 Esaias b 23 enntibuB P II adaersus b 26 mos P: fas b 27 cum nos: com P (Itaque cum per A. — eo loco b) 4 cogeretur atque in iram exarsisset, lepra oppletus decessit. quo morbo affectus uita functus est, cum regnasset annos duo et quinquaginta. 
1.47.5	regnum inde Ioathae filio datum: isque admodum sanctus fuisse traditur prospereque imperium administrauit: gentem Ammonitarum bello uictam stipendium praestare coegit. regnauit autem annis xvi eidemque Achaz filius successit. 
1.48.1	 Celebris circa haec tempora Niniuitarum fides traditur. id oppidum olim ab Assure, Sem filio, conditum caput regni Assyriorum fuit, frequens tum incolentium multitudine, alens uirorum milia c et xx atque ut in magno populo abundans uitiis. 
1.48.2	\' quia Deus motus Ionam prophetam ex Iudaea ire praecepit ac denuntiare urbi excidium, sicut olim Sodoma et Gomorra diuinis ignibus conflagrassent. 
1.48.8	uerum propheta praedicationis istius ministerium detrectans, non contumacia, sed praescientia, qua uidebat Deum paenitentia populi placandum, nauim, quae longe diuersa regione Tharsos petebat, conscendit. 
1.48.4	sed ubi in altum processum, nautae saeuitia maris compulsi, quisnam esset mali causa, sorte exploranare . cum super Ionam sors decidisset, tamquam piaculum tempestatis in profundum proiectus est: exceptusque a ceto [marino monstro] ac deuoratus, post triduum fere Niniuitarum litoribus eiectus iussa praedicat, urbem scilicet ob peccata populi triduo perituram. igitur non dissimulanter, ut olim Sodomis,. 
1.48.5	audita est uox prophetae: ac statim iussu regis exemploque populus uniuersus, quin et recens nati cibo potuque abstinentur: iumenta itidem et diuersi generis animalia compulsa fame ac siti lamentantium speciem cum hominibus praebebant. 
1.48.6	ita imminens malum auersum. Ionae apud Deum conquerenti, quod fides dictis non affuisset, responsum, paenitentibus ueniam negari non posse. 
1.49.1	 At in Samaria Zachariam regem admodum impium, quem superius regnasse memorauimus, Sella quidam interemit 1 IV Reg. 15. 7 Jon. 1 sqq. 29 IV Reg. 15. 2 duos b 4 ammanitanim P 6 azhaz P 7 id] in P 8 assure P: Assur b n Sem DrumtM: Seon Pb; cf. Genes. 10, 22 10 oitiis b: diuitiia P II queis b 12 Gomorrha b 14 Dominum b 16 Tharsis Drusim, ut LXX ii, Θαρσ l ς 19 coeto P II marino monstro obelo notauit Vonck 23 at statim malebat de Prato 24 abstinentur P: abstinere iubentur b 28 negare P 29 samariã P 30 Sella] ∑ ελλούμ LXX in Reg. 4, 15, 10 regnumque occupauit: idemque Mane insidiis exemplo facti sui periit. Mane ereptum Sellae imperium tenuit filioque Pachae reliquit. 
1.49.2	 eundem uero Paehe quidam eiusdem nominis interemit regnumque occupauit. mox ab Osee peremptus eodem scelere quo assumpserat imperium amisit. 
1.49.3	hic ultra omnes reges superiores impius poenam sibi perpetuamque genti captiuitatem a Deo meruit. namque ei Salmanassar rex Assyriorum intulit bellum uictumque tributarium sibi effecit. 
1.49.4	sed cum occultis consiliis rebellionem pararet regemque Aethiopum, qui tum Aegyptum optinebat, in auxilium arcesseret idque Salmanassar comperisset, perpetuis eum uinculis in carcerem coniecit urbemque excidit, populum uniuersum in regnum suum abduxit, Assyriis in hostili solo ad custodiam positis. exinde ea pars Samaria appellata, quod lingua Assyriorum custodes Samaritas uocant. ex quibus plerique diuinas caeremonias receperunt, reliquis in errore gentilitatis perseuerantibus. 
1.49.5	hoc bello Tobias in captiuitatem ductus est. at in parte duarum tribuum rex Achaz ob impietatem inuisus Deo, cum finitimorum bellis saepe premeretur, deos gentium colere decreuit, nimirum quia eorum auxilio uictoresfrequentibus proeliis extitissent. ita in hoc nefariae mentis piaculo diem functus est, cum xvi annis in regno fuisset. 
1.50.1	Huic Ezechias filius successit, multum paterni dissimilis ingenii. namque initio regni populum sacerdotesque ad Dei cultum cohortatus multis disseruit, ut frequenter castigati a Domino saepius essent misericordiam consecuti, ut postremum decem tribus in captiuitatem nuper abductae sacrilegii poenas dissoluerent: curandum eis sedulo ne eadem pati mererentur. 
1.50.2	ita conuersis ad religionem omnium animis Leuitas sacerdotesque omnes ad celebranda secundum legem sacrificia ordinauit celebrarique Pascha instituit, quod iam pridem fuerat omissum. 
1.50.8	cumque dies festus 21 IV Reg. 18. II Par. 29. 28 II Par. 80. 1 mane P, ut coni. G. Richter: Manae b, Μα v αήμ LXX p perit b 3 pacbę P: Pache b; in LXX dicitur (IVReg. 15,22) Φα x ε l ας 7 et 10 Salmanassar Pb: Salmanasser edd. recentt . 9 accerseret b 13 quot P 16 AcbasPb, em. dePrato, ut est in LXX et supra c. 47 18 auxilio P: ille (illae edd. seqq.) auxilio b 19 nephariae b 21 Ezecias Drusius 24 consequuti b 25 obducte P 26 mererentur nos: merentur P, mereantur b 28 aacrificia b: sacrilegia P 4* adesset, dimissis per omnem terram nuntiis conuentus diem edixit: ut si qui post abductionem decem tribuum inSamaria resedissent, ad sollemne sacrum conuenirent. ita frequentissimo conuentu dies sacer publica laetitia exactus, longo post interuallo religione legitima per Ezechiam restituta. 
1.50.4	pari deinde industria, qua diuina curauerat, rem bellicam administrauit, Allophylosque frequentibus proeliis contudit: donec ei Sennacherim rex Assyriorum bellum intulit, magno cum exercitu fines eius ingressus, lateque agris uastatis nullo obsistente urbis obsidionem urgebat: Ezechias enim multitudine inferior, non ausus manum conserere, muris se tuebatur. 
1.50.5	rex Assyrius portis assultans mimtan excidium, deditionem imperare: Ezechiam frustraDeo confidere, seDei nutu potius arma sumpsisse: uictorem omnium gentium, euersorem Samariae effugi non posse, ni matura deditione sibimet consuluissent. 
1.50.6	in hoc rerum statu Ezechias Deo fretus Isaiam prophetam consulit, eiusque responso edocetur, nihil ex hoste periculi fore, diuinum autem auxilium non defuturum. nec multo post Tarraca rex Aethiopum regnum Assyriorum inuadit. 
1.51.1	 Quo nuntio Sennacherim ad sua tuenda conuersus, fremens et clamitans uictori sibi uictoriam eripi, bellum omisit, missis ad Ezechiam litteris cum uerborum contumeliis denuntians, se paulo post rebus domi compositis ad excidiumludaeaemature rediturum 
1.51.2	 sed nihil his Ezechias motus orasse Deum traditur, ne hanc tantam hominis insolentiam inultam sineret. ita eadem nocte angelus castra Assyriorum aggressus multa hominum milia leto dedit. rex trepidus in oppidum Niniuem confugit ibique a filiis interfectus dignum se exitum tulit. 
1.51.3	per idem tempus Ezechias aeger corpore morbo incubuerat. cumque Isaias ei uerbis Domini annuntiasset 6 IV Reg. 1. II Par. 31. Esai. 36. 13 EsaL 37. 17 IV Reg. 19 27 IV Reg. 20. Esai. 38. 3 solemne b .7 sennacherim P (ut est in LXX ∑ ευ v αχηρε l μ ): Sens nacherib b, item infra 9 etechias P (litterae t et z in P persmiles sunt) 11 excidum P 13 stlpsisse P, ut coni. Sigonim: srcppreasigse b 15 Esaiam b 16 fore b: fere P 17 tarraca (addito in extrema a apict) P: Tirchac b; in LXX estGagaxa 22 domi compositis b: cd domi positis P II reditum P 23 Dominum b 24 insolenteram P (syTlaba ter per compendium) 25 loeta P, letho b 26 Niniuen b 27 exitum P et Brusius: exitium b 28 esaias hic P || nerbis P, ut coni. dePrato: uerbum b uitae eius finem adesse, flesse rex traditur: ita xv annos prorogari sibi ad uitam meruit. 
1.51.4	quibus peractis nono et uigesimo imperii anno decessit: regnum Manasse filio reliquit. is a patre multum degenerans relicto Deo culturas impias exercuit: ob quod in potestatem Assyriorum traditus malo coactus agnouit errorem, populumque adhortatus est ut relictis idolis Deum colerent. nihil sane dignum memoria gessit, regnauit autem annos v et L. 
1.51.5	Amos deinde filius eius regnum indeptus est, nec ultra biennium eo potitus -est: paternae impietatis heres, Dei neglegens, suorum insidiis circumuentus periit. 
1.52.1	Ad Iosiam filium imperium deuolutum. is admodum religiosus fuisse traditur summaque cura diuina administrasse, Helchia sacerdote usus bene. 
1.52.2	is cum in templo librum, uerbis Dei scriptum, repertum a sacerdote legisset, quo continebatur Hebraeam gentem ob crebras impietates et sacrilegia delendam, piis ad Deum precibus fletuque iugi imminentem cladem auertit. 
1.52.3	quod ubi indultum . sibi per Oldam prophetissam comperit, maiore cura, utpote obligatus diurnis beneficiis, cultum Dei exercuit. igitur uasa omnia, anteriorum regum superstitionibus idolis consecrata, cremauit. namque eo profani ritus inualuerant, ut soli ac lunae diuinos honores darent eisdemque etiam ex metallis sacraria aedificarent. 
1.52.4	 quibus Iosias in puluerem redactis sacerdotes quoque profanarum aedium interfecit. sed ne sepulchris quidem impiorum pepercit, quod olim praedictum a propheta, impletum animaduersum est. huius octauo et decimo imperii anno Pascha celebratum. 
1.52.5	post triennium fere aduersusNechao regem Aegypti, qui bellum Assyriis inferebat, in proelium egressus, priusquam inter se acies concurrerent, sagitta ictus est. exque eo uulnere in urbem relatus decessit, cum regnasset annos unum et uiginti. 3 II Reg. 21. 6 IV Reg. 22. 11 IV Reg. 22 sq. 25 II Par. 35. 2 merrmt P 3 Manassae Giselinus 4 Domino b II impotestatem P 6 Dominum b 7 amos P: Amon b 8 indeptus P: adeptus b 9 Domini negligens b 12 Helchia Pb; in LXX dicitur Xflxtag 13 uerbis P: uerbi b 17 Oldam Drusius: Ollam Pb; in LXX estvOXia, in Vulg . Holda II utpote b: ut puta P II oblegatus P 19 idoli P 20 diunos P 23 ne pulchris quidem P 26 triennium] cf. de Prato 29 annos I et XXX Vorstius coll. IV Beg. 22,1 
1.53.1	 Ioachas inde filius eius regnum indeptus tribus mensibus tenuit, captiuitati ob impietatem destinatus. namque eum Nechao rex Aegypti uinctum captumque duxit, nec multo post in uinculis diem functus est. 
1.53.2	Iudaeis stipendium annuum imperatum, rex eis Eliacim arbitrio uictoris datus, qui postea immutato nomine loachim uocitatus est. hic Ioachae frater, Iosiae filius fuit, fratri quam patri propior, sacrilegio inuisus Deo. 
1.53.8	igitur cum regi Aegyptio pareret, quippe cui tributum penderet, Nabuchodonosor rex Babylonius Iudaeam terram occupauit armis et per triennium iure belli uictor possedit. etenim cedente iam rege Aegypti determinatiBque inter eos imperii finibus conuenerat Iudaeos ad Babylonam pertinere. 
1.53.4	ita cum Ioachim, exactis in regno annis undecim, filio eiusdem nominis locum fecisset isque regis Babylonii in se iram concitasset, Deo nimirum agente, cui constitutum erat Iudaeam gentem captiuitati et internecioni dare, Nabuchodonosor Hierosolymam cum exercitu ingressus urbem murosque ac templum solo strauit: auri inmensum modum et sacra ornamenta uel publica uel privata, puberesque omnes uirilis ac muliebris sexus transtulit, relictis, quorum imbecillitas aut aetas fastidio uictoribus fuit. quae turba inutilis seruitio exercendis colendisque agris, ne incultum esset solum, deputata. 
1.53.5	eisdemque rex Sedechias praepositus, ademptis uiribus inani tantum umbra regii nominis concessa. sed Ioachim tribus mensibus tempus imperii habuit. 
1.53.6	is cum populo Babylonam translatus et in carcerem coniectus: trigesimum post annum emissus atque a rege in amicitiam receptus mensaque et consiliis participatus, non sine solacio depulsae calamitatis decessit. 2 IV Reg. 23. 11 IV Reg. 24. 21 IV Reg. 25. 1 adeptus b 2 impięta.te P 3 uictum de Prato coll. Ezech. 19, 2 sq., item Vonck 5 Eliachim Pb, em. de Prato 6 Joachis Pb, em. Vorstius cf. II, 1, 2 (Joacim Sigonius) II ioachae frater iosiae fllios P, ut coni. Drusius: Joachae fratris Josiae f. b 9 babilonius P 11 ba- bilbnam P 12 Joachis Pb, itern infra u. 23 . 13 eiusdem nominis] cf. de Prato 15 internetioni P II hierusolimam P 17 uel-uel] sic P, non et—et, ut ait de Prato 18 mulieris P 20 agris b: om. P, fort . eIereendis agris colendisque II incultu P 21 Sedecias Drusius cum LXX ∑ εδε xl ας 24 babiloham P II coniectus eat b II tricesimum septimum Sigonius, cf. IV Eeg. 25, 27 26 solatio Pb 
1.54.1	Interea Sedechias rex turbae inutilis, quamquam sine uiribus, infido ingenio et Dei immemor, qui non intellegeret captiuitatem ob delicta gentis illatam, postremis denique malis debitus, regis animum offendit. ita ei post nouem annos Nabuchodonosor bellum intulit, compulsumque intra muros confugere triennio obsedit. 
1.54.2	 qua tempestate Hieremiam prophetam, qui iam saepius imminere urbi captiuitatem pronuntiauerat, consulit, si quid spei forsitan superesset. sed ille caelestis irae non ignarus, eadem saepius interrogatus, respondit, ipsi regi specialem poenam denuntians. 
1.54.8	 tum uero Sedechias in iram excitatus trudi prophetam in carcerem iubet: moxque eum crudelis facti piguit, sed obsistentibus Iudaeorum principibus, quibus iam inde a principio moris fuerat bonos premere, absoluere innocentem non- ausus. 
1.54.4	isdem cogentibus in lacum inmensi profundi caenoque ac sordibus atque ex eo exitiabili foetore horridum demissus est, ut ne simplici quidem morte exspiraret. sedrex licet impius, aliquanto tamen sacerdotibus mitior, educi prophetam de lacu et carceris custodiae reddi iubet. 
1.54.5	interea obsessos uis hostium et penuria urgebat, consumptisque omnibus, quae mandi poterant, fames inualuerat: ita defessis inedia defensoribus oppidum captum incensumque. rex, ut propheta dixerat, effossis oculis Babylonam translatus, Hieremias misericordia hostili carcere exemptus. 
1.54.6	cum eum Nabuzardan, princeps regius, captiuum cum ceteris duceret, delata sibi optione ab eo, utrum in solo patrio deserto desolatoque subsistere an secum abire in summis honoribus uellet, residere in patria maluit. 
1.54.7	Nabuchodonosor abducto populo, residuis quos belli conditio uel praedae fastidium relinqui a uictoribus fecerat, Godoliam eiusdem gentis praeposuit absque ullo insigni regio aut imperii nomine, quia praeesse paucis et calamitosis nulla dignitas erat. 10 Jer. 37 sqq. 13 IV Reg. 25. H Par. 36. 4 nouem b: nn. P, cf. IV Reg. 25,1 . 6 Jeremiam b II qaiaam saepius P 7 consuluit malebat de Prato 10 carcere P 13 non est ausus b II hiedem P 14 coenoque b 16 principibus mitior Vorstius coni . 19 famia P 21 babilonam P 22 Nabuzardan Pb: Nebuzardan aliquot editt. posteriores 26 uel] sic P, non et, ut ait de Prato II relinqui P, ut coni. Oiselintu et Sigonius: reliqui b 28 praeesee] pracee P (pro praeêê) 29 erat. EXPLICIT SACROBV CHRONICORV LIBER PRIMVS. INCIPIT SECVNDVS . LEGE FELICITER . P . 
2.1.1	 Captiuitatis tempora prophetarum uaticiniis atque actibus illustrata sunt, maximeque Danielis egregia ad conseruandam legem perseuerantia et in absolutione Susannae diuino consilio ceterisque ab eo gestis, quae iam ordine persequemur. 
2.1.2	hic sub rege Ioachim captus deductusque Babylonam paruus admodum puer: postea ob elegantiam uultus inter ministros regios assumptus, unaque cum eo Annanias, Misael et Azarias. 
2.1.3	sed cum eos rex delicatioribus cibis curari praecepisset idque Asphanae eunucho negotii dedisset, Daniel paternarum traditionum memor, ne ex mensa regis gentilium cibis participaret, poposcit ab eunucho, ut leguminibus tantum uterentur. 
2.1.4	causante Asphane, ne dissimulatum imperium regis consecutura macies proderet, Daniel Deo fretus pollicetur maioris decoris sibi [uultus ex:leguminibus quam ex cibis regiis fore. fidesque dictis affuit, ita ut minime eorum uultus comparabiles haberentur, qui imperialibus impendiis procurabantur . igitur a rege in honorem et gratiam adhibiti prudentia et 7 Dan. 1. 2 egregiam — perseuerantiara P, em. de Prato (Maiime itaque Danielis egregiam ad c. 1. perseuerantiam, et in abaolutionem S. diuino consilio, caeteraque ab eo gesta ordine persequemur b) 3 absolutionS P, em. Hofmeister et de Prato 11 suBsanne P 4 quae iam ordine scripsi: quae in ordine P 5 Joacim Sigonius 11 babalonam P 6 eligantiam P 7 Ananias b, item infra c . 3 8 delicatoribus P 11 asphane eununcho P 9 patriarum Sigonius, at u. II, 12, 6 II memo. ne P 11 uescerentur Sigonius II asphanen P 13 maius P 16 in honorem et gratiam nos: in honore et gratia (sed gratia ex gratiS raswra faetum) P, in honore et gratia b disciplina breui omnibus regis proximis antelati. 
2.1.5	per idem tempus Susanna, cuidam Ioachi nupta, spectatae femina pulchritudinis, a duobus presbyteris appquita , cum impudicis non adquieuisset, falso crimine incessitur, isdem presbyteris deferentibus, in remotis locis adulescentem cum ea deprehensum, sed illum iuuenili alacritate senum manus effugisse. ita presbyteris fides habita: iudicio populi Susanna damnatur. 
2.1.6	quae cum secundum legem ad supplicium duceretur, Daniel, tum annos natus xn , increpitis Iudaeis, cur innocenter morti dedissent, reduci eam in iudicium causamque denuo audiri postulat. 
2.1.7	enimuero multitudo Iudaeorum, quae tum aderat, non sine Deo existimans puerum contemptae aetatulae in hanc constantiam prorupisse, fauore accommodato in consilium reuertitur. initur denuo iudicium: Danielo. 
2.1.8	, ut inter maiores natu resideret, delatum. igitur separari accusatores iubet: unumquemque ex eis interrogat, sub cuius generis arbore adulteram deprehendisset. ex uarietate responsi falsitas deprehensa: Susanna absoluta, presbyteri, qui innocenti periculum creauerant, capite damnati. 
2.2.1	Ea tempestate Nabuchodonosor somnium uidit, mysterio futurorum mirabile. cuius interpretationem cum per se non posset euoluere, ascitis ad interpretandum Chaldaeis quique magicis artibus extisque hostiarum scire occulta et futura praecinere uidebantur, mox ueritus, ne more hominum non uera, sed placita regi ex somnio coniectarent, uisa subprimit poscitque ab eis, ut, si uera in iis diuinatio esset, somnium ipsum sibi dicerent: tum demum interpretationi eorum crediturum, si prius enuntiando somnium artis periculum fecissent. 
2.2.2	illi uero tantam molem abnuentes, non esse id humanae opis confitebantur. rex motus, cur falsa diuinandi professione homines erroribus illuderent, cum astricti praesenti negotio nihil scire se confiterentur: ita edicto regis in eos 18 Dan. 2. 1 tempus BQS I snsaanna P 2 cuidam de Prato: quaedam P II Joachim b, Joacim Drusius 3 presbiteris P et sic deincepa 4 hiadem P 5 dephensfls P 7 snssanna dampnatur P 9 innocenter P: inno- centem edd . II reduci scripsi: reduce P, reducere b 13 Danieli b, item p. 68, 2 14 unumquemque de Prato: unumque Pb 17 dampnati P 18 misterio P 20 quique Drusitu: qui Pb, cf. Dan. 2, 2 et 2, 10 22 ueritur P 23 poscitque nos: poposcitque Pb II in his Pb 27 car P: quod b animaduersum palamque omnes huius artis interficiebantur. 
2.2.3	quod ubi Danielo compertum, regis proximum appellat: enuntiationem 80mnii interpretationemque eius pollicetur. 
2.2.4	res ad regem defertur: Daniel arcessitur. iam reuelato sibi per Deum mysterio uisa regis refert absoluitque. sed res postulat, uti regis somnium et interpretationem prophetae et consequentium fidem exponamus. 
