1.23.2	sed regibus proximarum urbium deditio eorum iras conciuerat. itaque admotis copiis oppidum eorum Gabaoth nomine obsidione circumsistunt. igitur oppidani, artis rebus suis, nuntios ad Iesum mittunt, obsessis uti succurreret. 
1.23.3	ita ille maturato itinere inopinantibus superuenit caesaque ad internecionem multa hostium milia. cum dies caedentes deficeret noxque uictis futura praesidio uideretur, merito fidei dux Hebraeus noctem auertit, dies perseuerauit: ita nullum hostibus effugium fuit. quinque reges capti interfecti sunt. eodem impetu uicinae quoque urbes imperio adiectae regesque earum perempti. 
1.23.4	uerum quia omnia haec \' in ordinem persequi non fuit consilium, dum breuitati studemus, 1 Jos. 6. 5 Jos. 8. 11 Jos. 9. 16 Jos. 10. 23 Jos. 11. 24 Jos. 12. 1 facilis Pb II Domino b 3 circumacta P: circumlata b 4 turres Pb: turris edd. multae uitiase 5 Dominum b II traditur] supplet Gciesinius ex Josuae cap. 6, 26: Tum Jesus Dominum traditur allocataa, iis male precando, qui Hierichon oppidum ope diuins. disturbatum instaa- . . rare aggrederentur. \\I Geth Pb: Gai de Prato (praeeunte Drusio) cum graecis Bibliis et Hieronytno de locis Paiestinae II excercitus P 12 \'мal- lem tantwn uel in bellum conspirant uel conspirant H. annis depellere* de Prato; cf. II, 11, 4 13 dedidcrant Galesinius: dederunt Pb 14 malim receptisque in fidem.. imperatum 16 Gabaoth Pb: Gabaon Drusius 17 artis P : arctis b 18 nuntiiss (sic) P \\I succurret P 19 internecionem I ulta P id modo annotandum curauimus, xx et nouem regna imperio Hebraeorum subiecta: quorum terra per undecim tribus uiritim distributa est. Leuitis enim in sacerdotium assumptis nulla portio data, quo liberius seruirent Deo. 
1.23.5	equidem hoc exemplum non tacitus praeterierim, legendumque ministris ecclesiarum libenter ingesserim. etenim praecepti huius non solum immemores, sed etiam ignari mihi uidentur: tanta hoc tempore animos eorum habendi cupido ueluti tabes incessit. inhiant possessionibus, praedia excolunt, auro incubant, emunt uenduntque, quaestui per omnia student. 
1.23.6	at si qui melioris propositi uidentur, neque possidentes neque negotiantes, quod est multo turpius, sedentes munera expectant, atque omne uitae decus mercede corruptum habent, dum quasi uenalem praeferunt sanctitatem. 
1.23.7	sed longius quam uolui egressus sum, dum me temporum nostrorum piget taedetque: ad inceptum redeo. igitur, ut supra dixi, diuiso per tribus captiuo solo, pace summa Hebraei perfruebantur, finitimis bello territis tot uictoriis nobiles annis temptare. 
1.23.8	eodem tractu Iesus mortuus est, anno aetatis decimo et centesimo. de imperii autem eius tempore parum definio: frequens tamen opinio est, xx et vii annis eum Hebraeis praefuisse. quod si ita est, a mundi exordio in excessum eius anni sunt III D CCC LXXX et IIII. 
1.24.1	 Iesu mortuo populus sine duce agebat. sed cum aduersus Chananaeos bellandum esset, dux belli ludas assumptus est. huius ductu res prospere gestae: domi militiaeque summum otium: populus subactis aut per deditionem acceptis gentibus imperitabat. 
1.24.2	 inde, ut semper fieri secundis rebus solet, morum disciplinaeque immemor matrimonia ex uictis assumere paulatimque externos mores trahere ac mox profano ritu idolis sacrificare occepit: adeo 3 Jos. 13. sqq. 15 Jos. 23. 24. 22 Jud. 1. 1 xxxi Stgonius coll. Jos. 12, 24 . 2 terra per undecim tribus uiritim b: trib; per undecim tribus uirtntem P; uerum erat per xn tribus, sed uidetur error ipsim Seueri 6 immoemores P 7 labendi P 15 incoeptum Pb 17 annis nemine audente tentare b ex interpolatione 1\\ tractu temporis malebat de Prato, temporum tractu Vonck coll. I, 13. II, 5. 9. 12. 33 . 21 m P, ut coni. GiselintIJJ: M b 22 chananeos P 23 Juda coni. Brusius, quoniam de tribu sermo est 25 populus aut subactis b 27 assumere b: assumpsere P cuncta cum externis societas perniciosa est. quae Deus longo ante prospiciens salubri Hebraeos responso instruxerat, deuictas gentes ut internecioni darent. sed plebs cupida dominandi imperare victis cum pernicie malebat. 
1.24.3	igitur cum relicto Deo idola colerent, destituti diuino auxilio, a rege Mesopotamiae euieti et subacti VIII annis captiuitatem pependerunt, donec Gothoniel duce in libertatem restituti per quinquaginta annos rerum potiti sunt. 
1.24.4	rursumque corrupti longae pacis malo idolis litauerunt. moxque aderat poena peccantibus: ab Eglom rege Moabitarum deuicti duodeuiginti annis seruierunt, donec instinctu Dei Aod regem hostium dolo interemit contractoque tumultuario exercitu libertatem armis uindicauit. idem per LXXX annos in pace Hebraeis praefuit. huic Semigar successit: isque aduersus Allophylos congressus secundum euentu proelium fecit. 
1.24.5	rursumque Hebraeos sectantes idola rex Chananaeorum Iabin nomine subiugauit grauissimamque in eos per xx annos dominationem exercuit, donec pristinum Debbora mulier statum reddidit. adeo nihil spei in eorum ducibus erat, ut muliebri auxilio defenderentur. quamquam haecintypum ecclesiae [forma] praemissa sit, cuius auxilio captiuitas depulsa est. sub hac duce uel iudice XL annis Hebraei fuerunt. 
1.24.6	rursumque ob peccata Madianitis traditi duro imperio habebantur, afflictique malo seruitutis diuinum auxilium implorauerunt. ita semper in secundis rebus immemores caelestium beneficiorum idolis supplicabant, in aduersis Deo. 
1.24.7	unde cum reputare in animo soleo, populum tot beneficiis Dei obligatum, tot cladibus cum peccaret coercitum, expertumque et misericordiam et seueritatem Dei nequaquam emendatum, et cum semper ueniam erroris acciperet, semper peccasse post ueniam, nihil mirum uideri potest Christum 4 Jud. 3. 14 Jud. 4 sq. 20 Jud. 5. 1 pernitiosa P, item u . 4 pernitie II longo P: longe b 3 internetioni P 5 malim Mesopotamiae uicti 6 vm Vorstim (ef. Jud. 3,8): vn Pb IIlibertate P 7 quadraginta Judicum 3,11, cf. de Prato ad h. I . 9 Eglom Vorgtius: eglo P (ab Eglo enim rege b) 10 intinctu P \\I Aod Drusius: Adon Pb 11 exercitui P 13 Samegar LXX et August. Quaest. 25 in lib. Jud . II isque P (corr. 1 m. ex icque): hicque b II aduersum P corr . II allofilos P II secundo euentu Drusim 19 forma J. C. Hofmeisterus (in ed. Tiguri 1708) glossema esse uidit \\I est depulsa b 23 coelestium b 25 Deo malebat de Prato ab his non receptum, cum iam inde ab initio totiens in Domino rebelles deprehendantur: magisque mirum est, illis semper peccantibus numquam Dei, si quando eum implorauerunt, defuisse clementiam. 
1.25.1	 Igitur cum eis, ut supra retulimus, Madianitae dominarentur, conuersi ad Dominum, misericordiam solitam flagitantes, impetrauerunt. 
1.25.2	erat in Hebraeis Gedeon quidam nomine, uir iustus et carus Deo acceptusque. huic angelus de campo messis domum reuertenti astitit et \'Dominus\' inquit \'tecum, potens in uirtute\'. 
1.25.3	 at ille uoce humili non esse in se Deum ingemescebat, siquidem quod populum captiuitas premeret, uirtutumque Domini, qui eos de terra Aegypti eduxerat, flens recordabatur. 
1.25.4	tum angelus (uade\' inquit \'in hoc spiritu, quo locutus es, et populum de captiuitate eripe.\' ille uero abnuere se infractis suorum uiribus, cum ipse minimus esset, tantum onus suscipere. perstare angelus, ne dubitaret posse fieri, quae Deus loquebatur. 
1.25.5	perfecto sacrificio dirutaque ara, quam Baalis idolo Madianitae sacrauerant, ad suos profectus castra castris hostium contulit. sed Madianitis etiam gens Amalech se coniunxerat: Gedeon uero non amplius quam ad triginta et II milia exercitum parauerat. 
1.25.6	sed priusquam confligeret, Deus ad eum locutus est, nimiam esse hanc multitudinem, quam in proelium uellet educere: Hebraeos pro solita perfidia euentum pugnae non Deo, sed uirtuti suae daturos: itaque daret uolentibus discedendi potestatem. quod ubi populo diuulgatum, xx et II a castris recesserunt. sed ex decem milibus, quae resederant, admonitus a Deo non amplius quam trecentos tenuit: 
1.25.7	reliquos ab armis dimisit. ita media uigilia castra hostium ingressus, iussis omnibus tuba canere, magnum terrorem iniecit: neque cuiquam resistendi animus fuit: turpi fuga quo quisque potuit dilapsi. 19 Jud. 7. 1 non esse receptum b II toties b II in Dominum Vorstius 8 Domino b 9 et addidit Vorstius II inquid P 10 Dominum ingemiscebat b II siquidem populum Giselinus 14 abnuere in se Hornius; siquidmutandum, potius Be delendum uidetur 15 perstare P: perstare contra b 16 Dominus b II perfecto P: perfecto igitur b 17 bachili P corr. w bachali 18 perfectus P 19 Amalec Drusius 20 n milia] n P 22 pręlio P II solitã P 26 a Domino b 29 quisque 6: quisqui P II dilapsi P: dilapsis b sed occurrentibus omni ex parte Hebraeis passim fugientes cadunt. reges Gedeon persecutus ultra Iordanem, comprehensos neci dedit. ea pugna c et xx ex hostibus caesa, xv capta traduntur. 
1.25.8	tum consensu omnium Gedeoni, ut princeps populi esset, delatum. quod ille aspernatus communi iure cum ciuibus uiuere quam praeesse suis maluit. depulsa igitur captiuitate, quae septem annos populum continuerat, pax per XL annos fuit. 
1.26.1	Sed defuncto Gedeon filius eius Abimelech, ex concubina ortus, fratribus interemptis, pessimis quibusque consentientibus et maxime Sicimorum principibus operam nauantibus, regnum occupauit. 
1.26.2	isque discordiis ciuilibus exercitus, cum suos bello premeret\', turrim quandam, in quam se amisso oppido fugientes receperant, expugnare aggressus, dum incautius subit, saxo a muliere ictus periit, cum triennio imperium tenuisset. 
1.26.3	huic successit Thola, qui duobus et xx annis regno potitus est. post hunc Iair fuit, qui cum aeque uiginti et duos annos principatum obtinuisset, populus relicto Deo idolis se mancipauit. \'obque id Israelitae subacti sunt ab Allophylis et Ammonitis duoque de xx annis sub eorum imperio fuerunt. 
1.26.4	quo tempore eis Deum inuocantibus diuinum responsum redditum est, simulacra potius inuocarent, se non ultra misericordiam ingratis praestiturum. at illi flentes culpam fateri et ueniam precari, abiectisque idolis Deum implorantes negatam; licet misericordiam impetrauerunt. 
1.26.5	igitur Iepta duce ad libertatem armis uindicandam frequentes conueniunt, missis prius ad Ammon regem legatis, finibus suis contentus bello abstineret. at ille proelium non abnuens aciem instruxit. tum Iepta prius quam signum pugnae daretur, uouisse dicitur, si prospere pugnasset, eum, qui sibi primus reuertenti obuius fuisset, hostiam Deo dandum. 
1.26.6	ita uictis hostibus, cum 2 Jud. 8. 8 Jud. 9. 13 Jud. 10. 24 Jud. 11. 3 xv b: xv P II Tunc b 8 Gedeoni b, Gedeone Vonck 10 Sichimorum b 1\\ operam P: operam Fei b 15 Thola Galesinivs: cholias Pb 17 Domino b \\I iarahelitae P; itemp. -30, 11 18 ab illophilis P II duoq. b: duo P 19 Dominum b 20 diuinum P: diuinum scilicet b 22 precari ueniam b 24 Jephtha Drusius 25 Amon ad regem P, ad Amõ regem b, ad Ammonitarum regem Voratius, ad regem fUiorum Ammon Drusius; at cf. 1, 35, 4 ad regem Moab II finibus P: ut finibufl b J26 abstinere P 29 damdfl (sic) P, sed ù ex ã ead. m. corr . domum rediret, filia ei obuiam fit, quae patrem exceptura uictorem cum tympanis et choris laeta processerat. tum Iepta consternatus, dolore conscissis uestibus, indicat filiae uoti necessitatem. at illa non feminea constantia, mori non recusans, duos tantum tamen menses uitae spatium petit, ut aequales suas prius uideret. quibus actis ultro ad patrem rediit uotumque Deo reddidit. Iepta principatum sex annis tenuit. 
1.26.7	huic Esebon successit, et tranquillis rebus exacto imperio anno septimo decessit. postque eum Ailon Zabulonites annis x itemque Abdon annis VIII rerum potiti, pacis tempore nihil quod historia loqueretur ediderunt. 
1.27.1	 Rursum Israelitae ad idola conuersi, diuino destituti praesidio, subiecti Allophylis per XL captiuitatis annos poenas perfidiae pependerunt. ea tempestate Samson natus traditur. 
1.27.2	huius mater diu sterilis angelum uidit, dictumque ei est, uino et sicera atque inmundis abstineret: fore uti puerum ederet libertatis uindicem et hostium ultorem. ita mulier enixa puerum Samson nomen ei indidit. 
1.27.8	is intonso capite mirae uirtutis fuisse traditur, adeo ut leonem in uia obuium manu discerperet. uxorem ex Allophylis habuit: quae cum absente uiro in alterius matrimonium conuenisset, dolore ereptae coniugis perniciem genti molitus est: fretus Deo et uiribus palam uictores clade afficiebat. ccc siquidem uulpibus captis, ardentes lampades earum illigauit caudis atque eas agris hostium inmisit. ac tum forte maturis messibus facile incendium fuit, uineaeque et oliuarum arbores exustae. 
1.27.4	grandi Allophylorum exitio abreptae uxoris iniuriam ultus uidebatur. quo dolore Allophyli permoti mulierem tanti mali causam cum domo et patre incendio consumpserunt. sed Samson parum se uindicatum ratus, urguere omnibus incommodis profanam gentem non desinebat. 
1.27.5	tum compulsi Iudaei uinctum eum Allophylis tradiderunt: 7 Jud. 12. 11 Jud. 13. 17 Jud. 14 21 Jud. 15. 4 foeminea b 5 tamen del. Fabricius, item Vonck, nisi tantum delendum sit 6 rediit Pb: redit edd. recentiores II Domino b 7 \' Εσεβάυ in 8 et b: om. P 9 Allon Pb, Atkwv LXX, Ahialon uulgo 12 allophilis P et sic infra semper allophili 14 dictaque P II sicera P, sed s eadem m. ex c corr . 17 fuisse Pb: om. edd. recentt. pleraeque 21 Domino b \\I uictoris P 23 immisit. At tum b 28 urgere b sed traditus ruptis uinculis, arrepto osse asini, quod casus telum dederat, mille ex hostibus prostrauit. ingrauescente autem aestu, cum siti affectus esset, inuocato Deo ex osse, quod manu tenebat, aqua fluxit. 
1.28.1	Ea tempestate Samson Hebraeis praeerat, Allophylis unius uirtute domitis. igitur insidiantes uitae eius nec palam eum temptare audentes uxorem eius, quam ille postea acceperat, pecunia corripiunt, uirtutem uiri uti proderet. 
1.28.2	illa eum blandimento muliebri aggressa diu eludentem et multa cunctantem perpulit ut indicaret, m crinibus capitis uirtutem suam subsistere. 
1.28.8	mox dormienti insidiata crinem eius abstulit atque ita eum Allophylis tradidit: nam saepe prius traditum comprehendere nequiuerant. tum illi effossis oculis uinctum compedibus in carcerem coniecerunt. 
1.28.4	sed spatio temporis accisus crinis crescere et cum eo uirtus redire occeperat. iamque Samson conscius recepti roboris tempus modo iustae ultionis opperiebatur. erat Allophylis moris, cum dies festos agerent, Samson quasi in pompam publicam producere, capto insultantes. 
1.28.5	ita die quodam, cum publicum epulum in honorem idoli dedissent, Samson exhiberi iubent. templum autem, in quo omnis populus omnesque Allophylorum principes epulabantur, duabus subnixum columnis mirae magnitudinis erat: 
1.28.6	productus Samson inter columnas statuitur. tum ille tempore arrepto, inuocato prius Domino, columnas disiecit: turbaque omnis ruina domus obruta, ipse cum hostibus non inultus occubuit, cum xx annis Hebraeis praefuisset. 
1.28.7	huic Simmichar successit, de quo nihil amplius scriptura prodidit. nam neque finem imperii eius repperi et fuisse populum sine duce inuenio. ideo, cum aduersus Beniamin tribum ciuile bellum fuit, ludas temporarius dux belli assumptus est. sed plerique, qui de temporibus scripserunt, annuum imperium eius annotauerunt : plerique ita eum praeterierunt, ut post Samson 6 Jud. 16. 3 Domino b 6 teptare P 8 corripiunt P: corrumpunt b 9 multa P: multum b 10 captis P 14 accisos Pb II cum eo P: cum eis b II occoeperat b 18 idolis P 19 exhyberi P 21 mire P 25 Simmichar Pb, at infra c. 29, 7 Semigar 26 reperi b 27 ideo 6; adeo P p tribuum de Prato 29 plerique] immo pauci (uel aliqui); videtur eum librarius sequens plerique calamo praecepisse p annuum imperium scripsi: annùunù imperiO. P, annum unum imperio edd . Heli sacerdotem snbiunieriiit . nos eam rem ut parum compertam in medio relinquemus. 
1.29.1	 Per haec tempora ciuile, ut diximus, bellum exarserat, causa autem motus haec fuit. 
1.29.2	Leuites quidam cum concubina iter faciens, urguente nocte compulsus in oppido Gabaa, quod ab Beniamitis incolebatar , successerat. cum eum senex quidam hospitio benigne recepisset, iuuenes ei oppido hospitem circumsistunt, stupro eum subdere parantes. 
1.29.3	multum a sene increpiti aegreque exorati, uicario demum concubinae eius corpore in ludibrium accepto, aduenae pepercerunt, illusamque nocte tota postero die reddiderunt. Sed illa — stupri iniuria an uerecundia, parum definio — uiso uiro animam efflauit. 
1.29.4	tum Leuita m testimonium diri racmons membra eius in duodecim discissa partes per duodecim tribus misit, quo promptius omnes facti inuidia commoueret. 
1.29.5	quod ubi omnibus compertum, undecim reliquae tribus aduersum Beniamin in bellum conspirant. huic bello ludas, ut diximus, dux fuit. sed duobus proeliis male pugnatum: tertio demum Beniamitae uicti caesique ad internecionem: ita paucorum scelus publico exitio punitum. haec quoque Iudicum uolumine continentur: 
1.29.6	Regum libri sequuntur. sed mihi annorum ordinem et seriem temporum persequenti parum continuata uidetur historia. 
1.29.7	nam cum post Samson iudicem Semigar fuerit, pauloque post historia consignet populum sine iudicibus egisse, Heli etiam sacerdos libris regnorum fuisse referatur, sed quot anni inter Heli et Samson fuerint minime scriptura prodiderit, uideo medii quiddam fuisse temporis, quod laboret ambiguo. 
1.29.8	ceterum a die mortis Iesu usque in id tempus, quo Samson defunctus est, numerantur anni cccc et XVIIII, a mundi autem exordio anni IIII ccc et m. 
1.29.9	quamquam ab hac supputatione nostra 4 Jud. 19. 15 Jud. 20 sq. 1 Eli rectius scribi monuit Drusius 5 urgente b 6 successerat scripsi: succederat P, secesserat b; cf. 1, 35, 5 8 parentes P II exorati Sigonius: exortati P, exhortati b 10 crediderunt P, em. in b 11 uerecundiae Pb, em. in ed. Colon . II patrum P 18 internetionem P 19 regnorum coni de Prato, ut est infra II sequuntur P: sequentur b 21 et 22 hystoria P 21 cum P sup. lin. sed 1 manu 23 bęli P me et paulo post 24 sed P, ut malebat Vorstius: sed quum b 25 uideo] iudęo P 27 xvnn lnselinus: vmi P 28 nii Pb: IV edd. multae perperam II in] XXIII Sigonius ceteros discordare non nesciam: sed mihi conscius sum, me non incuriose latentem annorum ordinem protulisse, donec m haec tempora incidi, de quibus dubitare me fateor. nunc reliqua exequar. 
1.30.1	Igitur, ut supra retuli, Hebraei sine iudice aut duce ullo I proprio arbitrio agebant. Heli sacerdos erat: sub hoc Samuel natus est. huic pater Elchana, mater Anna. 
1.30.2	haec diu sterilis, cum conceptum a Deo peteret, uouisse traditur, si puer nasceretur, sacrandum Deo. ita annum puerum Heli sacerdoti tradidit. mox cum adoleuisset, Deus ad eum locutus est. 
1.30.3	Heli sacerdoti iram denuntiat ob uitam filiorum, qui sacerdotium patris in quaestum uerterant, munera a sacrificantibus exigentes: quamquam plerumque eos pater increpasse referatur, sed lenior obiurgatio non satisfecerat disciplinae. 
1.30.4	igitur AUophylis in Iudaeam irruentibus obuiam itum. sed uicti Hebraei parant aciem restituere: arcam Domini secum in pugnam efferunt et cum ea filii sacerdotis prodeunt, quia ipse annis grauior luminibus obductis satisfacere officio nequiuerat. 
1.30.5	sed ubi arca in conspectum hostium deducta est, maiestate quadam praesentis Dei territi fugam parabant. assumptaque rursum constantia et non sine Deo mutatis animis, totis uiribus concurrunt. uicti Hebraei: arca capitur, filii sacerdotis cadunt. 
1.30.6	Heli, delato ad se mali nuntio, consternatus animam expirauit, cum per annos xx sacerdotium administrasset. 
1.31.1	Victores secundo proelio Allophyli arcam Dei, quae in potestatem uenerat eorum, oppido Azoto in templum Dagon intulerunt. sed simulacrum daemoni dicatum, ubi arca illata est, corruit: 
1.31.2	 cumque idolum loco restituissent, nocte insecuta discerptum est. inde mures per omnem regionem exorti noxiis morsibus multa hominum milia leto dabant. 
1.31.8	quo malo compulsi Azotii ad declinandam calamitatem arcam Dei ad Gethaeos transtulerunt. qui 5 Jud. 21. I Reg. 1 aqq. 23 I Reg. 5 1 discordiare P 1\\ non curiose Pb, emendauit Oiselinus 2 done P 5 agebant Vorstius: agebantur Pb; cf. I, 24,1. 29, 7. 34, 2. 11, 9, 2 (?). 10, 4. 46, 8. II Samnhel P, et sic plerumque, sed non seMper 6 Elcana Drusius et deinde Hanna 8 Domino et 9 Dominus b 10 dennntians ob uitia de Prato 11 a om. P II quanquam P 12 lenior P: , leuior b 14 aciem b: etiem P 17 conspecta P 18 Domini et 19 Do- mino b 28 loeto dabunt P 29 getheos P 3 cum simili clade afficerentur, in oppidum Ascalonensium arcam transuexerunt. his uero, aduocatis gentis eius primoribus, consilium fuit, arcam Domini Hebraeis reddere. ita ex sententia principum augurumque et sacerdotum imposita uehiculo multis cum muneribus remittitur. 
1.31.4	illud mirabile, quod, cum oneri boues feminas subiecissent uitulosque earum domi retinuissent, iter nullo duce in Iudaeam pecudes direxerunt, non reuocante affectu foetus relicti. cuius rei miraculo reguli Allophylorum usque in fines Hebraeorum aream secuti religiosum officium praestiterunt. 
1.31.5	Iudaei autem, ubi referri aream uiderunt, certatim ex oppido Betsamis cum gaudio obuiam ruere, festinare, exultare, grates Deo referre. mox Leuitae, quorum hoc negotium erat, sacrificium Deo celebrant, bouesque eas, quae arcam adduxerant, immolant. 
1.31.6	sed in oppido, quod supra diximus, teneri arca non potuit. itaque passim Dei nutu per totam urbem saeuitum, arca in Cariathiarim oppidum translata est ibique per uiginti annos fuit. 
1.32.1	 Ea tempestate Samuel sacerdos Hebraeis praeerat: quietis a bello rebus populus in otio degebat. pax deinde Allophylorum irruptione turbata, trepidantibus cunctis ob conscientiam peccati. 
1.32.2	 Samuel caesa prius hostia Deo fretus suos in proelium eduxit, primoque impetu fusis hostibus uictoria penes Hebraeos stetit. 
1.32.3	sed hostili metu remoto secundis tranquillisque rebus, corruptis consiliis, more uulgi, cui praesentia fastidio, insueta desiderio sunt, regium nomen, cunctis fere liberis gentibus perinuisum, populus desiderabat: plane insigni exemplo amentiaepraeoptabat libertatem seruitio mutare. 
1.32.4	igitur frequentesSamuelem circumsistunt, ut, quia iam ipse senuisset, regem eis constitueret. 
1.32.5	at ille placide salubri oratione ab insana uoluntate detorquere plebem: dominationem regiam et superba imperia exponere, libertatem extollere, seruitutem detestari, postremo diuinam eis iram denuntiare, siquidem homines mente corrupti, Deum regem habentes, regem sibi ex hominibus 2 I Reg. 6. 15 I Beg. 7. 25 I Reg. 8. 10 Betbsamis b, Βαιϑσαμύς LXX, Bethsames Drusius 11 Domino b 15 strage pestilentiae saenitam malebat de Prato II chariar thiarim P 20 Domino b II imflium P II deduxit b 24 perinmsum P: semper innisum b 25 plane P: planeque b II insigni Bernays p. 26: non sine Pb flagitarent. 
1.32.6	his atque aliis istiusmodi frustra dictis, cum populus in sententia perseueraret, Deum consulit. qui permotus uecordia insana6 gentis nihil aduersum se petentibus negandum respondit. 
1.33.1	Ita Saul, sacerdotali prius a Samuele unguento perfusus, rex constitutus est. hic ex tribu BAnisnnin , Cis patre onUs , modestus animi, forma excellenti, ut merito dignitas corporis dignitati regiae conueniret. 
1.33.2	sed principio regni huius aliquanta ab eo pars populi desciuerat, parere imperio abnuens, seque Ammonitis coniunxerat. sed hos Saul inpigre ultus est: uicti hostes, uenia Hebraeis data tum Saul iterato a Samuele unctus traditur. 
1.33.3	inde Allophyiorum irruptione atrox bellum exortum: locum exercitui ad conueniendum Saul in Galgalis constituerat. 
1.33.4	et cum per septem dies Samuelem opperitur, ut sacrificium Deo fieret, tardante illo cum populus dilaberetur, illicita praesumptione rex ad uicem sacerdotis holocaustum obtulit: multumque a Samuele increpitus sera peccatum paenitentia fatebatur. 
1.33.5	igitur ex peccato regis metus omnem exercitum peruaserat. castra hostium haud longe sita praesens periculum ostendebant, neque cuiquam exeundi in proelium animus: plures lamas petiuerant. nam praeter imbecillitatem animorum, qui alienum a se Deum delicto regis arbitrabantur, in maxima ferramentorum inopia exercitus erat, adeo ut praeter Saul et Ionathan filium eius nemo gladium aut lanceam habuisse tradatur. nam Allophyli, superiore bello uictores, cotis usum Hebraeis ademerant, neque cuiquam conficiendi teli bellici aut rustici ferramenti potestas fuerat. 
1.33.6	igitur Ionatha audaci consilio, solo armigero suo comite, castra hostium ingressus uiginti fere ex hostibus interemptis, uniuersum exercitum terrore perculerat. 
1.33.7	tmn uero\' 4 I Reg. 9 et 10 12 Reg. 13. 25 I Reg. 14.. 2 Dominum b 4 Ita P: Igitur b II Saul b: om. P 6 excellenti P: excellenti erat b 9 sed.- uenia P: Verum hos Saul impigre ultus est: uictique hostes, et uenia b 13 opperitnr P: opperitus esset b uel latebasr II Domino b 14 bolocaustum P 16 poenitentia b 19 lacrimas (add. a. I . 1 m. vel latebras) P, lachrymas et latebras 6; lacrimas potius ex lamas corruptum esse perspexit Bernays (Rhein. Mus. f. Philol. XVI, 371) colI. I Reg. 13, 6 . 20 Dominum b M delectu P II imaxinia P 23 superiores Pb, em. Giselinus II cotis addidit Bemays ex I Beg. 13, 20,; alii suppl . usum armorum 3* nutu Dei in fugam uersi non imperia exequi, non ordines obseruare, omne praesidium in pedibus habere. quod ubi Saul animaduertit, suis propere eductis fugientes persecutus uictoria potitus est. 
1.33.8	eo die rex edixisse traditur, ne quis nisi confectis hostibus cibum caperet. sed Ionatha interdicti nescius fauo reperto, tincto spiculo, mei degustauerat. id ubi regi ex Dei ira compertum est, morte affici filium iussit. sed populi auxilio ab exitio uindicatus est. 
1.33.9	ea tempestate Samuel a Deo monitus regem adiit, uerbis Dei nuntians, uti genti Amalech, quae olim Hebraeos ex Aegypto uenientes transitu prohibuerat, bellum inferret, addito interdicto, ne quid ex spoliis deuictorum concupisceret. 
