2.25.2	Tryphon, ubi se imparem cernit, pacem simulat, receptumque. in amicitiam inuitatumque Ptolemaidam interfecit. post Ionatham summa rerum ad Simonem fratrem defertur. is funus fratris magnifice curauit septemque illas pyramidas nobilissimi operis extraxit, in quibus et fratrum et patris ossa condidit. 
2.25.3	tum Demetrius, refecto cum Iudaeis foedere, contemplatione cladis a Tryphone illatae — nam post Ionathae necem urbes eorum atque agros bello uastauerat — annua eis uectigalia in perpetuum remittit: etenim usque ad id tempus regibus Syriae, nisi cum armis restiterunt, stipendium pensitauerant . 
2.25.4	id gestum Demetrii regis anno secundo, quod ideo 1 eo pręlio uincitur ptolomeus . cadit alexander nincitur paulo post P, eo proelio uincitur Ptolemaeus, cadit Alexander. Vincitur Ptolemaeus, et paulo post b; secuti sumus emendationem G. Bichteri, nisi quod ille secutldum editionem principem et ante paulo addidit 2 interfectus P: interficitur b 3 implerisque P 4 Jonathan b 5 iudas P jj 5 et 8 trifon P 6 regno] hic quaedam intercidisse critici recte intellexerunt; nec tamen sufficit cum Hieronymo de Prato inhiabat supplere; nam apparet plura deesse et uerba eum bello prohibiturus non ad sententiam. Requentem, sed ad priorem pertinere. Ex Maccab. I, 12, 39 sq., \'xal ξζη̄τησε Τρύϕω v βασιλεύσαι rfjg lAalag xal περιϑεσϑαι ro δ u ιδημσ x αί εχτεῑ v αι xEiea ὲπιιι \' Avl οχο v τό v βασιλέα \' xal ὲϕοβη̄ϑη μὴ ποτε οὐ x αὐτὸ v \' Ιω vi\' ιϑα v xal μὴ ποτε πολεμήσ x α ìal ξζὴτει π ó ρο v Toli σ v λλα fitTv τό v \' Ιω vá ϑαν xal á πολέσαι avrov, xal á π á ρας ὴλϑεν tlg Βαιϑσάν \' lacuna sic fere explenda uidetur: regno [Asiae inhians, ueritus ne Jonatha sibi arma inferret, profectus est Baethsan] eum bello prohibiturus. contra Jonatha ete . 7 ionatha (cum apice super syllaba tha) P: Jonathan b 8 milium b: milib; P 9 ptolomaidam P, Ptolemaidem Drusius, nisi malis Ptolemaida 10 interficit malebat de Prato II Jonathan b II symonem P 12 in quibus matris et fratrum de Prato; immo potius et fratrum et matris et patris, cf. Maccab. I, 13, 28 14 trifonQ P 16 eis Giselinus: eius P II imperpetuum P 17 restiterunt P: resisterent b signauimus, quia usque in hunc annum per tempora Asianorum regum cucurrimus, ut ratio temporum digesta luceret. 
2.25.5	nunc autem per tempora eorum, qui Iudaeis uel pontifices uel reges fuerunt, usque ad Christi natiuitatem rerum ordinem digeremus. 
2.26.1	Igitur post Ionatham Simon frater eius, ut supra dictum est, Hebraeis praefuit iure pontificis. id enim ei tum et a suis et a populo Romano honori%delatum . 
2.26.2	hic cum secundo Demetrii regis anno ciuibus praeesse coepisset, post octo annos insidiis Ptolemaei circumuentus occubuit. huic Iohannes filius successit. qui cum aduersum Hyrcanos, gentem ualidissimam, egregie pugnasset, Hyrcani cognomen accepit. mortuus est annos VI et xx rerum potitus. 
2.26.3	post hunc Aristobulus pontifex substitutus primus omnium post captiuitatem regium nomen assumpsit capitique diadema imposuit. exacto anno diem functus est. 
2.26.4	Alexander deinde filius eius, rex pariter et pontifex fuit, regnauit annos VII et xx: in cuius actibus nihil praeter crudelitatem memoria dignum repperi. hic cum Aristobulum et Hyrcanum paruos filios reliquisset, Salina siue Alexandra uxor eius regnum per nouem annos tenuit. 
2.26.5	 post huius obitum foeda inter fratres de regno certamina. ac primum Hyrcanus imperium obtinebat: mox ab Aristobulo fratre pulsus confugit ad Pompeium, qui tum Mitridatico bello confecto pacataque Armenia et Ponto uictor omnium gentium, quas adierat, introrsum pergere et uicina quaeque Romano imperio adiungere cupiens, causas belli et materiam uincendi quaerebat. igitur Hyrcanum libens excepit ductuque eius Iudaeos aggreditur: 
2.26.6	 urbe capta atque eruta templo pepercit. Aristobulum uinctum Romam mittit, Hyrcano ius pontificatus restituit: impositoludaeis stipendio procuratorem eis Antipatrum quendam 5 Jonathan b II symon P 6 id enim;- populo scripsi: et id enim et tnti et a suis et a populo P, id enim ei tum a suis, tum et a populo b (Dru- stus: a regibus eius loco quod est a populo Ro.) 8 ptolomei P 11 annos vi et xx r. potitus Qiselinus : anno vr et xx rerum potitus est P 12 aristobolus P 15 filius] \'immo frater, ut ex Josepho liqueV dePrato 18 Salina P, ut coni. Brusius: Solina b n alexandria P 19 prim\'ū (t. e. primusum) P 20 moi aristobolo P 23 aderat P II introrsum P: ultrorsum b 24 nincendi P: incendii aliquot edd. recentt . 25 excipit malebat de Prato 26 ernta P: arce b II uinctum Sigonius : nictum P, cf. Jos. Ant. 14, 8. Flor. 1, 41, 30 etc . 27 impositoque b 28 ascolonitem P, itemp. 82, 3 ascolonitae .. 6 Ascalonitem praeposuit. 
2.26.7	Hyrcanus quattuor et triginta annos rerum potitus, dum aduersum Parthos bellum gerit, capitur. 
2.27.1	 Tum Herodes alienigena, Antipatri Ascalonitae filius, regnum Iudaeae a senatu et populo Romano petiit accepitque. hunc primum Iudaei externum regem coeperunt habere. etenim iam aduentante Christo necesse erat secundum uaticinia prophetarum suis eos ducibus priuari, ne quid ultra Christum expectarent. 
2.27.2	sub hoc Herode, anno imperii eius tertio et xxx, Christus natus est Sabino et Rufino consulibus, vm Kai . Ianuarias. 
2.27.3	uerum haec, quae euangeliis ac deinceps Apostolorum actibus continentur, attingere non ausus, ne quid forma praecisi operis rerum dignitatibus deminueret, reliqua exequar. 
2.27.4	Herodes post natiuitatem Domini regnauit annos IIII: nam omne imperii eius tempus vu et xxx anni fuerunt. postque eum Archelaus tetrarcha annis VIIII, Herodes annis xx et IIII. 
2.27.5	hoc regnante, anno regni eius octauo et decimo, Dominus cruci fixus est FuSo Gemino et Rubellio Gemmo consulibus: a quo tempore usque in Stiliconem consulem sunt anni CCCLXXII. 
2.28.1	 Apostolorum actus Lucas edidit usque in tempus, quo Paulus Romam deductus est Nerone imperante: qui non dicam regum, sed omnium hominum et uel inmanium bestiarum sordidissimus dignus extitit, qui persecutionem primus inciperet: nescio an et postremus explerit, siquidem opinione multorum receptum sit, ipsum ante Antichristum uenturum. 
2.28.2	huius uitia ut plenius exponerem res admonebat, nisi non esset huius operis tam uasta ingredi: id tantum annotasse contentus sum, hunc per omnia foedissima et crudelissima eo processisse, ut matrem interficeret, post etiam Pythagorae cuidam in modum sollemnium coniugiorum 28 ex Tac. Ann. 15, 37. 1 IIII et xx Sigonim 2 bella b 7 sub 6: sed P 12 deminuerit P, diminueret b 14 postq. eum\'P: post quem b 15 annis xx P: an. xx b, annos xx complures edd. posteriores II eius P: om. b 16 fusio P: Fusio b II rebellio P, em. de Prato et iam ante evm Joh. Clericus 17 a om. P II atilliconem P 18 CCCLXYII Sigonius 22 persecutionem P: perNecutionem in Christianos b 23 explebit Giselinus; immo expleturus sit II receptus P 24 ante Antichristum de Prato (lectione in P non cognita): antecristum P, Antichriatum b; cf. Dial. II, 14 26 fedissima P 28 phytagorae P II sollempniorum P denuberet; inditumque imperatori flammeum; dos et genialis torus et faces nuptiales, cuncta denique, quae uelinfeminis non sine uerecundia conspiciuntur, spectata. 
2.28.3	reliqua uero eius incertum pigeat an pudeat magis disserere. hic primus Christianum nomen tollere aggressus est: quippe semper inimica uirtutibus uitia sunt et optimi quique ab improbis quasi exprobrantes aspiciuntur. 
2.28.4	 namque eo tempore diuina apud urbem religio inualuerat, Petro ibi episcopatum gerente et Paulo, posteaquam ab iniusto prae- - sidis iudicio Caesarem appellauerat, Romam deducto: ad quem tum audiendum plures conueniebant, qui ueritate intellecta uirtutibusque Apostolorum, quas tum crebro ediderant, permoti ad cultum Dei se conferebant. 
2.28.5	etenim tum illustris illa aduersus Simonem Petri ac Pauli congressio fuit. qui cum magicis artibus, ut se deum probaret, duobus suffultus daemoniis euolasset, orationibus Apostolorum fugatis daemonibus, delapsus in terram populo inspectante disruptus est. 
2.29.1	Interea abundante iam Christianorum multitudine accidit ut Roma incendio conflagraret, Nerone apud Antium constituto. sed opinio omnium inuidiam incendii in principem retorquebat, credebaturque imperator gloriam mnovandae urbis quaesisse. 
2.29.2	neque ulla re Nero efficiebat, quin ab eo iussum incendium putaretur. igitur uertit inuidiam in Christianos, actaeque in innoxios crudelissimae quaestiones: quin et nonae mortes excogitatae, ut ferarum tergis contecti laniatu canum interirent, multi crucibus affixi aut flamma usti, plerique in id reseruati, ut cum defecisset dies, in usum nocturni luminis urerentur. 
2.29.8	hoc initio in Christianos saeuiri coeptum. post etiam datis legibus religio uetabatur, palamque edictis propositis Christianum esse non licebat. tum Paulus ac Petrus capitis damnati: 
2.29.4	quorum um ceruix gladio desecta, Petrus in crucem sublatus est. dum haec Romae geruntur, Iudaei, 19 Tac. ann. 15, 40 sqq. 1 denuberet P (ut est ita Tae. Ann. 15, 37 extr.): nnberet b 2 thorue b 3 conspicuntur P 8 praesidis P, ut uoluercU Stgonius: prae- auliB b 11 ediderant Pb: ediderunt edd. complures 13 symonem P 13 congreaio P 15 dilapsna P 21 afficiebat P 27 latis legibus Sigonius 28 Christiano Nic. Heinsius ad Ovid. ep. Heroid. 14, 64 29 dampnati P 6* praesidis sui Festi Flori iniurias non ferentes, rebellare coeperunt. aduersus eos Vespasianus proconsulari imperio a Nerone missus multis grauibusque proeliis deuictos coegit intra muros Hierosolymae confugere. 
2.29.5	interim Nero iam etiam sibi pro conscientia scelerum inuisus, humanis rebus eximitur, incertum an ipse sibi mortem consciuerit: certe corpus illius nonrepertum . 
2.29.6	 unde creditur, etiam si se gladio ipse trangfixerit , curato uulnere eius seruatus, secundum illud, quod de eo scriptum est: et plaga mortis eius curata est, sub saeculi fine mittendus, ut mysterium iniquitatis exerceat. 
2.30.1	 Igitur post excessum Neronis Galba. imperium rapuit: mox Otho Galba interfecto occupauit. 
2.30.2	tum Vitellius e Gallia fretus exercitibus, quibus praeerat, urbem ingressus, Othone interfecto summam rerum usurpauit. quae posteaquam ad Vespasianum delata, licet malo exemplo, bono tamen affectu rei publicae ab improbis uindicandae, cum Hierosolymam obsideret, sumit imperium et, ut mos est, diademate capiti imposito ab exercitu consalutatus. Titum filium Caesarem facit: eidem pars copiarum et obsidendae Hierosolymae negotium datum. 
2.30.3	Vespasianus Romam profectus, summo fauore senatus et populi receptus, cum se Vitellius interfecisset, imperium confirmauit. interea Iudaei obsidione clausi, quia nulla neque pacis neque deditionis copia dabatur, ad extremum fame interibant, passimque uiae oppleri cadaueribus coepere, uicto iam officio humandi: quin omnia nefanda esca super ausi ne humanis quidem corporibus pepercerunt, nisi quae eiusmodi alimentis tabes praeripuerat. 
2.30.4	igitur defessis defensoribus irrupere Romani. ac tum forte in diem Paschae omnis ex agris aliisque Iudaeae oppidis multitudo conuenerat: 8 Apocal. 13, 3. 1 Festi] a Josepho uocatur Gessius Floras, ab Eusebio Cestios FL 4 Nero P, ut coni. Giselinus: uero b 6 non repertum (sic ñreptù.) P: interemptum b; sententiam diuinauerat TUlemont proponens irrepertum 8 ei\' P: fort . 08, i e . esse: II et Sigonius: uel (per comp.) P, ut b 12 Tunc b II in Gallias Pb, ex Galliis Sigonius, in Galliis. Is fretus Vonck 13 excercitibus P 14 postea malebat de Prato 15 R. P. P 18 consalutatus P: Imperator consalutatus b 21 sibi confirmanit de Prato 22 obsidioni P 23 interiebant P haud scio an recte 25 esca super P: insuper b ; cf. Bernays p. 59 n. 79 nimirum ita Deo placitum, ut eo tempore, quo Dominum cruci aftixerat , gens impia internecioni daretur. 
2.30.5	Pharisaei aliquantisper pro templo acerrime restiterunt, donec obstinatis ad mortem animis ultro se subiectis ignibus intulerunt. numerus peremptorum ad undecies centena milia refertur, capta uero C milia ac uenundata. 
2.30.6	fertur Titus adhibito consilio prius deliberasse, an templum tanti operis euerteret. etenim nonnullis uidebatur, aedem sacratam ultra omnia mortalia illustrem non oportere deleri, quae seruata modestiae Romanae testimonium, diruta perennem crudelitatis notam praeberet. 
2.30.7	at contra alii et Titus ipse euertendum in primis templum censebant, quo plenius Iudaeorum et Christianorum religio tolleretur: quippe has religiones, licet contrarias sibi, isdem tamen ab auctoribus profectas; Christianos ex Iudaeis extitisse: radice sublata stirpem facile perituram. 
2.30.8	ita Dei nutu accensis omnium animis templum dirutum, abhinc annos trecentos triginta et unum. atque haec ultima templi euersio et postrema Iudaeorum captiuitas, qua extorres . patria per orbem terrarum dispersi cernuntur , cotidie mundo testimonio sunt, non ob aliud eos quam ob illatas Christo impias manus fuisse punitos. nam saepe alias, cum propter peccata captiuitatibus traderentur, numquam tamen ultra LXX annos seruitutis poenam pependerunt. 
2.31.1	Interiecto dein tempore Domitianus, Vespasiani filius, persecutus est Christianos. quo tempore Iohannem apostolum atque euangelistam in Pathmum insulam relegauit: ubi ille arcanis sibi mysteriis reuelatis librum sacrae Apocalypsis, qui quidem a plerisque aut stulte aut impie non recipitur, conscriptum edidit. non multo deinde interuallo tertia persecutio per Traianum fuit. 
2.31.2	 qui cum tormentis et quaestionibus nihil in Christianis morte aut poena dignum repperisset, saeuiri in eos ultrauetuit . 
2.31.3	sub Adriano deinde Iudaei rebellare uoluerunt, Syriam ac Palaestinam 2 farisaei P 5 C b: om. P; C milia habet Eusebius, τρεϊς μ v ριάδας Syneellus, ad C milia Drusius secundum Josephum 8 oportere P: deberi b, debere de Prato quasi ex codice 9 perenne P 11 templum in primis b II penitiue coni Bernays p. 57; at u. ad 1, 35, 9 13 hisdem P II ab hic addidit de Prato, ante isdem Sigonius 17 quae P 18 patria P, non patriae, ut ait de Prato 23 deinde b 24 Joannem b 25 Patmum Drusius II archanis P diripere conati: misso exercitu subacti sunt. qua tempestate Adrianus, existimans se Christianam fidem loci iniuria perempturum, et in templo et loco Dominicae passionis daemonum simulacra constituit. 
2.31.4	et quia Christiani ex Iudaeis potissimum putabantur — namque tum Hierosolymae non nisi ex circumcisione habebat ecclesia sacerdotem — militum cohortem custodias in perpetuum agitare iussit, quae Iudaeos omnes Hierosolymae aditu arceret. 
2.31.5	 quod quidem Christianae fidei proficiebat, quia tum paene omnes Christum Deum sub legis obseruatione credebant. nimirum id Domino ordinante dispositum, ut legis seruitus a libertate fidei atque ecclesiae tolleretur. 
2.31.6	ita tum primum Marcus ex gentibus apud Hierosolymam episcopus fuit. quarta sub Adriano persecutio numeratur, quam tamen postea exerceri prohibuit, iniustum esse pronuntians, ut quisquam sine crimine reus constitueretur. 
2.32.1	 Post Adrianum Antonino Pio imperante pax ecclesiis fuit. sub Aurelio deinde, Antonini filio, persecutio quinta agitata. ac tum primum intra Gallias martyria uisa, serius trans Alpes Dei religione suscepta. sexta deinde Seuero imperante Christianorum uexatio fuit. 
2.32.2	quo tempore Leonida, Origenis pater, sacrum in martyrio sanguinem fudit. interiectis deinde annis VIII et XXX pax Christianis fuit, nisi quod medio tempore Maximinus nonnullarum ecclesiarum clericos uexauit. 
2.32.3	mox Decio imperante iam tum septima persecutione saeuitum in Christianos. inde Valerianus octauus sanctorum hostis fuit. 
2.32.4	post eum, interiectis annis fere quinquaginta, Diocletiano et Maximiano imperantibus acerbissima persecutio exorta, quae per decem continuos annos plebem Dei depopulata est. qua tempestate omnis fere sacro martyrum cruore orbis infectus est: quippe certatim gloriosa in certamina ruebatur multoque auidius tum martyria gloriosis mortibus quaerebantur, quam nunc episcopatus prauis ambitionibus appetuntur. 
2.32.5	 nullis umquam magis bellis mundus exhaustus est, neque maiore umquam triumpho uicimus, quam cum decem annorum 1 rnissoP: miseoque b 3 et in templo et loco P: et in templo ac loco b, qua uitiosa scriptura de Prato inductus est ut locum mancum esse putaret call. Paulini ep. 31 et Rieron. ep. 58 . 6 imperpetuum P 13 postea Pb: post aliquot edd. recentt . 19 leonida P: Leonidas b, Leonides de Prato cum Eusebio 22 iam tum uix sanum est 25 Maximiano Pb: Maximiniano praue edd. llornii et Vorstii stragibus uinci non potuimus. 
2.32.6	extant etiam mandatae litteris praeclarae eius temporis martyrum passiones, quas conectendas non putaui, ne modum operis excederem. 
2.33.1	Sed finis persecutionis illius fuit abhinc annos VIIII et LXXX, quo tempore Christiani imperatores esse coeperunt. namque tum Constantinus rerum potiebatur, qui primus omnium Romanorum principum Christianus fuit. 
2.33.2	sane tum Licinius, qui aduersum Constantinum de imperio certauit, milites suos litare praeceperat: abnuentes militia reiciebat. sed id inter persecutiones non computatur: adeo res leuioris negotii fuit, quam ut ad ecclesiarum uulnera perueniret. 
2.33.3	exinde tranquillis rebus pace perfruimur: neque ulterius persecutionem fore credimus, nisi eam, quam sub fine iam saeculi Antichristus exercebit. etenim sacris uocibus decem plagis mundum afficiendum pronuntiatum est: ita cum iam VIIII fuerint, quae superest ultima erit. 
2.33.4	hoc temporum tractu mirum est quantum inualuerit religio Christiana. tum siquidem Hierosolyma horrens ruinis frequentissimis ac magnificentissimis ecclesiis adornata. 
2.33.5	namque Helena, mater principis Constantini, quae Augusta cum filio conregnabat, cum Hierosolymam agnoscere concupisset, reperta ibi idola ac templa protriuit: mox usa regni uiribus basilicas in loco Dominicae passionis et resurrectionis et ascensionis constituit. 
2.33.6	illud mirum, quod locus ille, in quo postremum institerant diuina uestigia, cum in caelum Dominus nube sublatus, continuari pauimento cum reliqua stratorum parte non potuit, siquidem quaecumque applicabantur, insolens humana suscipere terra respueret, excussis in ora apponentium saepe marmoribus. 
2.33.7	quin etiam calcati Deo pulueris adeo perenne documentum est, ut uestigia impressa cernantur. 
2.33.8	et cum cotidie confluentium fides certatim Domino calcata diripiat, damnum tamen arena non sentiat, et eandem adhuc sui speciem, uelut impressis signata uestigiis, terra custodit. 18—29 Paulini ep. ad Seuerum 31. 1 praeclarae b: praecarae P 2 conectandas P, connectendas edd . 7 quia adnersum P, em. Vonck 18 adhornata P, eat adornata b 20 concnpisceret b 21 basylicas P, basilicam b 23 postrem\' (posiremns) P 24 sublatus est b 28 docimentaiQ P 30 eandem Laubmann: eadem P 
2.34.1	 Eiusdem reginae beneficio crux Domini tum reperta: quae neque in principio obsistentibus Iudaeis potuerat consecrari, et postea dirutae ciuitatis oppressa ruderibus, non nisi tam fideliter requirenti meruit ostendi. 
2.34.2	igitur Helena primum de loco passionis certior facta, admota militari manu atque omnium prouincialium multitudine in studia reginae certantium, eSbdi terram et contigua quaeque ac uastissima ruinarum purgari iubet: mox pretium fidei et laboris tres pariter cruces, sicut olim Domino ac latronibus duobus fixae fuerant, reperiuntur. 
2.34.3	hic uero maior dinoscendi patibuli, quo Dominus pependerat, difficultas ommum animos mentesque turbauerat, ne errore mortalium forsitan pro cruce Domini latronis patibulum consecrarent. 
2.34.4	capiunt deinde consilium, ut aliquem recens mortuum crucibus admouerent. nec mora, quasi Dei nutu funus extincti sollemnibus exequiis deferebatur concursuque omnium feretro corpus eripitur. 
2.34.5	duabus prius frustra crucibus admotis, ubi Christi patibulo attactum est, dictu mirabile, trepidantibus cunctis, funus excussum et inter spectatores suos astitit: crux reperta dignoque ambitu consecrata. 
2.35.1	 His per Helenam gestis, principe Christiano libertatem atque exemplum fidei mundus acceperat : sed longe atrocius periculum cunctis ecclesiis illa pace generatum. namque tum haeresis Arriana prorupit totumque orbem iniecto errore turbauerat. 
2.35.2	 etenim duobus Arriis acerrimis perfidiae huius auctoribus imperator etiam deprauatus, dum sibi religionis officium uidetur implere, uim persecutionis exercuit: actique in exilium episcopi, saeuitum in clericos, animaduersum in laicos, qui se ab Arriorum communione secreuerant. 
2.35.3	quae autem Arrii praedicabant, erant huiusmodi: patrem Deum instituendi orbis causa genuisse 1 cap. 34 ex Pantini ep. 5. 27 - p. 89, 2 ex Hilario fragm. II, 26 col. 642 cd. Veron. 1730. 7 pcium P 10 dignoscendi b II quo P: ill quo b 14 funus P, ut coni. S\'igonius: funeriB b II immo efferebatnr, ut Hofmeisterus quoque uidit 22 Arriana de Prato: arriani P, Ami b (P semper habet arrius, etsi nomen est graecum \' Αρεϊος ) II iniecto P: inuecto b 24 deprauatus dum P: deprauatur: dumque b II regionis P 26 animaduersus P II Arrianorum b 27 Arriani b 28 huiuBcemodi b II deum P: Domini b (praue intellecto compendio in P dm ̃ ); apud Hilarium est : tradebant autem Arii talia: patrem Deum instituendi orbis causa genuisse filium, et pro potcstate filium, et pro potestate sui ex nihilo in substantiam nouam atque alteram Deum nouum alterumque fecisse: fuisse autem tempus, quo filius non fuisset. 
2.35.4	igitur huius mali causa synodus apud Nicaeam ex toto orbe contrahitur, ccc siquidem et duodeuiginti episcopis congregatis: fides plena, conscribitur, haeresis Arriana damnatur, imperator decretum episcopale complectitur. 
2.35.5	Aniani nihil contra sanam fidem retractare ausi, se quoque tamquam adquiescentes nec aliud sentientes ecclesiis miscuerunt: manebat tamen in pectoribus eorum insitum in catholicos uiros odium, et aduersus quos de fide disceptare non poterant, eos subornatis accusatoribus fictisque criminibus appetebant. 
2.36.1	Itaque primum Athanasium Alexandriae episcopum, uirum sanctum, qui apud Nicaenam synodum diaconus adfuerat, aggrediuntur absentemque condemnant. 
2.36.2	etenim ad crimina, quae falsi testes congesserant, aggregabant, quod Marcellum atque Photmum haereticos sacerdotes, synodi iudicio condemnatos, prauo studio recepisset. 
2.36.8	sed de Photino dubium non erat merito fuisse damnatum: in Marcello nihil tum damnatione dignum repertum uidebatur, maximeque ei a studiis partium innocentia accesserat, quod eosdem illos iudices, a quibus fuerat condemnatus, haereticos esse nemo dubitabat. 
2.36.4	ceterum Arriani non hos potius quam Athanasium remouere cupiebant. itaque imperatorem eo usque compellunt, ut Athanasius exulatum ad Gallias mitteretur. 
2.36.5	mox in Aegypto LXXX episcopi congregati Athanasium iniuste condemnatum esse pronuntiant. res ad Constantinum refertur: iubet ex toto orbe apud Sardicam episcopos congregari atque . omne iudicium, quo Athanasius damnatus fuerat, retractari i. 3-5 Hilarii fragm. II, 27 sui ei nihilo in substantiam nonam atque alteram Deum nouum alterumque fecisse 1 et Galesinius: eo P 2 deum P: factum Dominum b II fecisse supple- uimus ex Hilario 6 dampnatur P 7 detrectare coni . de Prato 10 adacrsum b 12 uirn sanctum P distincte: iuns consultum b 13 affuerat P 15 fotinum P et sic postea 19 a studiis p. innocentia Mceaserat scripsi: astudiis p. innocentiù cesserat P, studium p. innocontium aceesserat b 20 condempnatus P et sic saepius 23 compellant tnalebat de Prato II, p, 103 II athanasids (sic) P 25 Constantinum] at u. de Prato ad h. l . 26 serdicam P inter haec Constantinus moritur: 
2.36.6	synodus congregata iam Constantio imperatore Athanasium absoluit, Marcellus quoque episcopatui redditur: nam de Photino episcopo Sirmiensi non est rescissa sententia, qui etiam nostrorum iudicio haereticus probatur. et tamen hoc ipsum Marcellum grauabat, quia Photinus auditor eius fuisse in adolescentia uidebatur. 
2.36.7	uerum tamen ad Athanasii absolutionem etiam illud accesserat, quod Vrsatius et Valens, principes Arrianorum, cum post synodum Sardicensem uiderentur a communione secreti, coram positi a Iulio Romanae urbis episcopo ueniam poposcerunt, quod innoxium condemnassent, meritoque eum sententia concilii Sardicensis absolutum professi sunt. 
2.37.1	 Interfecto deinde tempore Athanasius, cum Marcellum parum sanae fidei penitus comperisset, a communione suspendit. habuitque ille hanc uerecundiam, ut tanti uiri iudicio notatus sponte concederet. 
2.37.2	ceterum antea innocens, postea deprauatus, uideri poterat iam tum nocens fuisse, cum de eo fuerat iudicatum. nacti ergo Arriani istiusmodi occasionem conspirant penitus Sardicensis synodi decreta subuertere. 
2.37.3	etenim eis color quidam subpetere uidebatur, ut tam iniuste fuisset pro Athanasio iudicatum, quam Marcellus fuerat absolutus, qui nunc etiam Athanasii indicio esse haereticus probaretur. 
2.37.4	namque Marcellus Sabellianae haeresis assertor extiterat: Photinus uero nonam haeresim iam ante protulerat, a Sabellio quidem in unione dissentiens, sed initium Christi ex Maria praedicabat. 
2.37.5	igitur Arriani astuto consilio miscent innoxium criminosis, damnationemque Photini et Marcelli et Athanasii eadem sententia comprehendunt, illud nimirum apud imperitorum animos praestruentes, ut non putarentur de Athanasio perperam iudicasse, qui de Marcello atque Photino uera sensissent. 
