pr.1	Seuerus Desiderio fratri karissimo. Ego quidem, frater unanimis, libellum quem de uita sancti Martini scripseram, scheda sua premere et intra domesticos parietes cohibere decreueram, quia, ut sum natura infirmissimus, iudicia humana uitabam, ne, quod fore arbitror, sermo incultior legentibus displiceret omniumque reprehensionis dignissimus iudicarer, qui materiem disertis merito scriptoribus reseruandam inpudens occupassem: sed petenti tibi saepius negare non potui. quid enim esset, quod non amori tuo uel cum detrimento mei pudoris inpenderem? 
pr.2	uerumtamen ea tibi fiducia libellum edidi, qua nulli a te. prodendum reor, quia id spopondisti. sed uereor, ne tu ei ianua sis futurus, et emissus semel reuocari non queat. 
pr.3	quod si acciderit et ab aliquibus eum legi uideris, bona uenia id a lectoribus postulabis, ut res potius quam uerba perpendant et aequo animo ferant, si aures eorum uitiosus forsitan sermo perculerit, quia regnum Dei non m eloquentia, sed m fide constat. 
pr.4	meminerint etiam, salutem saeculo non ab oratoribus, cum utique, si utile fuisset, id quoque Dominus praestare potuisset, sed a piscatoribus 1 fratri karissimo AV (sed add. in A salutem): om. F || unianimie F 2 scribseram V, et sic fere semper scribsi, scribtum, scribtura etc . fl achida V, sceda F, scaeda A 3 promere F 4 infirmissimus V: infimuB F, infirmos Av 6 repraehensionis V: reprehensione AFv; cf . infra c. 9, 3 || materiem V: materiam AFo et corr. V 9 ueruntamen V, om. FQ 10 ededi V || quia nulli V 11 spondisti V, cf. Chron. 1, 34, 7 12 non queat renocari AFv 13 id uenia v 17 cum — potuisset BY: post praedicatam esse habent AFv II fuisset] fuit et V 18 praedicatum est V, praedicatam (sine esse) AB (?) Fv praedicatam esse. 
pr.5	ego enim, cum primum animum ad scribendum appuli, quia nefas putarem tanti uiri latere uirtutes, apud me ipse decidi, ut soloecismis non erubescerem: quia nec magnam istarum umquam rerum scientiam contigissem, et si quid ex his studiis olim fortasse libassem, totum id desuetudine tanti temporis perdidissem. 
pr.6	sed tamen ne nos maneat tam molesta defensio, suppresso, si tibi uidetur, nomine libellus edatur. quod ut fieri ualeat, titulum frontis erade, ut muta sit pagina et, quod sufficit, loquatur materiam, non loquatur auctorem.1 
1.1	 Plerique mortales studio et gloriae saeculari inaniter dediti exinde perennem, ut putabant, memoriam nominis sui quaesierunt, si uitas clarorum uirorum stilo inlustrassent. 
1.2	quae res utique non perennem quidem, sed aliquantulum tamen conceptae spei fructum adferebat, quia et suam memoriam, licet incassum, propagabant, et propositis magnorum uirorum exemplis non parua aemulatio legentibus excitabatur. sed tamen nihil ad beatam illam aeternamque uitam (haec eorum cura pertinuit. 
1.3	quid enim aut ipsis occasura cum saeculo scriptorum suorum gloria profuit? aut quid posteritas emolumenti tulit legendo Hectorem pugnantem aut Socraten philosophantem ? cum eos non solum imitari stultitia sit, sed non acerrime etiam inpugnare dementia: quippe qui humanam uitam praesentibus tantum actibus aestimantes spes suas fabulis, animas sepulcris dederint: 
1.4	siquidem ad 2 appoli V 1\\ putaui A, putaram Vonck 3 ipsum Fcorr. m. 2 ex ipso II decidi B et aliquot Giselini libri: didici A Vv, decreui Fin ras. m. 2 II solycipmis V, soloecismos dett . 4 rerum umquam A 1\\ quit V et sic alias || ez his om. Fpr. m . 5 desuetudine V: dissuetudine AFQ, desitudine 2 codd. Gis. etv 7 subpresso F II edatur om. Fpr. m., datur V 8 et] aut de Prato 9 auctorem] additum in V: Vale frater in Christo uenerabilis; decus bonorum. sanctorumque omnium. Sequitur deinde in V: Incipit uita sancti martini episoopi et confessoris, in F legitur post praefationem (eap. 2 in.) : Inc. uita sci ac beatissimi patroni nostri Martini episcopi atque confessoris, in A eodem item loco: Inc. uita sci ac beatissimi Martini archiepiscopi turoniensis 10 mortalium AFQ 1\\ studio et gloriae (F gloria ut uidetur) saeculari AFV: studio gloriao saecularis 3 codd. Gisel . \'Studium h. J . notI ardorem animi et desideriuiu, sed litterarum exercitationem designat\' de Prato 11 quaesiuerunt AFv 12 uirorum V s. I . 13 utique om. A 14 suam BMV: sui AFQv 17 curam V 20 socraten V: socratem AFv 23 animas suas v Ii dederunt F II Si F corr. e Sed solam hominum memoriam se perpetuandos crediderunt, cum » hominis officium sit, perennem potius uitam quam perennem memoriam quaerere, non scribendo aut pugnando uel philosophando, sed pie sancte religioseque uiuendo. 
1.5	qui quidem error humanus litteris traditus in tantum ualuit, ut multos plane aemulos uel inanis philosophiae uel stultae illius uirtutis inue--nerit. 
1.6	unde facturus mihi operae pretium uideor, si uitam sanctissimi uiri, exemplo aliis mox futuram, perscripsero: quo utique ad ueram sapientiam et caelestem militiam diuinamque uirtutem legentes incitabuntur. in quo ita nostri quoque rationem commodi ducimus, ut non inanem ab hominibus memoriam, sed aeternum a Deo praemium exspectemus, quia etsi ipsi non ita uiximus, ut exemplo aliis esse possimus, dedimus tamen operam, ne is lateret qui esset imitandus. 
1.7	igitur sancti Martini uitam scribere exordiar, ut se uel ante episcopatum uel in episcopatu gesserit, quamuis nequaquam ad omnia illius potuerim peruenire: adeo ea, in quibus ipse tantum sibi conscius fuit, nesciuntur, quia laudem ab hominibus non requirens, quantum in ipso fuit, omnes uirtutes suas latere uoluisset quamquam etiam ex his, 
1.8	quae conperta nobis erant, plura omisimus, quia sufficere credidimus, si tantum excellentia notarentur: simul et legentibus consulendum fuit, ne quod his pareret copia congesta fastidium. 
1.9	obsecro autem eos qui lecturi sunt, ut fidem dictis adhibeant, neque me quicquam nisi conpertum et probatum scripsisse arbitrentur: alioquin tacere quam falsa dicere maluissem. 
2.1	Igitur Martinus Sabaria Pannoniarum oppido oriundus fuit, sed intra Italiam Ticini altus est, parentibus secundum saeculi dignitatem non infimis, gentilibus tamen. 
2.2	pater eius miles primum, post tribunus militum fuit. ipse armatam militiam m adulescentia secutus inter scolares alas sub rege Constantio, deinde sub Iuliano Caesare militauit: non tamen sponte, quia a 3 philosofando V 5 humanis codd. aliquot prob. Vonckio H plane V pr. m.: tamen AFQ et corr. V 6 inanes philosofiae V 12 praemium om. Fpr. m . 13 aliis exemplo v 15 ut se MV: utq; F, ut quae Q, et quae Av 21 excellentia AFQV: excellentiora v 26 Sabaria BV et corr. F: sabariae AF1 Qv 1\\ Pannoniorum dett . || oppido om. v 27 alitus ABF\\ aletus V corr . (altus pr. m.) 28 milex V, item p. 112, 20 30 alas F partifn in ras. m. 2 || Constantino v 31 sponte A in marg . - primis fere annis diuinam potius seruitutem sacra inlustris pueri spirauit infantia. 
2.3	nam cum esset annorum decem, inuitis parentibus ad ecclesiam confugit seque catechumenum fieri postulauit. 
2.4	mox mirum in modum totus in Dei opere conuersus, cum esset annorum duodecim, eremum concupiuit, fecissetque uotis satis, si aetatis infirmitas non obstitisset. animus tamen aut circa monasteria aut circa ecclesiam semper intentus meditabatur adhuc in aetate puerili, quod postea deuotus inpleuit. 
2.5	sed cum edictum esset a regibus, ut ueteranorum filii ad militiam scriberentur prodente patre, qui felicibus eius actibus inuidebat, cum esset annorum quindecim, captus et catenatus sacramentis militaribus inplicatus est, uno tantum seruo comite contentus, cui tamen uersa uice dominus seruiebat, adeo ut plerumque ei et calciamenta ipse detraheret et ipse detergeret, cibum una caperent, hic tamen saepius ministraret. 
2.6	triennium fere ante baptismum in armis fuit, integer tamen ab iis uitiis, quibus illud hominum genus inplicari solet. 
2.7	multa illius circa commilitones benignitas, mira caritas, patientia uero adque humilitas ultra humanum modum. nam frugalitatem in eo laudari non est necesse, qua ita usus est, ut iam illo tempore non miles, sed monachus putaretur. pro quibus rebus ita sibi omnes commilitones deuinxerat, ut eum miro adfectu uenerarentur. 
2.8	necdum tamen regeneratus in Christo agebat quendam bonis operibus baptismi candidatum: adsistere scilicet laborantibus, opem ferre miseris, alere egentes, uestire nudos, nihil sibi ex militiae stipendiis praeter cotidianum uictum reseruare: iam tum euangelii non surdus auditor de crastino non cogitabat. 1 diuina p. seruitute Fv 2 inspirauit FQ et corr. V II duodecim V 3 cathecuminum F, catichumenum Q, caticuminum AF et sic fere semper in hoc nomine 4 opus A 5 heremum AF et Ric fere semper 6 non fuieset inpedimento V solus ex notis II tamen] eius add. in \'F m. 2 II tamen circa v 10 eius om. V 11 captus BMV: raptus AFQv 14 calceamenta (om . ipse) detraheret v 15 tamen om. AFQ 16 baptismum BMV: baptisma AFv II ab his AFQV 17 illius BV: illi AFv, 19 laudari ABFV: laudare v 20 qua F rasura ex quia 21 pro V: om. AFv II commilitones suos AFv 23 quędam Fpr. m . II baptismi F: baptismatis AFv 24 alere egentes] eregenes F 26 reseruare MV (item F, sed hic re in ras. ex reseruans ut uidetur): reseruabat AQ, reseruans 2 codd. Giselini 
3.1	Quodam itaque tempore, cum iam nihil praeter arma et simplicem militiae uestem haberet, media hieme, quae solito asperior inhorruerat, adeo ut plerosque uis algoris extingueret, obuium habet in porta Ambianensium ciuitatis pauperem nudum: qui cum praetereuntes ut sui misererentur oraret omnesque miserum praeterirent, intellexit uir Deo plenus sibi illum, aliis misericordiam non praestantibus, reseruari. quid tamen ageret? 
3.2	nihil praeter chlamydem, qua indutus erat, habebat: iam enim reliqua in opus simile consumpserat. arrepto itaque ferro, quo accinctus erat, mediam diuidit partemque eius pauperi tribuit, reliqua rursus induitur. interea de circumstantibus ridere nonnulli, quia deformis esse truncatus habitu uideretur: multi tamen, quibus erat mens sanior, altius gemere, quod nihil simile fecissent, cum utique plus habentes uestire pauperem sine sua nuditate potuissent. 
3.3	nocte igitur insecuta, cum se sopori dedisset, uidit Christum chlamydis suae, qua pauperem texerat, parte uestitum. intueri diligentissime Dominum uestemque, quam dederat, iubetur agnoscere. mox ad angelorum circumstantium multitudinem audit Iesum clara uoce dicentem: Martinus adhuc catechumenus hac me ueste contexit. 
3.4	uere memor Dominus dictorum suorum, qui ante praedixerat: quamdiu fecistis uni ex minimis istis, mihi fecistis, se in paupere professus est fuisse uestitum: et ad confirmandum tam boni operis testimonium in eodem se habitu, quem pauper acceperat, est dignatus ostendere. 
3.5	1 quo uiso uir beatissimus non in gloriam est elatus humanam, sed bonitatem Dei in suo opere cognoscens, cum esset annorum 21 Matth. 25, 40. 1 igitur F 2 uestimentum V 3 obuiam F 4 anbianensium V, ambiamensium A 7 nihil] add. in V a. l. m . 2 quia 8 clamydem V, clamidem AF, item infra u. 16 clamydis et clamidis eidem || enim om. V 11 risere F, sed se ex corr . 12 esse Y: esse et AF, esset et v II habitus F corr . II tamen Y: quidem AF 13 sanctior V solus ex notis; cf. infra c. 9, 4 II gemuere F corr. et Q 15 uidet A pr. m. et V 16 contexerat 1 cod. Gisel . 17 uestem quam A 19 cathecuminus V 21 quae F II fecestes V, haec fecistis AFv (haec BM quoque om.) 22 pauperem Y 25 uisu F 26 annorum XXII Y; at habet Paulinus quoque, quem citauit de Prato: Quattuor a lustris geminos minus egerat annos 8 duodeuiginti, ad baptismum conuolauit. nec tamen statim militiae renuntiauit, tribuni sui precibus euictus, cui contubernium familiare praestabat: etenim transacto tribunatus sui tempore renuntiaturum se saeculo pollicebatur. qua Martinus expectatione suspensus per biennium fere posteaquam est baptismum consecutus, solo licet nomine, militauit. 
4.1	 Interea inruentibus intra Gallias barbaris Iulianus Caesar coacto in unum exercitu apud Vangionum ciuitatem donatiuum coepit erogare militibus, et, ut est consuetudinis, singuli citabantur, donec ad Martinum uentum est. 
4.2	tum uero oportunum tempus existimans, quo peteret missionem — neque enim integrum sibi fore arbitrabatur, si donatiuum non militaturus acciperet —, hactenus, inquit ad Caesarem, militaui tibi: 
4.3	patere ut nunc militem Deo: donatiuum tuum pugnaturus accipiat, Christi ego miles sum: pugnare mihi non licet. 
4.4	tum uero aduersus hanc uocem tyrannus infremuit dicens, eum metu pugnae, quae postero die erat futura, non religionis gratia detractare militiam. 
4.5	 at Martinus intrepidus, immo inlato sibi terrore constantior, si hoc, inquit, ignauiae adscribitur, non fidei, crastina die ante aciem inermis adstabo et in nomine Domini Iesu, signo crucis, non clipeo protectus aut galea, hostium cuneos penetrabo securus. 
4.6	 retrudi ergo in custodiam iubetur, facturus fidem dictis, ut inermis barbaris obiceretur. 
4.7	postero die hostes legatos de pace miserunt, sua omnia seque dedentes. unde quis dubitet hanc uere beati uiri fuisse uictoriam, cui praestitum sit, ne inermis ad proelium mitteretur. 
4.8	et quamuis pius Dominus seruare militem suum licet inter hostium gladios et tela potuisset, tamen ne uel aliorum mortibus sancti uiolarentur obtutus, exemit pugnae necessitatem. 
4.9	neque enim aliam pro milite suo Christus debuit 1 baptisma AF, item u. 5 || tamen om. FQ 6 licet V et meUores Giselini: scilicet ABF 7 irrumpentibus 1 cod. Gis . 8 uuangionum F 9 et ut BMV: ut AF*v, utque F corr . [J recitabantur F 10 opportunum v 11 remisBionem Y 14 militaturus Gisel. ex tribus suis libris et v 15 aduersum F 16 postera AFv 17 detrectare AFv 21 clypeo FVv II cuneis Fpr. m . 22 custodia A 23 obieceretur V 11 postera Fv 24 seque AFMV: seseque v 25 ne om. F pr. m . 27 licet] etiam F sed tn ras . manu receuti 28 mortibus Y: morte AFv 1\\ uiolaretur B praestare uictoriam, quam ut subactis sine sanguine hostibus nemo moreretur. 
5.1	Exinde relicta militia sanctum Hilarium Pictauae episcopum ciuitatis, cuius tunc in Dei rebus spectata et cognita fides habebatur, expetiit et aliquamdiu apud eum commoratus est. 
5.2	temptauit autem idem Hilarius inposito diaconatus officio sibi eum artius inplicare et ministerio uincire diuino. sed cum saepissime restitisset, indignum se esse uociferans, intellexit uir altioris ingenii, . uno eum modo posse constringi, si id ei officii imponeret, in quo quidam locus iniuriae uideretur: itaque exorcistam eum esse praecepit. quam ille ordinationem, ne despexisse tamquam humiliorem uideretur, non repudiauit. 
5.3	nec multo post admonitus per soporem, ut patriam parentesque, quos adhuc gentilitas detinebat, religiosa sollicitudine uisitaret, ex uoluntate sancti Hilari profectus est, multis ab eo obstrictus precibus et lacrimis ut rediret. maestus, ut ferunt , peregrinationem illam ingressus est, contestatus fratribus, multa se aduersa passurum: quod postea probauit euentus. 
5.4	ac primum inter Alpes deuia secutus incidit in latrones. cumque unus securi eleuata in caput eius librasset ictum, ferientis dexteram sustinuit alter: uinctis tamen post tergum manibus uni adseruandus et spoliandus traditur. qui cum eum ad remotiora duxisset, percontari ab eo coepit, quisnam esset. respondit Christianum se esse. 
5.5	quaerebat etiam ab eo an timeret. tum uero constantissime profitetur, numquam se tam fuisse securum, quia sciret misericordiam Domini maxime in temptationibus adfuturam: se magis illi dolere, qui Christi 3 pictaniae F corr. m . 2 (episoopum pictauae A) 4 erpectata AM, inclita spectata F 5 expetiuit AFv II aliquantum V, scd ntum in litura 6 diaconatos MY: diaconii AFv 7 implicari et m. uinciri Q 8 uir AV: uir Dei FQ 9 uno BY: hoc AFv II id » officii Y 11 praecipit V || dispexisset Y 12 multS AF 15 hilarii V corr. AFv || multia BY: multisque AFv II obstrictos ABFMQV: adstrictus Gisel. ex tribus suis et v 17 ingressus V: adgressus AFv II fratribus HMV: fratres AFv 18 ac om. F in rasura 19 secarim eleuatam Av 20 deiteram B d alii pauci (etiam duo Traiectini Vonckii): dextera AVv, dexterae FQ 21 postergum AF II adseraandus Y: ad aeruandum B, seraandus AFv II spoliandus F: spoliandum B, custodiendus AFM 22 percunctari MV 24 foisse tam v 26 sed magis Y teete de Prato || illi AV et Ubri fere omnes: ilia F II condolere deit. pauci 8* misericordia utpote latrocinia exercens esset indignus. 
5.6	ingressusque euangelicam disputationem uerbum Dei latroni praedicabat. quid longius morer? latro credidit prosecutusque Martinum uiae reddidit, orans ut pro ae Dominum precaretur. idemque postea religiosam agens uitam uisus est, adeo ut haec, quae supra rettulimus, ex ipso audita dicantur. 
6.1	 Igitur Martinus inde progressus cum Mediolanum praeterisset, diabolus in itinere, humana specie adsumpta, se ei obuiam tulit, quo tenderet quaerens. cumque id a Martino responsi accepisset, se quo Dominus uocaret intendere, ait ad eum: 
6.2	quocumque ieris uel quaecumque temptaueris, diabolus tibi aduersabitur. tunc ei prophetica uoce respondens, Dominus mihi, inquit, adiutorest: non timebo, quid faciat mihi homo. statimque de conspectu eius inimicus euanuit. 
6.3	itaque ut animo ac mente conceperat, matrem a gentilitatis absoluit errore, patre in malis perseuerante: plures tamen suo saluauit exemplo. 
6.4	 Dehinc cum haeresis Arriana per totum orbem et maxime intra Illyricum pullulasset, cum aduersus perfidiam sacerdotum solus paene acerrime repugnaret multisque suppliciis esset adfectus—nam et publice uirgis caesus est et ad extremum de ciuitate exire conpulsus — Italiam repetens, cum intra Gallias quoque discessu sancti Hilari, quem ad exilium haereticorum uis coegerat, turbatam ecclesiam comperisset, Mediolani sibi monasterium statuit. ibi quoque eumAuxentius, auctor et princeps Arrianorum, grauissime insectatus est, multisque adfectum iniuriis de ciuitate exturbauit. cedendum itaque tempori arbitratus ad 
6.5	 insulam, cui Gallinaria nomen est, secessit comite quodam 5 agere FMQ II adeo mei: om. v 6 ei BV: ab ÅFv 7 mediolanium V 8 itenere V (tales litterarum e et i in V confusiones posthac non omnes notabimus) II obuiam F 10 tendere M, eo tendere coni. de Prato 12 profiteca V II respondens — inquit BV: respondit AFv 13 homo mox statimque V II de MY: e AFv 14 ac AVi et F 15 a om AFv II —* peraenerantem V (patrem in malis pereenerantem reliquit F) 17 dehinc V: deindeAFc 18 cum adnersns — pugnaret Fin marg. m. 2 19 repugnaret BMF: pugnaret AFv 20 nam publice v 22 hilarii AFv et eorr. V || eii [limn — nirtntem] erectns (p. 117, 22): inclusa desunt in V, eum una scheda interciderit 27 cui gallinaria nomen est AFMQ: gallinariam nomine v presbytero, magnarum uirtutum uiro. hic aliquamdiu radicibus uixit herbarum: quo tempore helleborum, uenenatum, ut ferunt, gramen, in cibum sumpsit. 
6.6	sed cum uim ueneni in se grassantis uicina iam morte sensisset, imminens periculum oratione repulit statimque omnis dolor fugatus est. 
6.7	nec multo post, cum sancto Hilario comperisset regis paenitentia potestatem indultam fuisse redeundi, Romae ei temptauit occurrere profectusque ad urbem est. 
7.1	Cum iam Hilarius praeterisset, ita eum est uestigiis prosecutus: cumque ab eo gratissime fuisset susceptus, haut longe sibi ab oppido monasterium conlocauit, quo tempore se ei quidam catechumenus iunxit, cupiens sanctissimi uiri institui disciplinis: paucisque interpositis diebus languore correptus ui febrium laborabat. 
7.2	ac tum Martinus forte discesserat: et cum per triduum defuisset, regressus exanime corpus inuenit: ita subita mors fuerat, ut absque baptismate humanis rebus excederet. corpus in medio positum tristi maerentium fratrum frequentabatur officio, cum Martinus flens et eiulans accurrit. 
7.3	tum uero tota sanctum spiritum mente concipiens egredi cellulam, in qua corpus iacebat, ceteros iubet, ac foribus obseratis super exanimata defuncti fratris membra prosternitur. et cum aliquamdiu orationi incubuisset sen- . sissetque per spiritum Domini adesse uirtutem, erectus paululum et in defuncti ora defixus, orationis suae ac misericordiae Domini intrepidus expectabat euentum: uixque duarum fere horarum spatium intercesserat, uidet defunctum paulatim membris omnibus commoueri et laxatis in usum uidendi palpitare luminibus. 
7.4	tum uero magna ad Dominum uoce conuersus gratias agens 2 eleborum A, elebori * (i ex corr.) F II ferunt nt uenenatum Å 3 cibum] add. in F m. 2 suum 4 pepulit B 7 profectus (profectusq. corr. m . 2) 8 ad urbem F 9 Cumque iam uel Cum uero (autem) iam dett . II eum e uestigio cod. Berol. (Vorstii), eum e uestigiis est pros. non- nuUi libri GiseZini; exspectares potius: ita eius uestigia est pros. Paulinus habet: Ergo legens praegressa pio uestigia cursu etc . 10 gratantissime fuisse A 12 instrui coll. Berol . 13 paucis quippe AF II correptus est (add. m . 2 et) ui F 14 at tum M II post triduum fuisset regressus M 15 exanime corpus AFM: c. exanime v II subito Fpr. m . 17 tum F 18 tota sanctom spiritum (spir. sanctum F) AFM: sanctum spir. tota v 22 erectus] hic redit V 24 aduentum A 25 uidet ABF1V: uidit F corr. et v, et uidit (uel cum uidit) dett. pauci; at u. Chron. I, 38, 4. cellulam clamore conpleuerat: quo audito qui pro foribus adstiterant statim inruunt. mirum spectaculum, quod uidebant uiuere, quem mortuum reliquissent. 
7.5	ita redditus uitae, statim baptismum consecutus plures postea uixit annos, primusque apud nos Martini uirtutum uel materia uel testimonium fuit. 
7.6	idem tamen referre erat solitus, se corpore exutum ad tribunal iudicis ductum deputandumque obscuris locis et uulgaribus turbis tristem excepisse sententiam: tum per duos angelos iudici fuisse suggestum, hunc esse pro quo Martinus oraret: ita per eosdem angelos se iussum reduci, et Martino redditum uitaeque pristinae restitutum. 
7.7	 ab hoc primum tempore beati uiri nomen enituit, ut qui sanctus iam ab omnibus habebatur, potens etiam et uere apostolicus haberetur. 
8.1	 Nec multo post, dum agrum Lupicini cuiusdam honorati secundum saeculum uiri praeteriret, clamore et luctu turbae plangentis 
8.2	 excipitur, ad quam cum sollicitus adstitisset et quis esset hic fletus inquireret, indicatur unum ex familia seruulum laqueo sibi uitam extorsisse. quo cognito cellulam, in qua corpus iacebat, ingreditur, exclusisque omnibus turbis superstratus corpori aliquantisper orauit. 
8.8	mox uiuescente uultu, marcescentibus oculis in ora illius defunctus erigitur: lentoque conamine enisus adsurgere, adprehensa beati uiri dextera in pedes constitit: adque ita cum eo usque ad uestibulum domus, turba omni inspectante, processit. 
9.1	 Sub idem fere tempus ad episcopatum Turonicae ecclesiae petebatur: sed cum erui monasterio suo non facile posset, Rusticius quidam, unus e ciuibus, uxoris languore simulato ad genua illius prouolutus ut egrederetur obtinuit. 
9.2	ita dispositis iam in itinere ciuium turbis, sub quadam custodia ad ciuitatem usque deducitur. 1 adsisterant V 2 expectaculum F 3 baptisma AFv 6 corpore esse exutum V 7 deputandumque FMQV: deputatumque Av It et om. A II excipisse V et paulo post excepitur 10 redditum om. 1 cod. Gisel . 11 primum V: primo AFv 12 ab hominibus F 16 sollicitus cum v II adstitessit V, restitisset F 17 ei V: e AFv 20 uiuescente F pr. m.: uiuiscente AF2Vv 21 lenteoque V 25 Eodem fere teinpore martinus ad AF 26 monasterio AQV: a monasterio Fv II facile non v II possit AF, sed in F posset ead. m. corr . y rusticius V: rusticua BM, ruritius A, ruricius Fv mirum in modum incredibilis multitudo non solum ex illo oppido, sed etiam ex uicinis urbibus ad suffragia ferenda conuenerat. 
9.3	una omnium uoluntas, eadem uota eademque sententia, Martinum episcopatus esse dignissimum: felicem fore tali ecclesiam sacerdote. pauci tamen et nonnulli ex episcopis, qui ad constituendum antistitem fuerant euocati, impie repugnabant, dicentes scilicet, contemptibilem esse personam, indignum esse episcopatu hominem uultu despicabilem, ueste sordidum, crine deformem. 
9.4	ita a populo sententiae sanioris haec illorum inrisa dementia est, qui inlustrem uirum dum uituperare cupiunt praedicabant. nec uero aliud his facere licuit, quam quod populus Domino uolente cogitabat. inter episcopos tamen qui adfuerant praecipue Defensor quidam dicitur restitisse: unde animaduersum est grauiter illum lectione prophetica tum notatum. 
9.5	nam cum fortuito lector, cui legendi eo die officium erat, interclusus a populo defuisset, turbatis ministris, dum expectatur qui non aderat, unus e circumstantibus sumpto psalterio, quem primum uersum inuenit, arripuit. 
9.6	psalmus autem hic erat: ex ore infantium et lactantium perfecisti laudem propter inimicos tuos, ut destruas inimicum et defensorem. quo lecto clamor populi tollitur, pars diuersa confunditur. 
9.7	adque ita habitum est, diuino nutu psalmum hunc lectum fuisse, ut testimonium operis sui Defensor audiret, qui ex ore infantium adque lactantium, in Martino Domini laude perfecta, et ostensus pariter et destructus esset inimicus. 
10.1	Iam uero sumpto episcopatu qualem se quantumque praestiterit, non est nostrae facultatis euoluere. idem enim constantissime perseuerabat qui prius fuerat. 
10.2	eadem in corde eius 18 Ps. 8, 3. 2 conuenerant ABF 4 episcopatus V: episcopatu (— tu A) AFv; cf. p. 109, 6 II felicem om. A pr. m . 8 despicabilem F sed partim in rasura 2 m . dispicabilem QV 11 cogitabat V et cod. Laeii: cogebat AFv 13 quidam BMV: nomine quidam A, quidam nomine Fv II grauiter illum om. V 14 tam V: tunc AFv II fortuitu ABFM 15 eo die le- gendi A 18 hic om. v II lactantium F1QV (item infra u. 23): lactentium Av et corr. F 21 pars aduersa BM 23 qui MV: quia AFv II et A II lactentium Av 24 est (pro et) ostensus V 25 esset MV: est AFv 28 eadem in corde humilitas om. V, eius om. M humilitas, eadem in uestitu eius uilitas erat: adque ita, plenus auctoritatis et gratiae, inplebat episcopi dignitatem, ut non tamen propositum monachi uirtutemque desereret. 
