10.3	aliquandiu ergo adhaerenti ad ecclesiam cellula usus est: dein cum inquietudinem se frequentantium ferre non posset, duobus fere extra ciuitatem milibus monasterium sibi statuit. 
10.4	qui locus tam secretus et remotus erat, ut eremi solitudinem non desideraret. ex uno enim latere praecisa montis excelsi rupe ambiebatur, reliquam planitiem Liger fluuius reducto paululum sinu clauserat: una tantum eademque arta admodum uia adiri poterat. ipse ex lignis contextam cellulam habebat, multique ex fratribus in eundem modum: 
10.5	plerique saxo superiecti montis cauato receptacula sibi fecerant. discipuli fere octoginta erant, qui ad exemplum beati magistri instituebantur. 
10.6	nemo ibi quicquam proprium habebat, omnia in medium conferebantur. non emere aut uendere, ut plerisque monachis moris est, quicquam licebat, ars ibi exceptis scriptoribus nulla habebatur, cui tamen operi minor aetas deputabatur: maiores orationi uacabant. 
10.7	rarus cuiquam extra cellulam suam egressus, nisi cum ad locum orationis conueniebant. cibum una omnes post horam ieiunii accipiebant. uinum nemo nouerat, nisi quem infirmitas coegisset. 
10.8	plerique camelorum saetis uestiebantur: mollior ibi habitus pro crimine erat. quod eo magis sit mirum necesse est, quod multi inter eos nobiles habebantur, qui longe aliter educati ad hanc se humilitatem et patientiam coegerant: pluresque ex eis postea episcopos uidimus. 
10.9	quae enim esset ciuitas aut ecclesia, quae non sibi de Martini monasterio cuperet sacerdotem? 2 episcopii F II ut om. V 3 ergo] uero Q II adhaerente v 4 deinde Fv 5 se MV: om. AFv II ciuitate V 7 erimi V, heremi AF 8 excelsi BMV: excelsa AF 11 multique BMV: multi quidem AFv || ex V: e AFv II in eundem — cauato om. F pr. m . 12 saxo (non cx saxo) Bupertecti montis caua Y 13 fere BMV: uero AFv 14 in medio Fv 16 quisquam F corr. 2 m. ex cuiquam 18 suam ABFMQ: om. V, fuit dett. pauci et v 19 unil A 21 camellorum Y II saetis Y: setis AFtJ 22 sit om. V II mirandum duo lHbri Gisel . 24 edocati V 25 eis V: his AFv II post episcopatopos Y, sed siem . 2 in rasura (praeter syllabam extremam) 26 non sibi — cuperet sacerdotem BMV: non sibi (corr. e se) — cuperet sacerdotes Q, non — cuperet sacerdos A, non se — cuperet ■ sacerdotes habere Fv 
11.1	Sed ut reliquas uirtutes eius, quas in episcopatu egit, adgrediar, erat haut longe ab oppido proximus monasterio locus, quem falsa hominum opinio, uelut consepultis ibi martyribus, sacrauerat: 
11.2	nam et altare ibi a superioribus episcopis constitutum habebatur. sed Martinus non temere adhibens incertis fidem, ab his, qui maiores natu erant, presbyteris uel clericis flagitabat nomen sibi martyris, tempus passionis ostendi: grandi se scrupulo permoueri, quod nihil certi constans sibi maiorum memoria tradidisset. 
11.3	cum aliquandiu ergo a loco illo se abstinuisset, nec derogans religioni, quia incertus erat, nec auctoritatem suam uulgo adcommodans, ne superstitio conualesceret, quodam die paucis secum adhibitis fratribus ad locum pergit. 
11.4	dehinc super sepulchrum ipsum adstans orauit ad Dominum, ut quis esset uel cuius meriti esset sepultus ostenderet. tum conuersus ad laeuam uidet prope adsistere umbram sordidam, trucem: imperat nomen meritumque loqueretur. nomen edicit, de crimine confitetur: latronem se fuisse, ob scelera percussum, uulgi errore celebratum: sibi nihil cum martyribus esse commune, cum illos gloria, se poena retineret. 
11.5	mirum in modum uocem loquentis qui aderant audiebant, personam tamen non uidebant. tum Martinus quid uidisset exposuit iussitque ex eo loco altare, quod ibi fuerat, submoueri, adque ita populum superstitionis illius absoluit errore. 
12.1	Accidit autem insequenti tempore, dum iter ageret, ut gentilis cuiusdam corpus, quod ad sepulchrum cum superstitioso funere deferebatur, obuium haberet: conspicatusque eminus uenientium turbam, quidnam id esset ignarus, paululum stetit: nam fere quingentorum passuum interuallum erat, ut difficile fuerit dinoscere quid uideret. 
12.2	tamen quia rusticam manum cerneret et 1 cius AF: c... V, et V corr . 2 monasterio BMV: monasterii AFv 6 sibi nomen v II tempus V: tempora AFQ, uel tempora v 10 religionem V haud scio an recte 11 quadam A 12 dehinc V: dein A, deinde Fv 13 esset om. B 14 esset sepultus BV: esset om. AFv 15 uidet AV: uidit Fv II prope om. V II erucem V, actrucem F m. 2 16 loqueretur V: ut loqueretur AFv, ut BM ante nomen habent 19 hnmodum V, item 122, 6 20 tamen om. A 26 obuiam F 27 id om. A II paulolum F || nam tum fere F, nam cum fere Q 28 difficile ei coni. de Prato 29 dinoscere mei: dignoscere v agente uento lintea corpori superiecta uolitarent, profanos sacrificiorum ritus agi credidit: quia esset haec Gallorum rusticis consuetudo, simulacra daemonum candido tecta uelamine misera per agros suos circumferre dementia. 
12.3	leuato ergo in aduersos signo crucis imperat turbae non moueri loco onusque deponere. hic uero mirum in modum uideres miseros primum uelut saxa riguisse. 
12.4	 dein, cum promouere se summo conamine niterentur, ultra accedere non ualentes ridiculam in uertiginem rotabantur, donec uicti corporis onus ponunt: attoniti et semet inuicem aspicientes, quidnam sibi accidisset, taciti cogitabant. 
12.5	sed cum beatus uir conperisset exequiarum esse illam frequentiam, non sacrorum, eleuata rursum manu dat eis abeundi et tollendi corporis potestatem. ita eos et cum uoluit, stare conpulit, et cum libuit, abire permisit. 
13.1	 Item, cum in uico quodam templum antiquissimum diruisset et arborem pinum, quae fano erat proxima, esset adgressus excidere, tum uero antistes loci illius ceteraque gentilium turba coepit obsistere. 
13.2	et cum idem illi, dum templum euertitur, imperante Domino quieuissent, succidi arborem non patiebantur. ille eos sedulo commonere, nihil esse religionis in stipite: Deum potius, cui seruiret ipse, sequerentur: arborem illam succidi oportere, quia esset daemoni dedicata. 
13.3	tum unus ex illis qui erat audacior ceteris: si habes, inquit, aliquam de Deo tuo, quem dicis te colere, fiduciam, nosmet ipsi succidemus hanc arborem, tu ruentem excipe: et si tecum est tuus, ut dicis, Dominus, euades. 
13.4	tum ille intrepide confisus in Domino facturum se pollicetur. hic uero ad istius modi condicionem omnis illa gentilium 1 lintea BMV: linteamina AFo; Pauiinus habet: Et trcmefacta leui motantnr lintea uento II corporis F 4 leuato BMV: eleuato AFv II ad- , uersoa BF: aduerso Fr, adnersil A 7 cum primo moucre AFQ 8 uicti ABFMQ: uincti V, uicti pondere Giselinus ex suis 9 pouunt BMV: deponunt AFv II aspicientea MV: aspectantes AFv (de lectione codicis V errauit de Prato) 10 cogitantes A II beatus uir cum v 12 manum V 15 cum BMV: dum AFv 16 aggrcssus esset A 17 antistites V, antestites F 18 coeperont M II iidem v II inpcrante AF 21 scruirent ipsi V II succidi V: excidi AFv 22 daemoniis F II tum om. V unua ex illis V: unus ex his AFQ, ex illis unus v 24 succidimus ALFV 26 intrepidus M 27 omnes V turba consensit, facilemque arboris suae habuere iacturam, si inimicum sacrorum suorum casu illius obruissent. 
13.5	itaque cum unam in partem pinus illa esset adclinis, ut non esset dubium, quam in partem succisa corrueret, eo loci uinctus statuitur pro arbitrio rusticorum, quo arborem esse casuram nemo dubitabat. 
13.6	 succidere igitur ipsi suam pinum cum ingenti gaudio laetitiaque coeperunt. aderat eminus turba mirantium. iamque paulatim nutare pinus et ruinam suam casura minitari. 
13.7	pallebant eminus monachi et periculo iam propiore conterriti spem omnem fidemque perdiderant, solam Martini mortem expectantes. 
13.8	at ille confisus in Domino intrepidus opperiens, cum iam fragorem sui pinus concidens edidisset , iam cadenti, iam super se ruenti, eleuata obuiam manu, signum salutis opponit. tum uero — uelut turbinis modo retro actam putares — diuersam in partem ruit, adeo ut rusticos, qui tuto in loco steterant, paene prostrauerit. 
13.9	 tum uero in caelum clamore sublato gentiles stupere miraculo, monachi flere prae gaudio, Christi nomen in commune ab omnibus praedicari: satisque constitit eo die salutem illi uenisse regioni. nam nemo fere ex inmani illa multitudine gentilium fuit, qui non impositione manus desiderata Dominum Iesum, relicto . impietatis errore, crediderit. et uere ante Martinum pauci admodum, immo paene nulli in illis regionibus Christi nomen receperant: quod adeo uirtutibus illius exemploque conualuit, ut iam ibi nullus locus sit, qui non aut ecclesiis frequentissimis aut monasteriis sit repletus. nam ubi fana destruxerat, statim ibi aut ecclesias aut monasteria construebat. 
14.1	Nec minorem sub idem fere tempus eodem in opere uirtutem edidit. nam cum in uico quodam fano antiquissimo et celeberrimo ignem inmisisset, in proximam, immo adhaerentem domum 1 consentit AFv 2 cum om. F pro m. 4 loci V: loco AFv 7 itaque F 8 casura ̄ F s. l. m. 2 || minitari coepit F 10 Ac A 11 in dominum V, at u. suprac. 12, 4 II operiens A || sui F corr . e auę ut uidetur 12 iam super] et super V, sed et in ras. manu antiqua II elenat o. manum AFQ 13 uelut V: om. AFv 15 tuto loco v || steterant — semper (p. 124,11) desunt in V una scheda amissa 18 constat B 20 impositionem manuum desideraret et domino Jesu B 24 frequentissimus dett., om. M 29 iniecisset BM 1\\ malim in adhaerentem domum, cum uerba proiimam immo glossam sapiant \' agente uento flammarum globi ferebantur. 
14.2	quod ubi Martinus aduertit., rapido cursu tectum domus scandit, obuium se aduenientibus flammis inferens. tum uero mirum in modum cerneres contra uim uenti ignem retorqueri, ut compugnantium inter se elementorum quidam conflictus uideretur. ita uirtute Martini ibi tantum ignis est operatus, ubi iussus est. 
14.3	In uico autem, cui Leprosum nomen est, cum itidem templum opulentissimum superstitione religionis uoluisset euertere, restitit ei multitudo gentilium, adeo ut non absque iniuria sit repulsus. 
14.4	itaque secessit ad proxima loca, ibique per triduum cilicio tectus et cinere, ieiunans semper adque orans, precabatur ad Dominum, ut, quia templum illud euertere humana manus non potuisset, uirtus illud diuina dirueret. 
14.5	tum subito ei duo angeli hastati adque scutati instar militiae caelestis se obtulerunt, dicentes missos se a Domino, ut rusticam multitudinem fugarent praesidiumque Martino ferrent, ne quis, dum templum dirueretur, obsisteret: rediret ergo et opus coeptum deuotus impleret. 
14.6	ita regressus ad uicum, inspectantibus gentilium turbis et quiescentibus , dum profanam aedem usque ad fundamenta dirueret, aras omnes adque simulacra redegit in puluerem. 
14.7	quo uiso rustici, cum se intellegerent diuino nutu obstupefactos adque perterritos, ne episcopo repugnarent, omnes fere Iesum Dominum crediderunt, clamantes palam et confitentes, Deum Martini colendum, idola autem neclegenda, quae nec sibi nec aliis adesse possent. 2 obuiam F 6 operatus est F 7 leprosus A, lcbrosum cud. Berol. (Vorstii), libroso M, librosso cod. Jureti, librasao B, fort . Leproso (Giselinus tacet de suis libris) 1\\ itidem BM: idem AFv II superstitiosae religionis B et 2 codd. Gisel . 11 a Domino v 12 illut V || manus BV: manu AFv; contulit de Prato Greg. Turon. h. Franc. VIII, 12: dininam misericordiam.. flagitabat, ut quia id (BC. simulacrum) humana industria euertere non ualeret, uirtus illud diuina destrueret 16 rediret] dum iret V 17 ergo opus incoeptum F II deuotum v 18 spectantibus M, expeetantibus BV 19 fundamenta F sed ultima a in ras., fundamentum v 22 fere om. Fpr. m . || Iesum MV: in Jesum AFv (in dominum J. F) 1clamantesque F 23 dominum VI II autem V: om. AFv \\I neglegenda AF 24 nec sibi nec aliis adesse de Prato: nec sibi adesse V, sibi adesse non reU. et v; cf. Greg. Turon. h. Fr. II, 29 nihil sunt dii quos colitis, qui neque sibi neque aliis potuerunt subuenire, et II, 31 coepit ei insinuare ut.. idola negligeret, quae neque sibi neque aliis prodesse possent 1\\ posset V, possunt A 
15.1	Quid etiam in pago Aeduorum gestum sit, referam. ubi dum templum itidem euerteret, furens gentilium rusticorum in eum inruit multitudo. cumque unus audacior ceteris stricto eum gladio peteret, reiecto pallio nudam ceruicem percussuro praebuit. 
15.2	nec cunctatus ferire gentilis, sed cum dexteram altius extulisset, resupinus ruit, consternatusque diuino metu ueniam precabatur. 
15.3	nec dissimile huic fuit illud. cum eum idola destruentem cultro quidam ferire uoluisset, in ipso ictu ferrum ei de manibus excussum non conparuit. 
15.4	plerumque autem contra dicentibus sibi rusticis, ne eorum fana destrueret, ita praedicatione sancta gentiles animos mitigabat, ut luce eis ueritatis ostensa ipsi sua templa subuerterent. 
16.1	Curationum uero tam potens in eo gratia erat, ut nullus fere ad eum aegrotus accesserit, qui non continuo receperit sanitatem: quod uel ex consequenti liquebit exemplo. 
16.2	Treueris puella quaedam dira paralysis aegritudine tenebatur, [ita] ut iam per mul-, tum tempus nullo ad humanos usus corporis officio fungeretur: omni ex parte praemortua uix tenui spiritu palpitabat. 
16.3	tristes ad . solam funeris expectationem adstabant propinqui, cum subito ad ciuitatem illam Martinum uenisse nuntiatur. quod ubi puellae pater conperit, cucurrit exanimis pro filia rogaturus. 
16.4	et forte Martinus iam ecclesiam fuerat ingressus. ibi inspectante populo multisque aliis praesentibus episcopis, eiulans senex genua eius amplectitur dicens: filia mea moritur misero genere languoris, et quod ipsa est morte crudelius, solo spiritu uiuit, iam carne praemortua. rogo ut eam adeas adque benedicas: confido enim quod per te reddenda sit sanitati. 
16.5	qua ille uoce confusus obstipuit et refugit dicens, hoc suae non esse uirtutis: senem errare iudicio, non esse se dignum, per quem Dominus signum uirtutis 2 itidem om. V II euertet Ã 4 proiecto M II percussuro AJBFV: percussori v 7 fuit illut V, illud fuit Ã 10 fana eorum v || gentiles V: gentilium AFv 15 liquebat V [I Triberis V 16 ita om. V 19 adstabant BMV: adaistebant AFv 20 ad ciuit. illam martinum uenisse nuntiatur V: nuntiatur ad ciu. illam uenisse mart. AFv 21 pater puellae r H currit AFQ II exanimis mei: exanimi v 22 spectante BM, expectante V, cf. supra c. 14, 6 23 episcopis praesentibus AFv II heiulans AF II illius 26 eam adeasBM: eas adeam - V, sed sicm. 2 in litura, ad eam nenias AF (sed in F rasura corr . eaa) 27 obstipuit V: obstupuit AFv ostenderet. perstare uehementius flens ater pater et orare ut exanimem uisitaret: 
16.6	postremo a circumstantibus episcopis ire conpulsus descendit ad domum puellae. ingens turba pro foribus expectabat, ; 
16.7	 quidnam Dei seruus esset facturus. ac primum quae erant illius familiaria in istius modi rebus arma, solo prostratus orauit. deinde aegram intuens dari sibi oleum postulat: quod cum benedixisset, in os puellae uim sancti liquoris infundit, statimque uox reddita est. 
16.8	tunc paulatim singula contactu eius coeperunt membra uiuescere , donec firmatis eressibus gressibus populo teste surrexit. 
17.1	 Eodem tempore Taetradii cuiusdam proconsularis uiri seruus daemonio correptus dolendo exitu cruciabatur. rogatus ergo Martinus, ut ei manum inponeret, deduci eum ad se iubet: sed nequam spiritus nullo proferri modo de cellula, in qua erat, potuit: ita in aduenientes rabidis dentibus saeuiebat. 
17.2	tum Taetradius ad genua beati uiri aduoluitur, orans ut ad domum, in qua daemoniacus habebatur, ipse descenderet. tum uero Martinus negare se profani et gentilis domum adire posse: 
17.3	nam Taetradius eo tempore adhuc gentilitatis errore implicitus tenebatur. spondet ergo se, si de puero daemon fuisset exactus, Christianum fore. 
17.4	ita Martinus inposita manu puero inmundum ab eo spiritum eiecit. quo uiso Taetradius Dominum Iesum credidit: statimque catechumenus factus nec multo post baptizatus est, semperque Martinum salutis suae auctorem miro coluit affectu. 
17.5	 Per idem tempus in eodem oppido ingressus patris familias cuiusdam domum, in limine ipso restitit dicens, horribile in atrio domus daemonium se uidere. cui cum ut discederet imperaret et 3 expectans AFV haud scio an recte, malim tamen: ingens stat turba.. expectans (erat autem ingens t. — expectans M, ubi i. t. p. f. expectans aderat B) 4 acturus A 5 in om. V 7 infundit V: infudit AFv 8 ante singula in V uox erasa est || coeperant A II uiuescere ABF1: uiuiscere V add . re manu antiqua, reuiuiscere F corr., uiuiscere v 10 Eodemque F, Eodem quoquae A || taetradii V: tetradii AFv et sic deinceps 12 manus F II ne qua ̃ ∗∗∗ F 13 de (non ex) cellula V: de ea cellula M, ex cella AFv 15 daemonicus V pr. m . 16 uero om. V 17 eo tempore BM: eodem tempore AFVv 18 spondit FV, spopondit F corr . II igitur v 20 ab eo om. Fpr. m . 21 domino diu V, dominum nostrum J. AF 22 multum AF 24 in eo V 25 horribi- lem in atrii V 26 descenderet V II et patrem familias V: cocum patris familias BMt quendam e familia AFv patrem familias, qui in interiore parte aedium morabatur, arripuisset, saeuire dentibus miser coepit, et obuios quosque laniare. commota domus, familia turbata, populus in fugam uersus: Martinus se furenti obiecit, ac primum stare ei imperat. 
17.6	sed cum dentibus fremeret hiantique ore morsum minaretur, digitos ei Martinus in os intulit: si habes, inquit, aliquid potestatis, hos deuora. 
17.7	tum uero, ac si candens ferrum faucibus accepisset, longe reductis dentibus digitos beati uiri uitabat attingere: et cum fugere de obsesso corpore poenis et cruciatibus cogeretur nec tamen exire ei per os liceret, foeda relinquens uestigia fluxu uentris egestus est. 
18.1	Interea cum de motu adque impetu barbarorum subita ciuitatem fama turbasset, daemoniacum ad se exhiberi iubet: imperat ut, an uerus esset hic nuntius, fateretur. 
18.2	tum confessus est decem daemonas secum fuisse, qui rumorem hunc per populum dispersissent, ut hoc saltim metu ex illo Martinus oppido fugaretur: barbaros nihil minus quam de irruptione cogitare. ita cum haec inmundus spiritus in media ecclesia fateretur, metu et turbatione praesenti ciuitas liberata est. 
18.3	Apud Parisios uero, dum portam ciuitatis illius magnis secum turbis euntibus introiret, leprosum miserabili facie horrentibus cunctis osculatus est adque benedixit, statimque omni malo emundatus. 
18.4	postero die ad ecclesiam ueniens nitenti cute gratias pro sanitate, quam receperat, agebat. nec praetereundum est, quod fimbriae uestimento eius cilicioque detractae crebras super infirmantibus egere uirtutes. 
18.5	nam digitis inligatae aut collo inditae saepe ab aegrotantibus morbos fugauerunt.\' 1 arripuisset V: arripuit AFv 2 quosque AMV: quoscumque Fv II laniaret V 5 morsu V II minitaretnr A, minabatur FQ 10 ei exire A 1\\ reliquens V 11 egressus est M 12 metu AFQ, at u. Paulinus: Barbaricos adfert fama improba motus etc . II ciues V solus ex notis . 13 turbasset fama A II exiberi V 14 tunc AVv 15 decem de Prato: decim V, sedecim AFv || daemones Av et corr. F II secum V: om. reU. et v; cf. de Prato ad h. I . 16 dispersissent BMV: disseminassent AFv II saltim mei: saltem v et sic aliqs 17 minus] omnino V II de inruptione V: inruptionem AFv 18 media in AFv 20 aput parios V 23 emundatus AJBFV: emundatus est c 24 nec BMV: sed nec (ne F) hoc AFv 25 uestimento BM: uestimenti AFVv, uestimentis de Prato II malim cilicioue (cilicio F pr . m.) 26 nam digitis — inditae V: nam 
19.1	 Arborius autem, uir praefectorius, sancti admodum et fidelis ingenii, cum filia eius grauissimis quartanae febribus ureretur, epistulam Martini, quae casu ad eum delata fuerat, pectori puellae in ipso accessu ardoris inseruit, statimque fugata febris est. 
19.2	quae res apud Arborium in tantum ualuit, ut statim puellam Deo uouerit et perpetuae uirginitati dicarit: profectusque ad Martinum puellam ei, praesens uirtutum eius testimonium, quae per absentem licet curata esset, obtulit, neque ab alio eam quam a Martino habitu uirginitatis inposito passus est consecrari. 
19.3	 Paulinus magni uir postmodum futurus exempli, cum oculum grauiter dolere coepisset et iam pupillam eius crassior nubes superducta texisset, oculum ei Martinus penicillo contigit pristinamque ei sanitatem sublato omni dolore restituit. 
19.4	ipse autem cum casu quodam esset de cenaculo deuolutus et per confragosos scalae gradus decidens multis uulneribus esset adfectus, cum exanimis iaceret in cellula et inmodicis doloribus cruciaretur, nocte ei angelus uisus est eluere uulnera et salubri unguedine contusi corporis superlinire liuores: adque ita postero die restitutus est sanitati, ut nihil umquam pertulisse incommodi putaretur. 
19.5	sed longum est ire per singula: sufficiant haec uel pauca de plurimis, satisque sit, nos et in excellentibus non subtrahere ueritatem et in multis uitare fastidium. 
20.1	 Adque ut minora tantis inseram — quamuis, ut est nostrorum aetas temporum, quibus iam deprauata omnia adque corrupta cum aut digitis — inditae sunt AF, nam aut digitis - inditae 11 27 porsaepe AFv II fugauerunt V: effagauerunt ÅFv 2 quartanis BM 4 accessu BM, ut uidetur: accensu, AF, itetn V, sed in hoc s manu posteriore in rasura scripta est. Retinuimus lectionem uulgatam, cum salt- locutio accessio febris vulgaris sit, sed rasura in V probabiie fit Sulpicium scripsisse in ipso accentu (i. e. incremento) ardoris, cuius locutionis haec similia accentus hiemis, doloris etc. in lexicis adferuntwr II febris fugata F 6 uoueret A II uirginitatis V II dicaret AFV II profectus F pr. m . 7 praesens ob uirtutem AFQ II quae] per quas F m . 2 in ras . 10 Paulinus magni uir V: Faulinus uero uir magni AFv 12 pinicillo V, peniculo AFv 14 caenaculo F, coenaculo v 15 grados V et pr. m. F 16 et] nec V; an nec raodicis ? 17 unguedine V: unguento BM, unguine AFro 18 superlinire linores BMV: membra contingere AFv 19 sed BMV: sed quia AFv 21 excellentioribus F 23 inferam\' F (sed uirgula uidetur a 2 m.) sunt, paene praecipuum sit, adulationi regiae sacerdotalem non cessisse constantiam —, cum ad imperatorem Maximum, ferocis ingenii uirum et bellorum ciuilium uictoria elatum, plures ex diuersis orbis partibus episcopi conuenissent et foeda circa principem omnium adulatio notaretur seque degenere inconstantia regiae clientelae sacerdotalis dignitas subdidisset, in solo Martino apostolica auctoritas permanebat. 
20.2	nam et si pro aliquibus regi supplicandum fuit, imperauit potius quam rogauit, et a conuiuio eius frequenter rogatus abstinuit, dicens se mensae eius participem esse non posse, qui imperatores unum regno, alterum uita expulisset. 
20.3	postremo, cum Maximus se non sponte sumpsisse imperium adfirmaret, sed inpositam sibi a militibus diuino nutu regni necessitatem armis defendisse, et non alienam ab eo Dei uoluntatem uideri, penes quem tam incredibili euentu uictoria fuisset, nullumque ex aduersariis nisi in acie occubuisse, tandem uictus uel ratione uel precibus ad conuiuium uenit, mirum in modum gaudente rege, quod id impetrasset. 
20.4	conuiuae autem aderant, uelut ad diem festum euocati, summi adque inlustres uiri, praefectus idemque consul Euodius, uir quo nihil umquam iustius fuit, comites duo summa potestate praediti, frater regis et patruus: medius inter hos Martini presbyter accubuerat, ipse autem in sellula iuxta regem posita consederat. 
20.5	ad medium fere conuiuium, ut moris est, pateram regi minister obtulit. ille sancto admodum episcopo potius dari iubet, expectans adque ambiens, ut ab illius dextera poculum sumeret. 
20.6	sed Martinus ubi ebibit, pateram presbytero suo tradidit, nullum scilicet existimans digniorem, qui post se prior biberet, nec integrum sibi fore, si aut regem ipsum aut eos, qui a rege erant proximi, presbytero praetulisset. 
20.7	quod factum imperator omnesque qui tunc aderant ita admirati sunt, ut hoc ipsum eis, in quo contempti fuerant, 1 ut paene FQ, sed ut in F erasuni 3 uictoriae laetum V 4 orbis BMV: om. AFv 5 degenere V: degeneri AFv 1\\ inconstantiae regiae clientillae V 7 supplicandum regi AFv 10 imperatores ÃFV: duos imperatores F corr. et v II uitae V 11 sej hic margo in V laesa est, nec tamen se in eo uidetur fuisse 14 paenes V 17 conuiuiae V II autem om. Finrasura 18 ueluti AFv II summi itaque V 22 in V: om. AFv 25 ebebit V 27 post se prior biberet AB: possit prior bibere FQV, post se (oro . prior) biberet 2 codd. Gisel. et v 9 placeret. celeberrimumque per omne palatium fuit, fecisse Martinum in regis prandio, quod in infimorum iudicum conuiuiis nemo episcoporum fecisset. 
20.8	eidemque Maximo longe ante praedixit futurum ut, si ad Italiam pergeret, quo ire cupiebat, bellum Valentiniano imperatori inferens, sciret se primo quidem impetu futurum esse uictorem, sed paruo post tempore esse periturum. 
20.9	 quod quidem ita uidimus. nam primo aduentu eius Valentinianus in fugam uersus est: deinde post annum fere resumptis uiribus captum intra Aquileiae muros Maximum interfecit. 
21.1	 Constat autem etiam angelos ab eo plerumque uisos, ita ut conserto apud eum inuicem sermone loquerentur: diabolum uero ita conspicabilem et subiectum oculis habebat, ut siue se in propria substantia contineret, siue in diuersas figuras spiritalis nequitiae transtulisset, qualibet ab eo sub imagine uideretur. 
21.2	quod cum diabolus sciret se effugere non posse, conuiciis eum frequenter urguebat, quia fallere non posset insidiis. quodam autem tempore cornu bouis cruentum in manu tenens cum ingenti fremitu cellulam eius inrupit, cruentamque ostendens dexteram et admisso recens scelere gaudens 'ubi est\' inquit, (Martine, uirtus tua? unum de tuis modo interfeci. 
21.3	tunc ille conuocatis fratribus refert quid diabolus indicasset: sollicitos ire praecipit per cellulas singulorum, quisnam hoc casu adfectus fuisset. neminem quidem deesse de monachis, sed unum rusticum mercede conductum, ut uehiculo ligna deferret, isse ad siluam nuntiant. iubet igitur aliquos ire ei obuiam: 
