21.4	ita haut longe a monasterio iam paene exanimis inuenitur. extremum tamen spiritum trahens indicat fratribus causam mortis et uulneris: iunctis scilicet bubus dum 2 prandium V II nemo episc. V: episc. nemo AFv 4 pergerit Y 5 quidem primo V II inpetu A 8 dein AF 9 interficit V 11 inuicem apud eum AFv 12 ita V: tam AFv 13 spiritalis nequitiae BMV: spiritalesque (spiritualesque v) nequitias AFv 15 conuitiis AF II firequ. urguebat AV: urguebat (urgebat v) frequ. Fv 17 cornu. V (cornum corr.) 18 ostendens V: ostentans AFv 19 recenter F corr . || gaudens V: congaudens AFv II inquid V, item saepe alias 20 interfici V 21 sollicitosque M II ire de Prato: esse libri II praecepit AFv 22 fuisset adfectus AFv 25 ita ABFMQV: itaque v II hant] aut Y et sic saepe cUias 27 causam V et cod. Jurati: casum reU. et v; cf. Paulinus: Vulneris exponens causam etc . dissoluta. artius lora constringit, bouem sibi excusso capite inter inguina cornu adegisse. nec multo post uitam reddidit. uideris, quo iudicio Domini diabolo data fuerit haec potestas. 
21.5	in Martino illud mirabile erat, quod non solum hoc, quod supra rettulimus, sed multa istius modi, si quotiens accidissent, longe antea praeuidebat aut sibi nuntiata fratribus indicabat. 
22.1	Frequenter autem diabolus, dum mille nocendi artibus sanctum uirum conabatur inludere, uisibilem se ei formis diuersissimis ingerebat. nam interdum in Iouis personam, plerumque Mercuri, saepe etiam se Veneris ac Mineruae transfiguratum uultibus offerebat: aduersus quem semper interritus signo se crucis et orationis auxilio protegebat. 
22.2	audiebantur plerumque conuicia, quibus illum turba daemonum proteruis uocibus increpabat: sed omnia falsa et uana cognoscens non mouebatur obiectis. 
22.3	testabantur etiam aliqui ex fratribus, audisse se daemonem proteruis Martinum uocibus increpantem, cur intra monasterium aliquos ex fratribus, qui olim baptismum diuersis erroribus perdidissent, conuersos postea recepisset, exponentem crimina singulorum: 
22.4	Martinum diabolo repugnantem respondisse constanter, antiqua delicta melioris uitae conuersatione purgari, et per misericordiam Domini absoluendos esse peccatis, qui peccare desierint. contra dicente diabolo, non pertinere ad ueniam criminosos, et semel lapsis nullam a Domino praestari posse clementiam, tunc in hanc uocem fertur exclamasse Martinus: 
22.5	si tu ipse, miserabilis , ab hominum insectatione desisteres et te factorum tuorum uel hoc tempore, cum dies iudicii in proximo est, paeniteret, ego tibi uere confisus in Domino Jesu Christo misericordiam pollicerer. 2 cornu adegisse BV (std V cornua degesse): cornu iniecisse AFv II multum AF II reddit F J) uideris AAlV: uideres F, uidens B, uidetis v, uiderit is de Prato; at iam Gisetinns ueram esse lectionem uideris perspexit, cf. si tanti tst, Madwgii gramm. lat. §. 340 not. 4 3 diabulo V et sic saepius iv hoc uoc . 5 si quotiens ABFQV: quotiens 2 libri G-is. et v; cf. I>tal. III, 6,1 II ante AFv 6 aut BMV: et Alrv 8 conaretur A 9 persona M 10 persaepe AFv II enim AF 12 audiebantur AFMIJV: audiebantur etiam v 15 se om. FQ 17 prodidissent maleboC de Prato 18 recipisset V 20 conuersione V et cod. Berol . 21 desierint BMV: desinerent AFv 23 praestari posse clem. BV: praestari clem. AF, clem. praestari v 24 o miserabilis AFv 27 Jesu. Christo Y: Christi AFv 9* o quam sancta de Domini pietate praesumptio, in qua etsi auctoritatem praestare non potuit, ostendit affectum. 
22.6	et quia de diabolo eiusdemque artibus sermo exortus est, non ab re uidetur, licet extrinsecus, referre quod gestum est, quia et quaedam in eo Martini uirtutum portio est et res digna miraculo recte memoriae mandabitur, in exemplum cauendi, si quid deinceps uspiam tale contigerit. 
23.1	 Clarus quidam, adulescens nobilissimus, mox presbyter, nunc felici beatus excessu, cum relictis omnibus se ad Martinum contulisset, breui tempore ad summum fidei uirtutumque omnium culmen enituit. 
23.2	itaque cum haut longe sibi ab episcopi monasterio tabernaculum constituisset multique apud eum fratres commorarentur, iuuenis quidam ad eum Anatolius nomine, sub professione monachi omnem humilitatem adque innocentiam mentitus, accessit habitauitque aliquamdiu in commune cum ceteris. 
23.3	dein procedente tempore angelos apud se loqui solere dicebat. cum fidem nullus adhiberet, signis quibusdam plerosque ad creden dum coartabat. postremo eo usque processit, ut inter se ac Deum nuntios discurrere praedicaret, iamque se unum ex profetis haberi uolebat. Clarus tamen nequaquam ad credendum cogi poterat. 
23.4	ille ei iram Domini et praesentes plagas, cur sancto non crederet, comminari. 
23.5	postremum in hanc uocem erupisse fertur: ecce hac nocte uestem mihi candidam Dominus de caelo dabit, qua indutus in medio uestrum diuersabor: idque uobis signum erit, in me Dei esse uirtutem, qui Dei ueste donatus sim. 
23.6	tum uero grandis omnium ad hanc professionem expectatio. itaque ad mediam fere noctem fremitu terram insultantium commoueri omne monasterium loco uisum est: cellulam autem, qua idem adulescens continebatur, crebris cerneres micare luminibus, fremitusque in ea discurrentium et murmur quoddam multarum uocum audiebatur. 3 eiusdem F pr. m, 6 quit V 8 quidam BMV: quHam nomine AFv 11 aut V 12 aput eum V 13 anatholius AF 14 omni bumilitate atque innocentia F 15 que in V s. I . II in ow. V 17 fidem dictis nallas A 18 coartabat BMV: cohortabatur AFo 19 nuntios BM V: angelos AFv; lectionem nuntios firmat Paulinus 21 ei] enim FV 22 postrema AFfJ 1\\ inrupisse V 24 deuersabor AF 11 in me dei M et cod. Beroi.: me in dei FQ, me dei AVo 27 tcrram V: om. AFv 28 cellula V 1\\ qua AFV: in qua v 
23.7	dein facto silentio egressus unum de fratribus [Sabatium nomine] ad se uocat tunicamque ei, qua erat indutus, ostendit. 
23.8	obstupefactus ille conuocat ceteros, ipse etiam Clarus adcurrit, adhibitoque lumine uestem omnes diligenter inspiciunt. erat autem summa mollitie, candore eximio, micanti purpura, nec tamen, cuius esset generis aut uelleris, poterat agnosci: curiosis tamen oculis aut digitis adtrectata non aliud quam uestis uidebatur. interea Clarus fratres admonet orationi insistere, ut manifestius eis Dominus quidnam id esset ostenderet. 
23.9	itaque reliquum noctis hymnis psalmisque consumitur. ubi inluxit dies, adprehensum dextera ad Martinum trahere uolebat, bene conscius inludi illum diaboli arte non posse. 
23.10	tum uero reniti ac reclamare miser coepit, interdictumque sibi esse dicebat, ne se Martino ostenderet. cumque inuitum ire conpellerent, inter trahentium manus uestis euanuit. 
23.11	unde quis dubitet hanc etiam Martini fuisse uirtutem, ut fantasiam suam diabolus, cum erat Martini oculis ingerenda, dissimulare diutius aut tegere non posset. 
24.1	Animaduersum est tamen, eodem fere tempore fuisse in Hispania iuuenem, qui cum sibi multis signis auctoritatem parauisset, eo usque elatus est, ut se Heliam profiteretur. 
24.2	quod cum plerique temere credidissent, addidit ut se Christum esse diceret: in quo etiam adeo inlusit, ut eum quidam episcopus Rufus nomine ut Deum adoraret: propter quod eum postea ab episcopatu deiectum uidimus. 
24.3	plerique etiam ex fratribus nobis rettulerunt, eodem tempore in Oriente quendam extitisse, qui se Iohannen esse iactitauerit. ex quo conicere possumus, istius modi pseudoprofetis existentibus, Antichristi aduentum imminere, qui iam in istis mysterium iniquitatis operatur. 1 deinde v II Sabacium nomine F, om. ABMQV et 4 codd. Gisel . 2 ei otn. A 3 adcurrit V corr. ex occurrit 5 mollitiae candore exnimio V 6 curiosis BFMV: curiosius Av 8 insistere BMV: instare AFv 9 ei A II id BY: om. AFv 10 At ubi AFc 11 trahere ad martinum AFv || uolebant bene conscii ed. Ald. prob. dePrato 12 tuncAF 13 cum V solus ex notis 16 fantaaiam AFF: phantasiam v 17 ant tegere om. M 18 hispania BMV: hispaniis AFro (in hisp. iuuenem fuisse A) 21 addidit se Ch. esse (sine diceret) B 22 nomine rufos e 23 Deum MV: dominum AFv || postea episcopatus V 24 nobis e fratribus AFv 25 Johannen V: iohannS AF, Joannem v 26 iactitarit A, iactitaret Fr 27 anteehristi V 
24.4	 Non praetereundum autem uidetur, quanta Martinum sub isdem diebus diabolus arte temptauerit. quodam enim die praemissa prece et circumiectus ipse luce purpurea, quo facilius claritate adsumpti fulgoris inluderet, ueste etiam regia indutus, diademate ex gemmis auroque redimitus, calceis auro inlitis, sereno ore, laeta facie, ut nihil minus quam diabolus putaretur, oranti in cellula adstitit. 
24.5	cumque Martinus primo aspectu eius fuisset hebetatus, diu multum silentium ambo tenuerunt. tum prior diabolus: \'agnosce\' inquit, (Martine, quem cernis: Christus ego sum: descensurus ad terram prius me manifestare tibi uolui\\ 
24.6	 ad haec cum Martinus taceret nec quidquam responsi referret, iterare ausus est diabolus professionis audaciam: \'Martine, quid dubitas credere, cum uideas? 
24.7	Christus ego sum\\ tum ille, reuelante sibi spiritu, ut intellegeret diabolum esse, non Dominum, non se' inquit cIesus Dominus purpuratum nec diademate renidentem uenturum esse praedixit: ego Christum nisi in eo habitu formaque, qua passus est, nisi crucis stigmata praeferentem uenisse non credam . 
24.8	ad hanc ille uocem statim ut fumus euanuit et cellulam tanto foetore conpleuit, ut indubia indicia relinqueret diabolum se fuisse. hoc itaque gestum, ut supra rettuli, ex ipsius Martini ore cognoui, ne quis forte existimet fabulosum. 
25.1	 Nam cum olim audita fide eius, uita adque uirtute desiderio illius aestuaremus, gratam nobis ad eum uidendum suscepimus peregrinationem: simul quia iam ardebat animus uitam illius scribere, partim ab ipso, in quantum ille interrogari potuit, sciscitati sumus, partim ab his, qui interfuerant uel sciebant, cognouimus. 
25.2	quo quidem tempore credi non potest, qua me humilitate, qua benignitate susceperit, congratulatus plurimum et 1 Non BMV: Nec (neque) enim AFv II sub istis V 2 quadam F 3 prece V: praesc AF, prae se v II circumiecta (-tns 1 tn.) ipsa F || -qua V 7 cella A II adstetit V 8 multum BV: multumque AFv, mutumque aliquot libri Gisel . II ambo silentium AF II tunc v 10 terras AFM 11 nec quidquam responsi V s. I . II referret deest in V margine laesa 13 dubitas? crede MV, dubitas? cerne B 14 dominum MV: deum AFv 15 nec Y: et AFv II renidentem scripsi: renitentem libri 17 formamque V || proferentem Fv 19 et om. Y II faetore V 20 itaq. AFV: ita 11 || rettuli BMY: retulimus AFv 21 cognouimus A 22 ante uita in V et 8. I. add . 11 uirtute V: uirtutibus AFv 23 peregr. suscepimus AFv 25 illum interrogare potui B gauisus in Domino, quod tanti esset habitus a nobis, quem peregrinatione suscepta expeteremus. 
25.3	miserum me — paene non audeo confiteri — cum me sancto conuiuio suo dignatus esset adhibere, aquam manibus nostris ipse obtulit, ad uesperum autem pedes ipse nobis abluit. nec reniti aut Contra ire constantia fuit: ita auctoritate illius oppressus sum, ut nefas putarem, si non adquieuissem. 
25.4	sermo autem illius non alius apud nos fuit, quam mundi inlecebras et saeculi onera relinquenda, ut Dominum Iesum liberi expeditique sequeremur: praestantissimumque nobis praesentium temporum inlustris uiri Paulini, cuius supra fecimus mentionem, exemplum ingerebat, qui summis opibus abiectis Christum secutus solus paene his temporibus euangelica praecepta conplesset: illum nobis sequendum, illum clamabat imitandum: 
25.5	beatumque esse praesens saeculum tantae fidei uirtutisque documento, cum secundum sententiam Domini diues et possidens multa uendendo omnia et dando pauperibus, quod erat factu inpossibile, possibile fecisset exemplo. 
25.6	iam uero in uerbis et confabulatione eius quanta grauitas, quanta dignitas erat! quam acer, quam efficax erat, quam in absoluendis scripturarum quaestionibus promptus et facilis! 
25.7	et quia multos ad hanc partem incredulos scio, quippe quos uiderim me ipso etiam referente non credere, Iesum testor spemque communem me ex nullius umquam ore tantum scientiae, tantum [ingenii] boni et tam puri sermonis audisse. quamquam in Martini uirtutibus quantula est ista laudatio! 
25.8	 nisi quod mirum est homini inlitterato ne hanc quidem gratiam defuisse. 2 expeteremus V: expetissemus AFv soloece 3 esset BMV: est AFv II adhiberi Av 4 ipse om. V solus || ad uesperem A (non item Y) 5 ipse nobis pedes AFv II reniti ad hoc v 7 mundi V: mundi huius AFv 10 mentionem fecimos AFv, conunemorationem f. M 11 sequtus (sequutus corr.) Y 12 conplisset Y 13 illum (ante clam.) V 8. I . 14 documenta V (in Y litterae a et o saepe confusae sunt), documenta F pr. m. et Q 16 omnia Vpost dando 8. I. habet II factu F pr. m.: facta A, facto F corr. et V 18 acer BMV: alaeer AFv; illud firmat Paulinus II efficax erat quam Y: efficax quam AFQ, efficax et quam v 19 absolnendis BMV: exsoluendis AFv 23 tantum ingenii boni V, tantum ingenii, tam boni AFv, t. ingenii, tantum boni cod. Berol.; nos ingenii ut glossema inclusimus 24 quamquam AF: quam V 25 inletterato V \' 
26.1	 Sed iam finem liber postulat, sermo claudendus est, non quod omnia, quae de Martino fuerint dicenda, defecerint, sed quia nos, ut inertes poetae, extremo in opere neclegentes, uicti materiae mole succumbimus. 
26.2	nam etsi facta illius explicari uerbis utcumque potuerunt, interiorem uitam illius et conuersationem cotidianam et animum caelo semper intentum nulla umquam — uere profiteor — nulla explicabit oratio. illam scilicet perseuerantiam et temperamentum in abstinentia et in ieiuniis, potentiam in uigiliis et orationibus, noctesque ab eo perinde ac dies actas nullumque uacuum ab opere Dei tempus, quo uel otio indulserit uel negotio, sed ne cibo quidem aut somno, nisi quan- 
26.3	 tum naturae necessitas cogebat, uere fatebor, non si ipse, ut aiunt, ab inferis Homerus emergeret, posset exponere: adeo omnia maiora in Martino sunt, quam ut uerbis concipi queant. numquam hora ulla momentumque praeteriit, quo non aut orationi incumberet aut insisteret lectioni, quamquam etiam inter legendum aut si quid aliud forte agebat, numquam animum ab oratione laxabat. 
26.4	nimirum ut fabris ferrariis moris est, qui inter operandum pro quodam laboris leuamine incudem suam feriunt, ita Martinus etiam, dum aliud agere uideretur, semper orabat. 
26.5	 o uere uir beatus, in quo dolus non fuit: neminem iudicans, neminem damnans, nulli malum pro malo reddens. tantam quippe aduersum omnes iniurias patientiam adsumpserat, ut, cum esset summus sacerdos, inpune etiam ab infimis clericis laederetur, nec propter id eos aut loco umquam amouerit aut a sua, quantum in ipso fuit, caritate reppulerit. 
27.1	 Nemo umquam illum uidit iratum, nemo commotum, nemo maerentem, nemo ridentem: unus idemque fuit semper, * 2 fuerint Y: fuerant AFv II deficerint V 5 potuerint F (non itemV) II cotidianam conners. AF 7 profitetur F II nulla ABFMV: om. v 8 et in iei. V: et iei. AFv 9 et in uigiliis V II noctes V add . que 8. 1. eadem m . II perinde ab eo Apr. m . 11 ne cibo AFV: nec cibo e II quidem post somno habent AFv II quantum Y: in quantum AFv 12 coegit MY II non nisi F 13 omerus AF, omyrus V II possit V II explicare F in ras. m. 2 17 quit aliut V II ab operatione V, sed pe m. antiqua punct . 21 uir BMV: om. AFv II nem. damnans V s. I. habet, neminem condemnans v 23 aduersus F 27 nemo commotum om. AF 28 fuit V: om. AFv caelestem quodammodo laetitiam uultu praeferens extra naturam hominis uidebatur. 
27.2	numquam in illius ore nisi Christus, numquam in illius corde nisi pietas, nisi pax, nisi misericordia inerat. plerumque etiam pro eorum, qui illius obtrectatores uidebantur, solebat flere peccatis, qui remotum et quietum uenenatis linguis et uipereo ore carpebant. 
27.3	et uere nonnullos experti sumus inuidos uirtutis uitaeque eius, qui in illo oderant, quod in se non uidebant et quod imitari non ualebant. adque, o nefas dolendum et ingemescendum, non alii fere insectatores eius, licet pauci admodum, non alii tamen quam episcopi ferebantur. 
27.4	nec uero quemquam nominari necesse est, licet nosmet ipsos plerique circumlatrent: sufficiet ut, si qui ex his haec legerit et agnouerit, erubescat. nam si irascitur, de se dictum fatebitur, cum fortasse nos de aliis senserimus. 
27.5	non refugimus autem, ut, si qui eius modi sunt, nos quoque cum tali uiro oderint. 
27.6	illud facile confido, omnibus sanctis opusculum istud gratum fore. de cetero si qui haec infideliter legerit, ipse peccabit. 
27.7	ego mihi conscius sum me, rerum fide et amore Christi inpulsum ut scriberem, manifesta exposuisse, uera dixisse: paratumque, ut spero, habebit a Deo praemium, non quicumque legerit, sed quicumque crediderit. 3 erat V 4 obtrect. illias AFv 7 uirtutis MV: uirtutibus AFv; cf. Dial. 3,17, 5 non inuidus gloriarum 9 ingemescendum F: ingemisccndum A Vv II fere ABMV: fuere Fv 11 nominari ABV: nominare Fv 12 sufficiet (non sufficiat) ut si qui V: sufficit ut si quis AFv 13 de se BMV: de se ipso ed. Ald . de se ipse AFv 13 dictum esse A 14 de alio v 16 si quis AFv 18 ut haec scriberem v; in V haec s. I. alia manu add. est 19 uira V 1\\ ut spero orn. A pro m . 20 Expl. de uita sci martini epi. per (add. s. 1 . sulpicium) seuerum monachum massiliensem. cuius depositio est tertiu idus nouembf Inc. epistula eiusdem (add. 8. 1 . sulpicii) Seueri V, Expl. liber primus de uita sci Martini epi et confessoris. Inc. epistola Seueri ad eusebium presbiterum postea episcopum A, item F sed hie om. uerbis de uita — confessoris. 
