pr.1	Summe & sancte Deus, cunctae virtutis origo, 
3.410	Seruantur pr§dae: tanta est moderatio iusti 
3.411	Victoris: reliquos sparsit fuga turpis, & agros2 ) 
3.412	Vsq; Damascenos instans formido sequuta est. 
3.413	At victor tanti nil motus laude triumphi, 
3.414	Inter equos, pecuduq ; greges, populuq ; receptu, 
3.415	Aut captum, gazasq; (auido quae podere victos 
3.416	Victoresq ; mouent) nil prorsus concupit horum 
3.417	 * Magnificus , sed enim tanta inter gaudia mitis 
3.418	Et varios hominum reputans sub pectore casus, 
3.419	 Omnes omnino praeda , & praemia belli 
3.420	Direptis passim populis, regiq; resen/at : 
3.421	Non sibi se pugnasse docens, decimam tn offert 
3.422	Hostibus excussae que vera est hostia praedae, 
3.423	Melcisedech, vinumq ; & pani : ab cecde reuerso .
3.424	Melchisedech rex ile Salem, qui munere tali
3.425	Mystica pręmisit summi libamina Christi: 
3.426	Cuius de manibus sumens ecclesia corpus
3.427	 Viuificum panem, coelesti pota cruore est. 
3.428	 *At vero hostili redeuntem e funere lassum,
3.429	 Omnipotens verbis solatur talibus Abram,
3.430	Quandoquide nullis cupidum te praeda subegit, 
3.431	Illecebris, precium fidei, mercesq; laborum 
3.432	Mecum plena tibi est: teq; & tua cuncta tuebor, 
3.433	Haeredi seruanda tuo, quem germine sero 
3.434	ProgenitH , mage multo etid pius auctor amabis. 
3.435	 Nil est quod metuas haeres tuus illo Damascus 
3.436	Vt fuat, ipse tuo cernes de semine natum:
3.437	Accendat cuius patrios infantia sensus: 
3.438	Suspice conuexum quam denso lumine coelum 
3.439	Picta nocte micat: quantis congesta premantur 
3.440	Sidera sideribus, numeru quae obiecta recusent: 
3.441	Seminis hoc exemplar habe , stirpisq; futurae 
3.442	Multiplicis formam. Sic fatus finit: at ille 
3.443	Credidit, & nudae fidei consensio sola 2) 
3.444	Plenam ad iustitiae (6 meriti reputata corona est . 
3.445	Atque adeb hic Abra tata mercede docemur, 
3.446	Quanti sit meriti diuino credere Verbo : 
3.447	 * Demeriti contra quanti non credere: nalllq ; vt 
3.448	 *Credidit hac rursum diuina voce meretur 
3.449	 Solari: omnipotens dum verbis incipit istis: 
3.450	 Ille ego sum Deus ac dominus, qui teq; tuosq; 
3.451	Chaldaea de gente tuli, tandemq; paternis 
3.452	Exceptum vicijs, terra meliore locaui: 
3.453	Vt de te genitus populus meus arua beata 
3.454	Incolat, & seriem longe lateq; propaget, 
3.455	Gentibus expulsis, quas foedo errore parentum 
3.456	Sacrilegas ritus olim fecere prophani: 
3.457	Quod cUctabudus nimium quia credere differs , 
3.458	Trinam sume mihi trma iam fronte iuuencam, 
3.459	Cum qua par amnis blando grege lecta capella, 
3.460	Aequaeuusq ; aries, nostro mactetur honori: 
3.461	Casta quoq; humanae turtur coniuncta colube , .
3.462	At vero volucrum non sentiat hostia ferrum: 
3.463	Tantum intermedias pecudes discindere cura: 2)
3.464	Quas sic diductas mundis distinguito arenis, 
3.465	Vt membris coeant altrinsecus aemula membra.3) 
3.466	Dixit, at ille Dei monitus seruare libenter 
3.467	Assuetus, raptim properat mandata patrare: 
3.468	Sed quum dispositam quo iussa erat ordine, terrę 
3.469	Strauisset seriem, subito manus ingruit atra 
3.470	Importunarum predam insectata volucrum : 
3.471	Quę ne cotactu violarent sacra prophano, 
3.472	Vndiq; solicitus cauet, & circumspicit Abram. 
3.473	Sed qua opere attonitum tanto, nec sole cadente 
3.474	Vinceret officij moles tam magna recepti: 
3.475	Ecce niger terror, tremor horridus, & sopor Ttrat 
3.476	Nuncia iussa ferens, venturaq; secula formans. 
3.477	Credo, videbatur septum sibi cernere nilum 
3.478	Hebraeę gentis populo, serosq; nepotes 
3.479	Ingentemq; supra numerum cognoscere turbas: 
3.480	Inde truces motus, deductaq; castra suorum, 
3.481	Transmissu pelagus, sed gurgite mersa profundo 
3.482	Agmina naufragii nulla cum classe sequut?tm: 
3.483	Ereptosq; mari Hebraeos , dehinc tota beatae 
3.484	Regna Pal§stinae populo patuisse reuerso. 
3.485	Talibus attonito visis non defuit almus 
3.486	Interpres, praenosce tuos, sobolemq; tuorum 
3.487	Inquit, in externis per secula quattuor agris 
3.488	Niliaci illius sensuram dire tyranni 
3.489	Imperia: at quu tot peregrina expleuerit annos: 
3.490	Seruitio eripiam, gentemq ; vlciscar iniquam. 
3.491	Et reddam terris blando quas gurgite cingunt 
3.492	Nilus & Euphrates: sed quu peccata nocentum 
3.493	Gentis Amorrhaeae populiq; haec regna tenentis 
3.494	Explerint summam sceleru : digniq; paternis 
3.495	Sedibus expelli fuerint: at tu tamen ante 
3.496	Longęuo foelix decedens limite vitae 
3.497	Ploratus natis cum pace & munere nostro 
3.498	Ad sanctos migrabis auos: sic fatus, & alto 
3.499	Quu iam nox terris densas induceret vmbras 
3.500	Signu e monte dedit, confestim fumeus istic 
3.501	Apparet clibanus, lampas ; ignita videtur: 
3.502	 Tum sacras epulas mediumq; inuecta paratum 
3.503	Pręcipiti cursu delibans flamma rorauit . *) 
3.504	Interea certus regni prolisq; futurae 
3.505	Munus adire patri cupit Abram: casta sed vxor 
3.506	Abnuit officium, quod inanem effoeta senectus 
3.507	Iarnq ; vterum sibi fecisset: sed dulce mariti 
3.508	Pignus spemq; noua quacunq; ex pellice fusam 
3.509	Esse suam credens, famulam (cui iunior aetas 
3.510	Agar nomen erat, tellus Nilotica origo) 
3.511	Subrogat in thalamos, pcibusq; adgressa maritu, 
3.512	Seruili semen concredere perpulit aluo. 
3.513	Ast anima vt primum suscepta viuere sensit 
3.514	Agar ventris onus, fastu tumefacta superbo 
3.515	Despexit domina: & domina cui matris amorem 
3.516	Debebat, causamq; sui furiosa tumoris. 
3.517	Recte igitur flagris hanc vir iustissimus Abram 
3.518	Coniugis addixit: quorum magis acta pudore 
3.519	In deserta procul secretaq; lustra ferarum 
3.520	Abditur indignans, qua exui nec spernere cessat: 
3.521	Sed rursum obsequio priuas quod debuit, illam 
3.522	Contemnit quo more potest, mauultq; pericla 
3.523	Desertae perferre viae : ni missus olympo 
3.524	Angelus occurrat, famulamq; ad pristina rura 
3.525	Restituat miti dominae, blandoq; refectam 
3.526	Hortatu, melius iubeat sperare reuersam. 
3.527	Et nomen nati doceat, moresq; manusq;, 
3.528	Innumerosque greges tali de stirpe futuros: 
3.529	Quo maiore redit voto iam certa futuri: 
3.530	Et partu dominum fecit prior ipsa parentem. 
3.531	Quum. iam decursi spacijs foelicibus aeui 
3.532	Supra octoginta quum sex excluderet annos, 
3.533	Ad quos bissenas quum iustus & insuper vnam 
3.534	Adderet ęstates: solito hunc rursum pater almus 
3.535	Alloquio dignatus adit: iussitq; senectam 
3.536	Ducere foelicem: simul et promissa reuoluit, 
3.537	Et qua mercedem expectet: tum corpore prono 
3.538	Abram suppliciter dominum prostratus adorat. 
3.539	A quo mox audit firmata voce futurum 
3.540	 *Se patrem innumerae gentis , latcq ; parentis: 
3.541	*Et cuius venient etiam de semine reges . 
3.542	Hoc tamen a reliquis iussus discernere signo 
3.543	 Hebraeam gente populis, vt sponte resecta 
3.544	Carne superuacua se circuncidat, & owmem1 ) 
3.545	Masculei sexus prquentemq ; atq ; futuram2 ) 
3.546	Progeniem; iussus puero a matre recentes 
3.547	Atq; rudes vitae dum mens ignara dolendi est, 
3.548	Praeputio exutos, octaua luce sacrare. 
3.549	Quod qui tam sanctum corrupere testamentum 
3.550	Auderet, cessans legi inseruire rogatae: 
3.551	Exhaeres fieret regni, vitaeq; futurae. 
3.552	At simul vt vero sibi crederet argumento 
3.553	Venturas aliqucLdo suo de semine genteS 
3.554	 Innumeras, nomen dominus comutat vtriq;. 3) 
3.555	 Non Sarai tibi ait, sed Sarra vocabitur vxor ,
3.556	Et tu non Abram sed nomine clarior aucto 
3.557	Venturae Abraham posthaec vocitaiere genti . 
3.558	Quod comune ideo tibimet cu coiuge vera est 
3.559	Promissi quoniam (nihil est re certius ista) 
3.560	Mater erit generis, teq; annum sole remenso 
3.561	Esse patrem faciet, quauis ridenda putetis 
3.562	Virtutis promissa meg : nec vestra senectus 
3.563	Impediet, quin diuini sententia iuris 
3.564	Aeternos semper maneat stabilita per annos . 
3.565	Sed tamen ignoscam dubijs, pueroq; futuro 
3.566	Imponam nomen quod culpa hanc arguat Ishac: 
3.567	Qui nostri indubie seruato foedere pacti 
3.568	 Haeres certus erit, cuncta cum stirpe suoru . a) 
3.569	Nec tamen Ismael Agar de semine natus 
3.570	Expers dotis erit: nostro nam munere fultus 
3.571	Milia multa virum de se ventura potentllm , 
3.572	Bissenis pariter ducibus regnanda creabit: 
3.573	Dixit, at ille auidus pactu accelerare receptum 
3.574	Iam centum pulsans annos, iam pubere nato. 
3.575	Se primum, gnatnq \', suu , cunctosq; clientes 
3.576	Ac famulos oZs quo iussum est stigmate signat, 
3.577	Et populu facit esse noua, fontemq; piorum: 
3.578	Vna eademq; uia, tanta est deuotio, legem 
3.579	Accipiens explensq; fide: Quid no meret ergo 
3.580	Tam praesens veloxq; fides? nã non timor istud 
3.581	Sed syncerus amor famuliq; probatio iusti est. 
3.582	Quodlibet imperium placida sic mente subire 
3.583	Vnde Deum tibi promeruit: nempe antea tantu 
3.584	Audii-i solitus, meritum post tale ministri 
3.585	Iam patitur cerni: quumq; indignatio iusta 
3.586	Vltorem stimulet, mortales non tamen ille 
3.587	Respuit aspectus: nam quum damnare pararet 
3.588	Crimina terrarum, flammisq; abolere nocentes, 
3.589	Aut verum aut qualem norat se posse videri 
3.590	Et nome numerumq; Abraham prodidit ipsum. *) 
3.591	ILLi nãq ; domi Mamre in conualle sedenti 
3.592	Tres subito apparent angusta luce micantes. 
3.593	Abraham tanti stimulatus imagine visus 
3.594	Procurrit, dominumq; solo prostratus adorat: 
3.595	Tresq; etiam supplex forma veneratur in vna,
3.596	Queis vt, mente pia liceat seruire, precatur: 
3.597	Et refici in medios aestus tendentibus horis 
3.598	Non dedignentur, famuli mensisq; cibisq;: 
3.599	Vsquae adeo visus inter sensusq; vigentes 
3.600	Errabat dubitans hominis substantia an esset, 
3.601	Que norat mens esse Deum, tame annuit ille, 
3.602	Officiumq; pij non aspernatus alumni 
3.603	Oblatosq; cibos, mensasq; saerauit amicas .
3.604	Vt vero ablatis epulis mensisq; remotis 
3.605	 Hospitibus vixurn est illinc discedere, tum mox 2)
3.606	Inde moues gressus. lateri comes haeret euntum 
3.607	Hospes ouans: tristi ; quatit cocussa pauore 
3.608	Pectora, & attonitu venerabilis attrahit horror, 
3.609	Quippe videt vultus tacitos, visusq; seueros, 
3.610	In Sodoma dominū iuncta vibrasse Gomorrlw , 
3.611	Pacis & emissos famulos, iręq ; ministros: 
3.612	Et quum cognoscet tanta quid mole patraret 
3.613	Archanwn pandente Deo, caussamq; docente 3) 
3.614	VItro audet dominu scrutari an perderet vrbem, 
3.615	Errantis populi per crimina cuncta nocentem, 
3.616	Si quinquaginta morū probitate piorum 
3.617	 Spectatos aleret: quumq; ipsi diceret, illis
3.618	 Si numerū tale inuenio mihi parcere certa est .
3.619	Quid si quinq ; minus fuerint, tum subdidit ? dc quid 
3.620	 Si quadraginta soli? quid si minus illo 
3.621	Forte decZ numero? Quid si bis quinq ; dabuntur 
3.622	 *Innocui? non d; tu vrbi Deus optime parces ?
3.623	* Qzcurnq ; etiCL numero se vlle ignoscere tali 
3.624	 Dixisset, famulum in medio sermone reliquit 
3.625	Tendente ulterius: seq; in sua regna recepit. 
3.626	*Dimissi interea ciues b sede superna
3.627	 Angelici in Sodomae terras, Loth forte sedente 
3.628	Ante fores vrbis, iam terris sole propinquo 
3.629	Inueniunt: qui quum miro splendore videret 
3.630	Angelicos radiare viros. descendere summo 
3.631	E coelo ratus, in terram prostratus adorat. 
3.632	Inuitatq; domum, noctemq; auertere tecto 
3.633	Euincit precibus simul et conuiuere suadet. 
3.634	Innocuosq; cibos, & pocula parca ministrat. 
3.635	*Dumq; epulis sumptis somno indulgere pararet:
3.636	Ecce sub occasum lucis, noctisq; recursum, 
3.637	Foeda manus vulgi si fas dixisse, virilis 
3.638	Prosilit, & iuuenum insanis pueriq; senesq; 
3.639	 Ignibus vruntur: Lothq; vt sibi tradat abuti 
3.640	 Hospitibus, cogunt: quid non vesana libido 
3.641	 Ausit? at ille volens populi mollire furorem 
3.642	Insani, natas quibus illibata manebat 
3.643	 Virginitas offert quoscunq ; optarit in vsus, 
3.644	Ast effrena cohors in deteriora profundi 
3.645	* Lapsa mali, vicio sese immiscere minori 
3.646	Vile putat, nisi se summis etiam implicet: ergo 
3.647	Tnfandu ut patret facinus Loth opprimit: d; iam 2) 
3.648	 Vi maiore agitant quam quae virtute repelli 
3.649	Humana valeat: quum protinus hospes uterq; 
3.650	Angelicas nudant mentito corpore vires. 
3.651	Et populi secum obcquata mente furentis 3) 
3.652	Loth retrahunt: inq; ipsa domus secreta receptū 
3.653	Perdenda hortantur confestim abscedere terra.4)
3.654	Qui sint, quid veniant, & quae praecepta ferentes 
3.655	C55 Mox exple velint , nil iam sermone patenti 
3.656	Dissimulant: c5 ab hac se clade euadere saluum
3.657	Vosse , domumq ; suct dicunt generosq; suosq;
3.658	Colligere affines, & secum abducere mandant. 
3.659	 Ast illos simili cum vulgo crimine tactos 
3.660	 Inuoluit similis sententia sana monenti 
3.661	 Credere dū nolunt: quuTqua quod credere nolut
3.662	 *Non est vt multū mirere, abscedere quU Loth 
3.663	 * ld quoq; ridiculum quod cosuluere putaret .
3.664	 Qui lentum, pigrasq; moras sine fine trahente, 
3.665	Hospes uterq; videns manibus cu coiuge raptu, 
3.666	Virginibusq ; suis, procul extra moenia ducit: 
3.667	Et celerare iubet montesq; euadere in altos, 
3.668	Tali lege data, ne coelesti igne flagrantem 
3.669	Post se respiciat quisquft male cautus in vrbes. 
3.670	 *Loth vero metuens montes ne tardius altos 
3.671	Aggressum velox coeli praeuerteret ira. 
3.672	Ore Segor lachrymisq ; petit secura recessus 
3.673	 Antra sui: lachrymas autS nõ sensit inanes,
3.674	Concessumq; sibi donum speciale salutis 
3.675	Pluribus - impartit , meritumq; e munere fecit. 
3.676	Et iam non solitas raptim obducentia coelum 
3.677	A patria virtute Deo miscente, coacta 
3.678	Nubila densarat nebulas: sed quas rotat Aethna 
3.679	Quas vomit Inarime, atq; Apon \' feruttiV vndis 
3.680	Exaltat , quas vicino concussa Veseuo 
3.681	Eructat tellus: Lycię quas sęua Chymer§ 
3.682	Ora sinu vasto trinae fornacis anhelat, 
3.683	Et quocunq; loco fallentia sulphura velox 
3.684	Spiritus inflammas angusto tramite fusus 
3.685	Effluit in lucem rupta tellure vaporans: 
3.686	No qu ό d nõ possit pluuias quoq; vertere i ignes, 
3.687	Totum de nihilo potuit qui condere mundum: 
3.688	Sed maiore bonus iudex damnare paratu 
3.689	Mauult, quos miserens urbis morumq; ruinae 
3.690	Punit in exeplu : mox durum elementa minatur \' 
3.691	ConcuiTuntgy vndante globo: stipataq; flatu 
3.692	Quęq ; suo coeunt flammarii pabula in vnum 
3.693	Corpus, & infandas terra vrbesq; nocentes 
3.694	Sulphurei testudo tegit curuata metalli: 
3.695	Qua citus & vires angusto tramite sumens 
3.696	Spiritus incussam, tanto crepitare fragore 
3.697	Compulit, & crebro tonitrus agitate corusco 
3.698	Costernare animos, quotquot spectacula cernut
3.699	 Talia: quinetia Loth, heu miserabilis Vxor 
3.700	* Seu tanto stupefacta metu, seu stulta cupido 
3.701	Illa fuit vetitum cotra consurgere pactum
3.702	 * Foemineis innata animis: quae deniq; cumq;
3.703	 *Causa fuit, Sodoma inspectans se ponb mente ?, 
3.704	 Confestim poenas violata lege subiuit, 
3.705	In statuam conuersa salis, spoliataq; luce 
3.706	Sic animam infoelix cñ corpore perdidit omni: 
3.707	Vt nullum extaret forma remanente cadauer. 
3.708	Ocior inde Segor luctu prohibente timore 
3.709	Horriflcoq ; malo stupidus, mox ingreditur Loth.
3.710	Ttcm sol exoritur toto feruentior igne, 
3.711	Irato fulgore micans, radiosque seueros 
3.712	Dirigit in Sodoma: qui postqua lumina flamis 
3.713	Inuoluere suis, resolutaq; sulphura: nexos 
3.714	Secum praecipitant ignes, siccoq; liquore 
3.715	Dispensata suis stillant incendia Medis . 
3.716	Fulmineus denso praeceps cadit aere nymbus 
3.717	Inuoluitq; vrbes , & totis sęuit in agris. 
3.718	Admixto stridore tonat, vincitq; querelas 
3.719	Flammea tempestas: quae postqua pabula terris 
3.720	Repperit incensis, ipsisq; insedit arenis, 
3.721	Erigit immensam coniuncto fomite metam 
3.722	Ignis, & a terris redeunt in sidera flammae, 
3.723	In cineres donec cautes tellusq; resultans 
3.724	Transeat, ac penitus mersg soluantur arenae. 
3.725	Depressisq; cauos consumpto cespite campis 
3.726	Pandunt arua sinus, venisq; effusus apertis 
3.727	Consocians vires, qui terras strinxerat humor 
3.728	Priuatu gignit pelagus: Quidna esse putemus 
3.729	Quod raptim lacus est mira virtute refertus 
3.730	Qui fuit ante rogus? sic omnipotetia summi 
3.731	Iudicis in gelidas ignem conuertere lymphas, 
3.732	 Ac rursum lymphas ardenti possit in ignem. 
3.733	Nec tamen hic occulta vacãt mysteria, nã quod 
3.734	Vndae hic sunt vbi fldma fuit: quod fldmea missis 
3.735	 Desuper extinxit lymphis: fortasse notabat 
3.736	Luxuriae calidos ignes, fomentaq; primi 
3.737	 *Peccato contracta patris coelestibus vndis 
3.738	 * Extinctum quandoq; iri: proq; ignibus acris
3.739	 *Iustitiae, quibus illa olim lex dura vigehat : 
3.740	 * Saluificis purgatu iri c:ê lustralibus vndis . 
3.741	Finis libri tertii. 
