pr.1	Summe & sancte Deus, cunctae virtutis origo, 
1.380	Pausę ignara fames: qui si mandata supremi
1.381	Seruassent integra Dei, crudelia mortis 
1.382	Imperia, & diros nescissent vsq; dolores. 
1.383	Callidus at serpens Domini perfringQve legem 
1.384	Talibus incautam persuasit fraudibus Euam. 
1.385	O vitae melioris inops, rerumq; bonaru 
1.386	Gens ignara hOlm : neq; em bona nosse putadus 
1.387	* Qui praua ignorans, etid distinguere nescit
1.388	Quo diuersa bonis inter se limite distent . 
1.389	Atq; ideo augustos homini fas carpere fructus 
1.390	Noluit esse Deus: ne mentis nube remota 
1.391	Tmmitant in coelum oculos, atq; optima noscant: I) 
1.392	Sintq ; deis similes. Hic nunc excurrere paulum 
1.393	Fas fuat, & turpes veterum deflere ruinas. 
1.394	Ah nimium miseri gentiles quos furor egit 
1.395	In varios ritus cognomina multa Deorum 
1.396	Fingere, pluralemq; Deo vocem addere soli . 
1.397	Serpentis primam hanc sonuit vox impia diri, 
1.398	Qui mortis tū caussa fuit: nam credula, postqua 
1.399	Rupit sacrilegis praescriptum morsibus Eua, 
1.400	Experti iam docta mali, consorti , culpae 
1.401	Quaerit: & incautum fraudis male gnara maritu 
1.402	Qua perijt prior arte petit: sic hoste subactus 
1.403	A gemino cedit sceleri miserabilis Adam: 
1.404	Pomaq; degustat sacri plenissima succi. 
1.405	Sed quia legis in his suberant praescripta seuerae 
1.406	Plusqua vipereo morte adlatura veneno, 
1.407	Vt primum illicito violarunt ora sapore, 
1.408	Confestim sensere nefas, facinusq; peractum 
1.409	Creuit, & ignaro percussit pectora sensu. 
1.410	Hinc timor inde pudor, sumpserat primitus ortu. 2) 
1.411	Nam dum corda homines celsarum conscia reru 
1.412	Et coelo tantum rectoq ; intenta gerentes, 
1.413	Pectora ad excelsum ferrent conuersa parente: 
1.414	Dum secretorum miracula diuinorum 
1.415	Claro incorporeae mentis splendore notarent: 
1.416	Nondum contigerat membroru cura suoru , 1) 
1.417	Quos vbi deseruit vitae vigor ille perennis, 
1.418	Iam morte affectos: demum frigusq; calorq; 
1.419	Aeriae subiere vices: ac vestis egenos 
1.420	Se primum sensere homines: sexuq; latenter 
1.421	Erubuere suo taciti miserabile questi. 
1.422	Idcirco vmbrosae e folijs noua tegmina fici 
1.423	Decerptis texunt, post culpam, mente receptum 
1.424	Corpore velato denudatura pudorem. 
1.425	Nec satis: ignorat quid agant, qua crimen inustu 
1.426	Seq; ipsos fugiant: cuperent si forte pateret, 
1.427	Condere se barathro: vsque adeo cotermina poenę 
1.428	Culpa suae est: vt iam miseros mortale pauentes 
1.429	Mortis imago iuuet: syluas umbrosaq; lustra 
1.430	Obtendunt van/s solatia falsa tenebris, 
1.431	Nam qu te timidum fas est subducere corpus? 
1.432	Tete inqua quae mox vili de puluere fecit 
1.433	Virtus viua patris, mundi : abscondit , praesens 
1.434	Implet: et in penitos exit diffusa recessus. 2) 
1.435	Tune potes dominum fugiens euadere? tune 
1.436	Omnia cernentem sperasti posse lateret 
1.437	Vt vastis iaceas tenebris, caelabere nunquam . 
1.438	Ergo vbi peccati genitus pudor attigit Adam 
1.439	QuercntS latebras, mox audijt, heus vbi es Adam? 
1.440	*Quid vero est quod te quaerit Deus, inscius anne id 
1.441	Forte rogat que nec domino subducere summo 
1.442	Vel mors ipsa potest, fragili quam mente subisti? 
1.443	Quur vbi sis quaerit, nisi quod te morte doloris 
1.444	Lapsum sponte tua, secum non esse fatetur: 
1.445	Et coelo cecidisse sacro? sed sancta parentis 
1.446	Desperare vetat pietas: clementia cuius 
1.447	(Fas dixisse mihi, fas sit quoque dicta probasse?) 
1.448	Iustitiam excedit: nec tam me voce seuera 
1.449	Corripiens, vbi sis, trepido quid pectore quaeris, 
1.450	Terret: qua recreat quod adhuc post crimina lapsum 
1.451	Immersumque metu latebris, ac pene sepultum, 
1.452	Euocat & reuocat: ne vero exempla petantur 
1.453	Longius, ostendit culpae donatio mitem . 
1.454	Postqua excussa reos manifestat caussa parentes 
1.455	Incepere Deo coelum, mare, terra loquenti 
1.456	Contremere, & vastos concussa aperire recessus. 
1.457	Dumq; reos punit sententia, tartara condit . 
1.458	Quandoquide nostris visum est decedere iussis,\') 
1.459	lam mihi iusta nouos feriet censura nocentes. 
1.460	Principio inter totius uiuentia mundi
1.461	Tu maledictus eris: & peior quam tegis intus 
1.462	Inuida mes coluber: qui coeli in claustra veMdos 
1.463	Deiecisti homines: vetitasq; attingere fruges 
1.464	Fraude tua impulsis praedurae mortis origo es. 
1.465	 Ergo vt digna nefas poenae mensura sequatur, 
1.466	Ex quo homine. terrae immersti, tu stratus iniquo 
1.467	Membra solo, duram sulcabis pectore terram. 
1.468	Et vetitos tentare cibos quia feceris, hinc iam 
1.469	Vilis semper edes squallentia viscera terrae. 
1.470	Et quia te dignae placuit tibi primus vt esses 
1.471	Inuentor mortis: poena moriere perenni . 
1.472	Humaniq; odium generis specialiter in te 
1.473	Ac genus omne tuum bello experiere potenti . 
1.474	Perpetuumq; tui mors vt tibi longa, timorem
1.475	Esse dabo: pedibus repes & pectore prono: 
1.476	Teq; tuo mulier perimet cum semine, cuius
1.477	Callidus extremis tantum insidiabere plantis. 
1.478	Vt trepidans etiam capiti vestigia figat. 
1.479	Dixit, & exanguem sic est exorsus in Euam. 
1.480	Et tu quae minimo solam te perdere fructu x 
1.481	Non conteta , virum similes temeraria in ausus2 )
1.482	Traxisti: instar eris famulae: subiectaq; duros 
1.483	Arbitrium sensura viri patiere labores. 
1.484	Casibus & uero ( incoeptum quonia prior ausa es 
1.485	Multiplicare nefas,) semper uersaaere multis . 
1.486	Et pariens crebris adeo torquebere natis, 
1.487	Vt quos mortales faciet tua culpa creari, 
1.488	Mortis nonnuqua lacerae sint caussa parenti. 
1.489	Tu quoq; cui monitus nostros & prima salutis 
1.490	Vincula foemineis postponere fraudibus auso 
1.491	Sponte mori placuit: talem reus excipe sortem. 
1.492	Criminibus tellus quam tu sulcabis aratro 
1.493	Sit maledicta tuis: spinas, tribulosq; minaces 
1.494	Culta ferat; fallatq; tuu spes improba votum.3) 
1.495	Nec tibi terra fidem seruet, tu viuere laetus 
1.496	His in delitijs, & cunctis uiuere seclis 
1.497	Sponte recusasti: duro nunc viue labore, 
1.498	PerpetuU quoq; viue miser: dum lenta senectus 
1.499	In terram te restituat, terraeq; recondat. 
1.500	Dixit & ignaros ne coeli iniuria laedat 
1.501	Veste tegit pecudum miserens: vitamq; tueri 
1.502	Edocet: & ne iterum similes exiret in ausus 
1.503	Infaustum mortis formidine percutit Adam.1) 
1.504	At ne perpetuam vitali ex arbore vitam2 ) 
1.505	Protraherent: miserosque reos grauiora manerent 
1.506	*Supplicia: in tantis nimium diuturna periclis 
1.507	*Tempora ducentes, dirisq; obnoxia poenis:
1.508	Continuo sacris iussos decedere lucis 
1.509	ExpeLlunt venti, nemoris quos sylua profundi 
1.510	Concitat : atq ; illos libranti turbine nexos 
1.511	Aura vehens sacra Paradisi ab sede repellit . 
1.512	Ergo hinc eiecti iuuenes, terrisq; relate 
1.513	Perdita dimissi suspirant gaudia luci,
1.514	Expertes tanti spacij expertesq; pericli: 
1.515	Sed non expertes agitat qui corda doloris. 
1.516	 Qu ruerint, quid perdiderint, qug vita sequatur 
1.517	Quae fuerit, tacita tristes in mente volutant, 3) 
1.518	Porro etiam quid se supremo in fine futurū est, 
1.519	Haerent soliciti: sibi num grauiora supersunt, 
1.520	Nullane spes superet miseris: num morte pereni 
1.521	Perdant quod superest: an quu via mortis amar 
1.522	Per lignum ingruerit mundo populisq; futuris 
1.523	Possit adhuc aliquod per lignum vita redire, 
1.524	Finis lib. primi. 
2.1	Hactenus archanam seriem, primordia mundi, 
2.2	Vt sincera fides docuit, sine fraude cucurri: 
2.3	Dum dignis loeto vicijs terrena carerent. 
2.4	Nunc hominum mores, et iam mortalia versu 
2.5	Aggresso, omnipotens vires Deus adde poetae. 
2.6	Postqua sacratis decedere iussus vterq; 
2.7	Sedibus ac regnis, genitalia contigit arua: 
2.8	Inq; sua stetit exui humo: mirabile quali 
2.9	Ore rudes stupeant tam barbara rura coloni, 
2.10	Quae non frugifera distinctaq ; arbore vernant. 
2.11	Nec species place vlla soli, nam mixta coacto 
2.12	Pondere congeries confusa, mole locatur, 
2.13	Ardua caute rigent: syluis depressa laborant 
2.14	Plana, carentq; herbis: horrescunt edita dumis. 
2.15	Heu quibus hgc spectat oculis, quo pectore cernut , 
2.16	Quoru animis Paradisus lest ? qu causa doloris 
2.17	Vna subest, dum cunctoru iam plena malorum 
2.18	Se pandit facies, longe tristissima, post tot 
2.19	*Delitias Paradise tuas: cE amoena locorum
2.20	* Gaudia fertilium: quorum vanissima praesens 
2.21	* Semper adest, tristesq; animos idea fatigat . 
2.22	Nunc honor ille sacri nemoris maiore sereno 
2.23	Irradiat, nunc diuitias succurrit ademptas 
2.24	Sylua beata tuas: nunc pomi dulcior vsus, 
2.25	Nectareusq; sapor: viuis nunc floribus halans 
2.26	Tellus, absenti tristes contristat odore. 
2.27	O quam no eade ( exclamat ) Paradise rependis: 
2.28	Imo etid qucito prae illis haec dona beatis 
2.29	Delicijs , peiora facis? sic tristibus illis 
2.30	Iam vitae perit almus amor, penuria rerum 
2.31	Insinuat iam dulce mori: ne maior egestas 
2.32	Occurrat grauiore malo: nam viscera terrae 
2.33	Scrutari vesana fames, & quaerere cogit 
2.34	Qua steriles dat sylua dapes: adeό usque malignis 
2.35	Herbarû dubias passim radicibus escas 
2.36	Explorare iuuat, ventremq; explere latrantem .1) 
2.37	Tandem cunctaru quibus indiget vsus egenos 
2.38	Atq; inopes rerum, docuit sors vltima summi 
2.39	Auxilium sperare patris: tum stratus vterq; 
2.40	Membra solo, lachrymis tantum mutoq; dolore 
2.41	* Quae nequeunt verbis poscunt solatia votis: 
2.42	Dum pudor internis subducit verba querelis. 
2.43	Ergo vbi cognouit mutae sibi reddita linguae 
2.44	Munera, consurgens tali prece supplicat Adam. 
2.45	Omnipotens auctor mundi, rerumq; creator, 
2.46	* Quem mihi labe mali tfensum atq; audacibus ausis 
2.47	Constitui, foelix olim dum vita maneret, 
2.48	Et celeres animos visu super astra daretur 
2.49	Posse sequi, late circum perq; omnia fuso: 1) 
2.50	Hos ego quur oculos tua quodd archana tuetes , 
2.51	Vel iam no habeo, vel magna ex parte minutos,2) 
2.52	Et tetro clausos terreni carceris antro, 
2.53	Vt iam nil veri praeter mortalia quadam , cf ; 
2.54	Fluxa videre datu ac mundit in peiora labantê ? 
2.55	Atq; ideo omnipotes qui semper totus ubiq; es, 
2.56	Ad te confugimus, trepida te mente precamur, 
2.57	Exaudi miseros, quos semper cernis & audis. 
2.58	Quum me olim parti damnatae adnectere vellet 
2.59	Ille caput scelerum, mundi infensissimus hostis: 
2.60	Nil per se solum ne victus cederet, ausus, 
2.61	Serpentis formam accipiens, & coniugis illa 
2.62	Arma meae, duro confecit vulnere: sic nos
2.63	Artificis scelerum fraus improuisa subegit. 
2.64	Quumque ego damnarer iusta pro crimine poena, 
2.65	Agnouit culpam tanto mens icta dolore: 3) 
2.66	Vt mihi me de me poenam praebere putarem. 
2.67	Idcirco & gemitus poenae, laclirymasq; negaui, 4) 
2.68	Amplexusq; animo solatia dulcia poenae 
2.69	Hanc ipsam posthaec sacra inter munera ponens 
2.70	Pro venia sceleris: non iam detrecto labores 
2.71	Quoscūq ; addideris: tame interea optime iudex 
2.72	Si iuuat, exaudi nil in tua iussa precantes. 
2.73	Nec ia istud lachrymis & moesta voce precamur, 
2.74	ludicij censura tui quo se illa resoluat: 
2.75	Tota sed vt plenas teneat sententia vires. 
2.76	Iussisti mota victum me quaerere gleba, 
2.77	Et steriles spinas sparsa pro fruge leuandas )\' 
2.78	Dixisti, & tribulos pro fructibus, ergo sereda est 
2.79	Vt fallat mea vota seges quaesita labore. 
2.80	Noscere da quae sint segetes, quo more serendae . 
2.81	Fructiferae quae sint herbae, quae forma laboris: 
2.82	Da pater auxilium miseres, ysq ; imbue sensus: 
2.83	Tunc erit vt rerum compos, & certa salutis 
2.84	Seruiat Eua mihi, saeuumq; experta parentis 
2.85	Supplicium pariat populos vt crimine nostro 
2.86	Plectantur, purgetq; patrum peccata, nepotum 
2.87	Mortibus aeternam faciens successio poenam. 
2.88	Interea dum sic orant, serpentis imago 
2.89	Indice visa metu tacito se tramite ferre 
2.90	Leniter ad molles spiris reptantibus herbas, 
2.91	In se conuertit trepidos: diriq; doloris 
2.92	Excussas odio cognatas traxit in iras. 
2.93	Et prior Eua viro. Si te suprema malorum 
2.94	Caussa mouet, rape saxa manu, datur ecce facultas 
2.95	Auctorem loeti loeto dare, callidus ille 
2.96	Supplicijs doceat proprijs & morte cruenta 
2.97	Quam sit triste mori, qui me male perdidit & te. 
2.98	Dixit, & elapsum cursu pctrisq ; secuta est 
2.99	Missilibus: quin t6 duras per robora cautes, 
2.100	* Quò se reptando condebat callidus anguis,
2.101	Ambo proijciunt: quarum rigido una lacerto I) 
2.102	In nudum casu silicem dimissa resultat, 
2.103	Scintillamq; ciet: sicco quae e fomite nata 
2.104	Exijt in flammam & crinita incendia late 
2.105	Extendens tota iam sylua ardebat adepta. 
2.106	Hic horrent, latebrasq; gradu trepidate requirūt . 
2.107	Sed pauidos stupor ipse tenet: curamq; sagacem 
2.108	Inijcit insolitae flammae: quam cernere rursum, 
2.109	Et twmidi2 ) spectare volunt. Paulum ergo remoti 
2.110	Telluris dorso sterilis mirantur opacas 
2.111	Defluxisse comas, nemorum ; horrere fauillas, 
2.112	Fuscariq; diem, totas splendescere terras, 
2.113	Et lucem sub sole nouam: nec mente quieta 
2.114	accipiunt crepitus stridentibus vndiq; syluis, 
2.115	Vndantesq; globos flammarum, in sidera latos, 
2.116	Nec quod radices immersus tendit in imas 
2.117	Ignis edax \'penitus: sumpto quo victa calore 
2.118	Terra suas pandit generosa ad munera venas. 
2.119	Quae quum iam cuncto siccata liquore fuisset 
2.120	Mox fieri liquor incepit: riuisq; metalla 
2.121	Fundere quęq ; suis, fuluo hinc torrente coruscat 
2.122	Auri summus honos: candenti lacte renidens 
2.123	Effluit argentum, rigor aeris lubricus errat: 
2.124	Et coit in mollem resoluto corpore massam. 
2.125	* Vis breuibus forma ardentis cdprendere syluae ? 
2.126	*Sulphureae volitant nemoris per opaca fauillae,
2.127	Nõ aliter quam du ruptis sicca Aethna caminis 
2.128	Egerit immixtis stridentia sulphura flammis.3) 
2.129	Tum se decoctis tellus pinguissima glebis 
2.130	In foetus mouit varios quos imbre marito 
2.131	Parturiens putri dissoluti rura meatu, 
2.132	Qua tumidi crepuere sinus, elataq; messis 
2.133	Extitit, & motis vndans trepidauit aristis: 
2.134	Disceret vt speciem segetis nouus accola cultae. i) 
2.135	Nil tame hinc longus quidqud sibi vfdicet vsus , 
2.136	Nil casus virtutis inops, Deus omnia nosse 
2.137	Quę bona sunt cum luce dedit: mundoq; minori 
2.138	Quidquid maior habet sacro innotescere sensu 
2.139	Seq ; per haec voluit: quod si illibata maneret 
2.140	Vt data mens homini est, nulliq; obnoxia culpae: 
2.141	Non illam species, non illam corpora rerum, 
2.142	No modus astrorum, numerus nec mollis arenę 
2.143	Falleret, aut quantis cum magno terra profundo 
2.144	Extensa est spacijs: aut quae mensura peractae est 
2.145	Molis: quid resonet motu septemplicis axis 
2.146	Armoniae vocale melos: nunc discitur vsu 
2.147	Assiduisq; datur studijs: qudqud arte vel vsu 
2.148	Quod capimus, Domino semper donate tenemus. 
2.149	Et vero ad primos vt se digressa parentes
2.150	150 Nostra chelys referat, iam quęso aitedite paucis, 
2.151	Pulsus ab augustis Paradisi sedibus Adam, 
2.152	Nullum habuit prius officiu qua coiugis usum, 
2.153	Atq; omne natis operam nauare creandis:l) 
2.154	Ergo vbi prima domus natis iam plena duobus 
2.155	*Inter tam varios solatia multa labores
2.156	Attulit: atq; nouum se vidit vterq; parentem: 
2.157	Multiplicata graues releuauit cura dolores : 
2.158	Et spes iam subijt propriis gaudere ministris 
2.159	Ruris in officio: quorum qui maximus aeuo, 
2.160	Arua Cain duris vertebat pinguia rastris. 
2.161	At viuo gaudere lucro dignissimus Abel 
2.162	Collibus in nudis, & sicci germine campi 
2.163	Innocuas pascebat oues, & lacte parentes. 
2.164	Verum expectati sensere vt gaudia fructus 
2.165	 Diuino intuiti vinci sua vota fauore: 
2.166	Mox decreuit vterq; sui libamina fructus 
2.167	Prima dicare Deo: sacras prior impedit aras 
2.168	Frugibus ille nouis: niueo magis hic litat agno: 
2.169	Prima sacerdotum species, mox hostia fratris 
2.170	Impia: sed Christum longe tamen ante figura 
2.171	Signans. Perpetuus nam quft foret ille sacerdos
2.172	* Summi Melchisedech ex ordine: protinus in se
2.173	* Conflata inuidia, t6 fratrum liuore suorum est,
2.174	* Hostia saluifica dum pendet ab arbore factus: 
2.175	*Sic olim ante sui praesensit candidus Abel
2.176	Inuidiam fratris: nam quum de fruge litasset 
2.177	Iste sua: niueo ille agno, mox protinus altum 
2.178	In coelum ascendit combusto fumus ab agno: 
2.179	At contra per inane volans de frugibus illis 
2.180	* In terram redijt fugienti fumus olympo:
2.181	* Aut quod peiores domino sacrauerat, aut quod 
2.182	* Illi non gratum est animo quod prodit auaro . 
2.183	* Inde Cain tamen insanas flammatur in iras 
2.184	 Inuidiae ducens illo de fonte venenum, 
2.185	 Vnde propinarat serpens: fratrcmq ; cauendi 
2.186	Ignarum saeua mactatum caede trucidat. 
2.187	Heu facinus, quo non miseros furiosa libido, 
2.188	Quo non ira, recens odiu, cC vis improba - cog/t ? \') 
2.189	Quid nierct innocuus frater? num sanctior ille 
2.190	 Qu fuit, interimi meruit ? iam facta parentum 
2.191	Non est posteritas quod quidquct accuset, cE ipsi 
2.192	* FlagitiU addidimus: iãq ; est quod callidus anguis
2.193	*Obijciat, si fors illum accusare velimus,
2.194	 Qu morimur: nilq ; ad cumulU jnna illa propago 2) 
2.195	Criminis, adiecit mortem: culpamq; parentum 
2.196	Inductam mundo (horrendum est id dicere) fecit 
2.197	Impietas scelus esse nouum, sic impie, sic tu 
2.198	*Dire Cain primore nouum caede inficis orbem: 
2.199	Pro qua perpetuas poenas iam morte solutus 
2.200	Aeternumq; dabis, longe serpente nephando 
2.201	*Deterior, tua metimur si crimina, namq; 
2.202	Attulit. ille necem nobis, non intulit, at nos 
2.203	* Coepinws adlatam: tu vero hanc primitus infers:
2.204	Tanto illo peior, vitari publicus hostis 
2.205	 Qu potuit: tu priuatus nulla arte caueri 
2.206	Iam poteras : quis enim dilecto a fratre timeret ? 
2.207	At vero nulla est hominis tam dira nephandi 
2.208	Culpa, Deus qua non animo demente remittat, 
2.209	Si modo poeniteat facti: quod teste Caino3 ) 
2.210	Accipimus: quem tiic fraterna caede madente 
2.211	Non indigna habuit (tanta est clementia) sese 
2.212	*Correptore Deus, quin blanda voce rogatum
2.213	Frater vbi suus ille foret, facinusq; negantem, 
2.214	Arguit, & leuiter tanto pro crimine punit. 
2.215	Nd profugu tantu atq; extorrZ ab vtroq; parite ) 
2.216	Longius amandat, uastasq; relegat in oras: 2) 
2.217	Et iubet a patrijs confestim excedere terris: 
2.218	*Hac etiam longe misero foeliciter in re 
2.219	Gratificans: grauior na multo est poena videri 
2.220	Inter foelices, & pura mente beatos 
2.221	Victuro post supplicium, factiq; pudorem. 
2.222	Vtq; sit exilium leuius, comes additur vxor 
2.223	Fida reo forsan ne desperatio solum 
2.224	Arriperet : tu etid quae duras . pectoris aegri 
2.225	Itolliret curas, & moto corpore fractum 
2.226	Sisteret amplexu, nulliq; obnoxia culpae 
2.227	Et dominii votis & pura mente colendo, 
2.228	Eliceret quidquid posset satis esse duobus. 
2.229	Sic multa extorres comitatur gratia: quorum3 ) 
2.230	Auxit multiplicans per nomina mille nepotum 
2.231	Progeniem Deus omnipotês : regeq ; Cainu 
2.232	Esse dedit populis, quos cingere moenibus vrbes 
2.233	Erudijt, praelonga videns in tempora natos . 
2.234	Interea maesto rursum grauis Eua marito 
2.235	Pensarat primu sancto ia pignore danum : 
2.236	Reddideratq; iterum nata iam prole parenti 
2.237	Multiplices animi curas, d; mixta labore 
2.238	Gaudia: Seth puero nomen fecere, vice Abel 
2.239	 Qui dedit omnipotёs illis Deus: vnde secuta est 5) 
2.240	Posteritas, cuius de semine prodi;Y Enos, 
2.241	Qui primus tacita lectus virtute sacerdos, 
2.242	Posse ciere pijs precibs votoq; potentem 
2.243	Sperauit, meruitq; Deum, populumq; secutum 
2.244	Imbuit aeterni cultu seruare parentis. 6) 
2.245	Cuius de serie pollens virtutibus Enoch 
2.246	Descendens, meritis etiam non impar auitis . 
2.247	Redditus in sedes patrias orbemq; beatum, 
2.248	Viuit adhuc, cPc habet vitae iam regna futurae. 
2.249	Hic iusti proauus Noe: sub tempora cuius 
2.250	Infecit totum studijs concordibus orbem 
2.251	Culpa frequens, vicijsq; sequens adiunxit auitis 
2.252	Posteritas uicium: qua propter mille per annos 
2.253	Aut prope, maiores, quum viuere consucuissent : 
2.254	Ne peruersi hominu mores crescentibus annis
2.255	Augmentum acciperent, vitijs ut terminus esset. 
2.256	Maxima uita hoim lustra ad duodena redacta est *)
2.257	Namq; Cainigenu quu se coniuncta prophanis 
2.258	Damnasset thalamis in peius prona iuuentus: 
2.259	In varium facinus superum deserta fauore 
2.260	Prosilit, inq; omnes currit temeraria lapsus. 
2.261	*Tum Deus auerso tcL multa ob crimina mundo 
2.262	Confestim infensus uoces erumpit in istos . 
2.263	* Nequaquã posthac humana in gente manebit
2.264	Spiritus ille meus: uitam nec proferet vItra : 
2.265	Viuere bissenos decies contenta per annos
2.266	Vita nocens hominum : quoniam terrena sequuti 
2.267	Plus carnis qua mentis habent: sic ergo seuera 
2.268	Aeui constituit tempus sententia certum 
2.269	Iudicis immoti: longae ne tempora uitae 
2.270	Criminis augendi caussam praestare ualerent . 
2.271	Flagitij quid enim iam non auderet iniqui2 ) 
2.272	Impia gens kominUf nam magna mole gigates 
2.273	Monstra horrenda hominu vario de semine nati 
2.274	Nil non audebat : queis una & maxima virtus3 ) 
2.275	Non fore ad extremum prauos: quos dira, libido4 ) 
2.276	Crimen in ol trahes nullas sine sanguine noctes, 
2.277	Aut sine caede dies unquam ductare sinebat: 5) 
2.278	Immemores iuris diuini, hominumq;, suiq;, 
2.279	Affectusq; pij , matrumq ;, patrumq; suorum, 
2.280	Autorisq; De : tantuq ; in crimina summa 
2.281	Processum est, hotes dominU vt formasse pigeret: 
2.282	Vt peruersa etiam Deus ob peccata nocentum 
2.283	Criminis expertes animas conuoluere vellet: 
2.284	Atq; superfusis terras immergere lymphis: 
2.285	Rursus in antiqui mundo redeunte figura. 
2.286	* Vnus erat Noe iustus quem propter in iras 
2.287	Differret prodire Deus: quem uita fidelis 
2.288	Iam per quingentos immunem criminis annos 
2.289	Duxerat, & sancta degentem in lege probarat. 
2.290	Cui sic sancta Deus pandens archana reuelat. 
2.291	Iamq; hominū uitijs infectū turpibus omne 
2.292	Aera cum terris in deteriora relapsis6 ) 
2.293	Eluere, & tumido uisum est submergere ponto: 
2.294	Vt dum cuncta ruens operit, iussusq; residit 
2.295	Gurgite praecipiti, pollutum diluat orbem, 
2.296	Implicitosq ; hoies : & quidquid viuere iussum est 
2.297	Caussa hominu , inflati conuoluat labe profundi . 
2.298	Sed quia tu solus cui cordi nostra voluntas , 
2.299	Deuotum sanctis dnxisti legibus aeuum, 
2.300	Peruersis semper voto meliore repugnans: 
2.301	Sic decretoru moderabor iura meoru , 
2.302	Vt mihi qufL iustas luerit gens impia poenas, 
2.303	* Purgataeq ; orbis feces: tum dignius a te 
2.304	Incipiat mortale genus: summuq; parentem 
2.305	Te numerent populi posthac qui tempora viuet . 
2.306	Quadratis igitur trabibus contexta paretur 
2.307	Archa tibi, cubitis sed quae sit longa trecentis: 
2.308	Lata quaterdenis denos super: aera in altum 
2.309	Terdenis surgens: cubitali ornata fenestra . 
2.310	Insuper h laena ponatur ianua parte . \') 
2.311	Tunc calidi bibula spirans copage bitumen 
2.312	Exploret tenues & vestiat vndiq; rimas.2) 
2.313	Quumq; triplex spaciu discreuerit area duplex, 
2.314	Sic discernantur proprijs animantia nidis 
2.315	Ne violent permixta genus, comissaq ; pugnent 
2.316	Confundantq; cibos, quorum te condere par est 
2.317	Tantum materiem: nam dispensata receptis 
2.318	Ne desit, praestare meum est. Haec mente fideli 
2.319	Noe concipiens (nam animi sensumq; ministras, 
2.320	Velle & posse dabat famulo quodcuq ; in bebat .) 3) 
2.321	Iussum opus adgreditur, densas prosternere syluas 
2.322	*Incipiens, atq; annosas proscindere quercus . 
2.323	Admittunt luci radios, vmbrisq; leuatur 
2.324	Campus, & aequaeuo spoliantur robore valles. 4) 
2.325	Sed quum tam multo fuerit properata labore 
2.326	Summa operis coepti centum differtur in annos, 
2.327	Vt bona vita sequens, vitae delicta prioris 
2.328	*Emendet, mutetq; feros gens impia mores . 
2.329	0 miseri quos tam iustae dilatio poenae 
2.330	Plus facit esse reos: nec iam pro crimine tantum 
2.331	Praeterito, at longe grauius plectentur, ob ipsum 5) 
2.332	Temporis indulti spacifL , veniamq; neglectam: 
2.333	*Quum testaretur se parcere malle reuersis 
2.334	Tempore dilato dominus . Iam mole peracta 
2.335	Machina constabat laterum compage capaci 
2.336	Dijfugm quod supremum pater ipse pararat 
2.337	Naufragijs natura tuis, rapidisq; fluentis, 
2.338	Tum Deus c celso famulum dignatus olympo 
2.339	Voce mone Noe summum iam tempus adesse, 
2.340	Condere se latebris, natos cum vxore, nurusq; 
2.341	Eripere instanti exitio, mortisq; tenebris: 
2.342	Cunctaq; viuificis animalia reddere claustris:
2.343	Siue ea terra fouet, seu clarus sustinet aiir , 
2.344	Singula de mundis septena, & singula bina 
2.345	Ex ijs quae sacris minus apta, immttda vocatur . 
2.346	Nec mora fit. quidquid conuexo cardine coeli 
2.347	Nascitur, ignotum diuersis partibus orbis, 
2.348	Quod stupet Eous, quod pallidus horret Iberus, 
2.349	Australis Libyae calidis quod nutrit harenis, 
2.350	Scindit Hyperboreas miro quod lumine noctes 
2.351	Festinat trepidans: & apertae immergitur arcae.
2.352	 Diluuium dicas iam pracscnsisse , Deoq; 
2.353	Authori parere suo: d; pecudes ratione carentes 
2.354	Plus quam imprudentes homines ratione valere, 
2.355	Et si nil sapiunt. Ergo omni semine vitae 
2.356	Praegrauida vt primu claudi Deus iperat archa , 
2.357	Nox ruit, & subitae coelum obduxere tenebrae, 
2.358	Effusoq; cadens terras ferit aere nymbus . \') 
2.359	Et furit, & toto pariter desaeuit in orbe.2) 
2.360	Nec satis excidio est, qui nubibus effluit imber: 
