pr.1	Summe & sancte Deus, cunctae virtutis origo, 
pr.2	Omnipotens, quem nec subtili indagine rerum 
pr.3	Mentibus humanis sensu comprendere fas est, 
pr.4	Et nescire nefas (nam te ratione profunda 
pr.5	In tribus esse Deum, sed tres sic credimus vnum 
pr.6	Vnica personas ut tres substantia reddat. 
pr.7	Indiscreta pio conseruans foedera nexu) 
pr.8	Tu sine principio, pariter sine fine perennis, 
pr.9	Solus es atque idem: nullique obnoxius aeuo. 
pr.10	Tu spatium rerum mentis quocunq ; recessus 
pr.11	Tenditur, excedis: spatio neq; cingeris vllo. 
pr.12	Nec te qui capiat locus est, immensus enim es tu . 
pr.13	Quinetiam humanae nec fas contingere menti 
pr.14	Qualis imago tua est, oculis ignara videri, 
pr.15	* Ni cui cernendam speciali numine sese 
pr.16	Exibeat : nec vero est qui virtute creata 
pr.17	Tevegetet motus: per que sumus atq; mouemur . 
pr.18	Tu mens et sacre penitus substantia mentis: 
pr.19	Tu ratio, et plene prudens rationis origo, 
pr.20	Tu virtus virtutis apex, atq; ipsa profecto 
pr.21	Tu vita, & genitor vitae, lucisq; profundae: 
pr.22	Tu lux vera Deus; tu rerum causa, vigorq;: 
pr.23	A te principium traxit, quodcunq; repente 
pr.24	ex nihilo emicuit, tantoq; auctore repletum 
pr.25	Vel vim metis habet, vel forma in mebra recepit. 
pr.26	Te dominum natura probat seruata caducis 
pr.27	Partibus: et iussam seriem datus ordo fatetur. 
pr.28	Tu dociles numeros distinguens, pondera libras, 
pr.29	Mensuras varians, modulos, motumq; gubernas, 
pr.30	Alternas seruire vices, iugemq; recursum 
pr.31	Rerum stare iubes, & mentis imagine plenum 
pr.32	Edere nota tibi iam secula, volvere mundum. 
pr.33	Non vno tu contentus dotare creata 
pr.34	Munere, quidquid agis varios largiris in vsus. 
pr.35	Quinimo nil non causa Deus alme tuorum 
pr.36	Efficis: ipsa licet nobis ignota tuorum 
pr.37	Factorum ratio, atq; modus: contraria nempe 
pr.38	*Quae putat humanae solers ignauia mentis,
pr.39	Dum certant, plus pacis habent, sic omnia diues 
pr.40	Conditor aduersis etiam cognata elementis 
pr.41	Nectis et effusis à te virtutibus imples. 
pr.42	Et tamen hec quum sint in maiestate creandi, 
pr.43	Nil horum quae gignis eges: mundiq; peracti 
pr.44	Et per te stabili rerum compage manentis 
pr.45	Nil prorsum indigus es: nec in hoc tua gloria tm 
pr.46	Quod prestanda facis bonus autor: sed quod & ipsa 
pr.47	Efficere ut possint causis praebere secundis 
pr.48	Non dedignaris: quae qui tua munera sentit 
pr.49	Munus & ipse tuu est: tibi vt vni accepta referre 
pr.50	* Omnia homo merito possitq; & debeat vnus . 
pr.51	Nam tibi sola Deus gigni quorf cuncta iuberes 
pr.52	Causa fuit bonitas: quum iussis viuere primum 
pr.53	Spiritibus, mundoq; frui quem mente gerebas , 
pr.54	Atq; omnes in te rerum cognoscere caussas, 
pr.55	Et super terras et aquas volitare dedisti. 
pr.56	Certa quibus coelum sedes, queis libera corda 
pr.57	Arbitriumq; sui largitus es omnibus: vt iam 
pr.58	*Alterutram in partem vellent se vertere possent:
pr.59	Vt fieres iustis merce , meritisq ; piorum, 
pr.60	Hoc quoque coferres praestando, vt debitor esses. 
pr.61	Nam quod de primis coelesti in sede creatis 
pr.62	Vnus (dum lucis domino, vitaeq ; suoq; 
pr.63	Inuidet auctori, titulumq; hunc appetit) auctor 
pr.64	Maluit esse mali, primamq; inducere mortem, 
pr.65	Cum scelerum socijs celso deiectus olympo: 
pr.66	Virtuti nihil inde tu praeiudicat : illud 
pr.67	Cui satis est fecisse bonum: sed copia laudis 
pr.68	Haec est summa tuae: quod quu se extollere supra
pr.69	* Diuini virtutem apicis scelus esset, & ingens
pr.70	* Relligio nulla prorsum delebilis vnda: 
pr.71	Non tamen ingratis vitam sensumque negasti: 
pr.72	Quin etiam arbitrio mentis gaudere dedisti . 
pr.73	Nec tamen arbitrij natura in vtrumq; valentis 1)
pr.74	Accusanda venit nobis: namq; in de perire 
pr.75	Posse datum est cunctis vt viuere dulcius esset: 
pr.76	Mutuaq; alterni compar mensura pericli 
pr.77	Cederet ad meritum: quum iudice digna seuero 
pr.78	Praemia sanctorum geminaret poena malorum. 
pr.79	Porro etiam ( mihi si fas est hoc dicere salua
pr.80	Pace tua genitor) maius fortassis apud te est 
pr.81	Non peccasse bonum, per lubrica tempora vitae, 
pr.82	Quam miseris peccasse malum: sed videris vt se 
pr.83	Hoc habeat: caussas vni cui credimus omnes. 
pr.84	Interea satis est nobis, quod vilia terrae 
pr.85	 Pondera dum sacra inspiras ratione tuaq; 
pr.86	Informas virtute, tuumq; effingis ad instar, 
pr.87	*Nobiliora facie : dum lato in sidera vultu
pr.88	Erexisti hominem: quem saeui fraude tyranni 
pr.89	In mortis laqueos, & ad impia tartara raptum 
pr.90	Vnigeni redimis profuso sanguine nati:
pr.91	Eq; imis erebi dona ad maiora petitum 
pr.92	Restituis quam factus erat: vitaeq; perenni 
pr.93	Reddis, & in coelum diro vehis hoste subacto. 
pr.94	Iam iam nemo patrem temerarius arguat Adam 
pr.95	Quod leue praescriptum violata lege resoluens 
pr.96	Ad loetum patefecit iter: nam culpa, parentis 
pr.97	Compensata satis: quia plus est vincere mortem 
pr.98	Quam nescisse mori. coeli nunc laetus ab aula 
pr.99	Dispicit aetherios axes, & sidera calcat: 
pr.100	Dispositosq; vocat ventura in regna nepote : 
pr.101	Quos iterum formauit aquis, iterum ; renasci 
pr.102	Aeterni docuit diues sapientia patris: 
pr.103	Tete igitur deus alme precor, qui numine prono 
pr.104	Das sentire animis , & te charissime patris 
pr.105	Nate tui, da mellifluum in praecordia verbum 
pr.106	* Nostra tuum: & linguas nobis infunde disertas: 
pr.107	Du teneras formare animas, & corda paramus 
pr.108	Ad verae virtutis iter puerilibus annis. 
pr.109	Inclyta legiferi iam pandito scrinia Mosi, 
pr.110	Quae sit origo poli, vel quae primordia mundi, 
pr.111	Archanamq; fidem quid toto excusserit orbe 
pr.112	*Mentibus ambiguis: qua vires traxerit aucta
pr.113	 Pestis , & in vicium mores cessere vetusti.l) 
pr.114	Da Deus aetemae describere mystica vitae: 
pr.115	Da simul et mentem, da cogrua tempora menti, 
pr.116	Da studium, tanto ne desit cura labori, 
pr.117	Successumq; bonum studij: quodq; omnia vota 
pr.118	 lure supercurrit (scribenti candida mens est) 
pr.119	Ne damnes tantu quod nunc reus audeo munus : 
pr.120	Criminibusq ; meis conniue, cE parco benignus.2) 
pr.121	Quod si lege metri quidquam peccauerit ordo, 
pr.122	Peccarit sermo improprius, sensusq; vacilhtus : 3) 
pr.123	Hinc nullum fidei subeat mensura periclum. 
pr.124	Per dominum Christum qui tecum natus eadem 
pr.125	Magestate viget , pariter qua spiritus almus 
pr.126	Incowprensa animis, sectorum in secula viuit . J) 
1.1	Ante polos coeliq; diem mundiq; tenebras, 
1.2	Ante operum formas, & res, & semina rerum, 
1.3	Aeternum sine praeteriti, sine fine futuri 
1.4	Esse subest: cui semper erat Deus vnus : apud que 
1.5	Viuebat genitus Verbum Deus, & suus almus 
1.6	Spiritus, archani vitalis summa vigoris. 
1.7	Vna trium quo concordi substantia nexu 
1.8	Coniungens summa aeternum virtute beabat. 
1.9	Regnabatq; potens in maiestate creandi, 
1.10	Iam res, & causas rerum, casusq; futuros 
1.11	Et facieda videns, gignendaq ; mente capaci, 
1.12	Secula dispiciens, & quidquid tempora voluunt 
1.13	Praesens semper habens: immensum mole beata 
1.14	Regnum erat ipse suum: regni nec teste carebat 
1.15	Virtus trina deus: qui primum semine nullo 
1.16	Corpora dans rebus, dum res existere cogit, 
1.17	 Iam nostrum effecit munus, quod solus habebat. 
1.18	Vtq; istum faceret diues Sapientia mundum 
1.19	Cuncta simul genuit: sed posthaec semina rerum 
1.20	Ornauit superinductis informia formis. 
1.21	Temporaq; in seriem bene cdditus ordo redegit . 
1.22	Nam non, sacrilegi sensit quod lingua furoris, 
1.23	Casus mentis inops dum nescia semina voluuit. 
1.24	Tam prudens contorsit opus: nec dicere factum 
1.25	Ante aeuum fas est, quia tempore nata mouetur. 
1.26	Nec porro eternum mundum, superisq; coquum 
1.27	Credere fas stabilem semper tenuisse vigorem: 
1.28	Na quod corporibus constat coepisse fatendu est. 
1.29	Corpus enim quod plaga terit, quod tpa soluunt, 
1.30	Atq; abolent ipso qui tendit in vltima fine, 
1.31	Principium ostendit : quod quae sortita probatur, 
1.32	Aut facta haec credi par est, aut nata putari. 1) 
1.33	Factu igitur costat mundu , quod quisq; subactus 
1.34	Annuit, & vero conuictus dogmate credit, 
1.35	Concedes fecisse Deum: qui numine Verbi 
1.36	Et virtute potens quidquid natura putatur 
1.37	Disposuit, iussit, monuit, munusq; creatum 
1.38	Succiduis vicibus (semper fugitiua reformans) 
1.39	Sustinet: ac volucrem retrahens circurotat orbe. 
1.40	Qui si cuncta etiam mauult dissoluere raptim, 
1.41	Confestim in similes formas redeuntia reddet . \') 
1.42	Tanta Patris uis est t6 tanta est gloria Verbi. 
1.43	Vt vero semel attingam primordia rerum:
1.44	Excelsi conuexa poli, terraeq; iacentes, 
1.45	Pars prima est operis, sed terras unda tegebat 
1.46	Aeraq; in medio sordenti nube madentem, 
1.47	Et tenebris se uasta nigris velabat abyssus,
1.48	Et sacer extensis impendens spiritus vndis 
1.49	Altrices animabat aquas, ac semina rerum 
1.50	Nondum copositis fundenda ad germina terris 
1.51	Insinuanda dabat: quum lux immissa superne 
1.52	Emicuit dicente Deo: discretaq; nigrum 
1.53	Vmbra peplu retrahes, summo discessit olympo. 
1.54	 Tum diuina diem appellans prudentia lucem, 2) 
1.55	Indidit & tenebris obscurae nomina noctis, 
1.56	Sic facta una dies de mane ac vespere primo:
1.57	Rursus mane nouum primo iam vespere pulso 
1.58	Reddita lux fecit: quum se firmissima moles 
1.59	Fluctibus e mediis concreto corpore cedens 
1.60	Extulit: ac late duro solidata rigore 
1.61	Diuisas suspendit aquas: gelidumq ; profundum 
1.62	Axibus obiecit calidis: seq ; aequore septo 
1.63	Nixa superfudit rebus, quas circite vasto . 
1.64	Contegit3 ) aetherium deducto hinc nole caelum 64 
1.65	Forsitan hic aliquis sic secum errore perito 
1.66	Disserat aetherijs ne desint pabula flammis 
1.67	Et nimius calor ima petens alimenta sequendo 
1.68	Exurat mortale genus, coelumq ; coruscum 
1.69	Non possint terrena pati, subiecta deorsum est 
1.70	Machina firma poli: quę du nos protegit vmbra , 
1.71	* Interea super impositis frigescit ab vndis . 
1.72	Numinis at vero diuini quaerere causas 
1.73	Mes fuge nostra procul: plus sit tibi credere semp 
1.74	Posse Deum, quidquid fieri non posse putatur: 
1.75	Et magnum pelagus super astra & sidera ferri 
1.76	Ipsorum ratione proba qui credere nolunt, 
1.77	Et mundum pendere volunt, quem conditor ipse 1) 
1.78	Gestet, & immenso constantem pondere voluat. 
1.79	Tertia lux tumidos stupuit discedere fluctus: 
1.80	Quum deus impulsis reliqui iam gurgitis vndis, 
1.81	Aerijs magnum spacijs patefecit inane: 
1.82	Arida tunc primum mundi pars ima retectam 
1.83	Ostendit faciem: tremefactaq; numine Verbi 
1.84	Cerula nudatas cinxerunt aequora terras. 
1.85	Quas vario raptim iussas frutescere foetu 
1.86	Luxuriosa nouo texerunt gemina limo. 
1.87	Et rudis, t6 tenero prorumpens cespite laetis. 
1.88	Iactauit se sylua comis: speciemq ; secundum 
1.89	Edidit vna suam quaeq; arbor et herba virescens 
1.90	* Et fructu cC semen: vestitaq; gramine terra est . 
1.91	Iam tribus exactis motu succensa citato 
1.92	In flammas ignisq; globum se cogere iussa est 
1.93	Solis prima dies: fundataq; semina lucis 
1.94	Puniceos roseo sparserunt fomite crines. 
1.95	Lunaq; noctis honor quaesito lumine fulgrens2 ) 
1.96	Inferiore via soli subiecta pependit: 
1.97	*A quo susceptos radios percussa refudit . 
1.98	Astraq; distinctis coelum pingentia zonis 
1.99	Floribus aetherijs varios vibrare colores, 
1.100	Et magis ornatis se resplendere tenebris, 
1.101	Cerula nox stupuit, rutilis dum spicula flammis 
1.102	Fusa micant, vrgentq; alacres noua sidera iactus, 
1.103	Quae solare iubar radijs obducit apertis 
1.104	Tempora quadrifidi mensurcts quattuor anni. 
1.105	Sol quoq; quum cursus lune sit mestruus , vno 3) 
1.106	Contentus cursu reuolutum conficit annum 
1.107	Artificemque sacrum mira compage fatetur. 
1.108	Quinta dies mouit spirantia corpora ponto, 
1.109	Quae liquor humectans genuit: sparsitq; profunda 
1.110	Delitias pelagi: vario quas germine miris 
1.111	Formauit natura modis: educere iussa 
1.112	E toto partes, formasq; ex corpore inani. 
1.113	Quinetiam in brutas animam dedit ire figuras : 
1.114	Quaeq; salis tumidi squalentia gurgite terga 
1.115	Cete vasta leuant molli differta sagina, 
1.116	Edidit: & qui horum conseruat corpora, nostris 
1.117	Corporibus nocet ipse liquor: genitalis alumnus 
1.118	Piscibus: ipsa etiam terrae qui germina nutrit, *)
1.119	Hinc volucres quoque molle genus traxere vigore : 
1.120	Nã liquidas du format aquas, immissaque pontum 
1.121	Vita subit, feruent multo tumida aequora partu: 
1.122	Nec satis est pisces genus oS exurgere: quodq ;
1.123	Squammea turba salo summas euadit in vndas: 
1.124	Ni uolitans in aquis, sensim natet aethere puro, 
1.125	Aetherios volucris contingere docta recessus: 
1.126	Ergo materies auibusq; (6 piscibus vna est . 
1.127	 Iam bis terna dies claro radiabat olympo: 
1.128	Tertia post calidi genitalia munera solis: 
1.129	Iamque tepens tellus grauidos laxauerat artus: 
1.130	Quum maiora agitans iussit Deus edere terra 
1.131	Omne animal, vegetat ratio quod sola mouendi: - 
1.132	Cui seruire datum quo rerum postulat vsus. 
1.133	Nec mora prorumpunt foetis vitalia terris 
1.134	Pignora, quęq ; sui generis sortita figuras. 2) 
1.135	Hic mihi iam fas sit quadam perstringere, quoda 
1.136	Solicito trepidum penitus transmittere cursu: 
1.137	Mutata quadam serie transmissa referre. 
1.138	Postquam cucta datus generatim protulit ordo3 ) 
1.139	Veris plena bonis, & multa dote referta: 
1.140	Quae Deus in longa seriem mansura foueret : 
1.141	Autori perbeUa suo tum machina visa est. 
1.142	Sed quid id est quod mudus erat, quod sidera, & ortus, 
1.143	Aetheraq; & vitreum pelagus terręq ; virentes, 
1.144	Ni spectator, adest tantę quem gloria molis 
1.145	Impleat: atq; oculis auidum per singula ducat? 
1.146	Quorsum tam lati fines, possessioq; ampla, 
1.147	Si rerum possessor abest? hęc rector olympi 
1.148	* Secum animo versans & Verbi pondere librans, 
1.149	Stat data summa operi, bona sunt quecuq ; creaui 
1.150	Nunc hominem faciamus, ait, qui regnet in orbe, 
1.151	Et sit imago dei: similem decet esse creanti 
1.152	Liber ad arbitrium fruitur qui mente creatis. 
1.153	Dixerat haec, & factus homo est , seu corpore toto 
1.154	Siue anima ac specie, forsan quo more futura 
1.155	Quo facienda facit, quo factum semper habebat: 
1.156	Etsi praeteritum iam nondum accesserat aeuum, 
1.157	Ergo hunc praepositum rebus cu coniuge iussit 
1.158	Crescere per sobolem, terrasq; replere vacantes. 
1.159	Tum natura semel rebus concessa creatis, 
1.160	Praesertim quas uita mouens animare videtur, 
1.161	* MultipUcat quęcumq ; suis primū edita formis . 
1.162	Septima lux magnum vt vidit cessasse paretem, 
1.163	Sed generum tantum numeros desi/sse creare, 
1.164	Et requiem tenuisse suam : tum iure sacrata est 
1.165	Perfectu quae vidit opus: naq ; hoc quoq; plenū est 
1.166	Virtutis, cessasse Deum, posuisse labores, 
1.167	Nam genitis forma patris quam dextra parare 
1.168	Bis ternis dominum satis est patrasse diebus. 
1.169	Septima lux docuit venerandae exempla quietis 
1.170	Quam coelesti omnes sperare iubemur in aula, 
1.171	Si modo non desint operum bona facta pioru . 
1.172	Haec quoq; lux illa signat, qua tartara Christus 
1.173	Soluit, & euicto reditum patefecit auerno. 
1.174	Dum patriam ille semel victor rediturus in aula, 
1.175	* Iamq ; malorū expers, humana in carne quiescit . 
1.176	Sic cessare Deus, sic ocia sumere nouit, 
1.177	Plus vt agat cessans, pariter sine fine quiescens. 
1.178	Ac sine fine operans, seriemq; & tempora misces, 
1.179	Cessando consummat opus, quodcunq; crearat. 
1.180	Sed qualem qualiq; Deus formauerit Adam 
1.181	Materia, hic paucis cum Mose resumere fas est. 
1.182	Primus enim meritis postremus in ordine toto 1) 
1.183	Factus homo: vt sese rebus praestare creatis 
1.184	Nosset, <6 hinc laudes duo persolueret aequas, 
1.185	Ergo homini factura Dei manus optima summi2 )
1.186	Tractatu facili ac bene gnarum cedere limum, 
1.187	Et flexum formamq; sequi qua ducitur arte 
1.188	Sumit, (6 humanã quale iam mente gerebat 
1.189	Explicat in speciem: tum flatu immissa vaporo 
1.190	Vita rigauit humum: tellus mollita liquore 
1.191	Vertitur in carne: & sanguis, qui lubricus humor, 
1.192	Distendit molles per nota foramina venas. 
1.193	Tunc mentis iam plenus homo tellure relicta 
1.194	Exilit, ac dominu prudens rationis adorat. 
1.195	Haud aliter bustis madata resurgere apertis 
1.196	Corpora quum Christi caelo delapsa patenti 
1.197	Maiestas grauidae reserat viscera terrae, 
1.198	* Exilient , dominumq; colent terraeq ; poliq; . 
1.199	Na quod no habuit quum sic è puluere vili 
1.200	Humanu in formâ copactû est corpus honoram
1.201	Perfacile est rursum itegrfi , vt de puluere reddat
1.202	* Quod ia habuit multos caelatu terra per annos . 
1.203	* Sic ex antiquis prodibunt iussa sepulcris 
1.204	* Corpora, quaeq; suas rursum assumentia partes . 
1.205	Sic nil praeteriti est quod nõ sit forma futuri. 
1.206	Sed id hominis tepus sede atq; habitacula primi
1.207	Pandere, vbi toto acceptu pro semine vulnus. 1)
1.208	Eoos aperit foelix qua terra recessus 
1.209	Editiore globo nemoris Paradisus amoeni 
1.210	Panditur: & teretis distinguitur ordine syluae. 
1.211	Hic vbi, iam spatijs limes discernitur aequis 
1.212	Solis, & aeternum paribus ver temperat horis. 
1.213	Illic quaeq; suis diues stat fructibus arbor, 
1.214	Pomaq; succiduis pelluntur mitia pomis: 
1.215	Quae iucunda oculis, & miri plena vigoris 
1.216	Mebra animosq; fouet, pascutq ; sapore & odore. 
1.217	Sidereos hic terra vibrat distincta calores 
1.218	Semper flore nouo frondens, fructuq; recenti: 
1.219	Hic fragiles soluunt calamos animata vigore 
1.220	Muneris ambrosij spirantia cinnama odores . 
1.221	Sed nec quod Medus redolet, vel crine soluto 
1.222	Fragrat Achemenius, quod molli diues amomo 
1.223	Assyrius, messisq; rubens Mareotica nardo, 
1.224	Quod Tartesiaci frutices, quod virga Sabaei, 
1.225	Quodq; Palaestinus lacero flet vulnere ramus: 
1.226	Omnia certatim hunc congesta putabis in hortu ,
1.227	Naq ; huc cucta Deus pariter quae singula certis 
1.228	Accepit natura locis, conferta regessit. 
1.229	Motaq; dum leni vibrat nemus aura meatu, 
1.230	Vnum ex diuerso nectar permiscet odore: 
1.231	Fitq; nouu munus sibi nulla quod asserat arbor. 
1.232	Quaq ; tremens blando sensim iactata fragore 
1.233	Commotis trepidat folijs, sonat arbore cuncta 
1.234	Hymnum sylua Deo, modulataq; sibilat aura 
1.235	Carmina, nec vacuus vanum quatit aera motus. 
1.236	Quippe apud autorem, qui totum mole sub vna 
1.237	Res rebus nectens alterna lege retentat, 
1.238	Nil temere fieri vel frustra credere par est . 
1.239	Quin etiam speciosa, nemus, syluaeq; coruscae 
1.240	Argumenta operum sunt, & plantaria rerum, 
1.241	Nec dubium primi quin delicta ante parentis 
1.242	 Hic sua fixissent pariter tentoria spcum2 )
1.243	Gloria, simplicitas. studium, sapientia, veri 
1.244	Diua tenax, prudentia, gratia, honorq ;, salusq ;, 
1.245	Praeclariq ; animae adfectus: atque inclita virtus: 
1.246	Et quidquid pulchra orbis habet: quid denique paucis 
1.247	Enumerare uelim qua plurima munera verbis? 
1.248	Iam satis hoc fidei est laeto quod semine surgens 
1.249	Hinc arbor vitae celsis petit aera pomis: 
1.250	Illinc diuerso nocitura peritia fructu 
1.251	Notitiam rerum suspend# ab arbore legis. 
1.252	Ad gremium sacri nemoris quod sylua coronat 
1.253	Fons scatet & diti prolem virtute maritat 
1.254	Quadrifido tumidu lętus caput amne resoluens, 
1.255	Ditior oceano iugi, nam gurgite prono 
1.256	Ille suos donat latices, iste accipit omnes. 
1.257	Nec turget tamen: at minor est qui crescere tatis 
1.258	Fluctibus infusis qua qui decrescere nescit 
1.259	Amnibus effusis: quorum primo ordine Phison 
1.260	Prosilit exultans, fontis pars quarta beati: 
1.261	Edens naturae quas dat prudentia dotes: 
1.262	Gangetisq; replet populos atque Indica regna 
1.263	Distendit limo, terrasq; & semina voluens 
1.264	Quae facit arua serit, nudis qua squallet arenis 
1.265	Aurea fulgentis inter ramenta metalli. 
1.266	Hic vbi fulmineo rutilans carbunculus igne,
1.267	Ac viridi radiat fulgescens luce smaragdus. 
1.268	Nec minor inde Geon placidis sed mitior vndis 
1.269	Niliacas attollit aquas, arsuraq; late 
1.270	Diluuio tegit arua pio coeloq; repugnans 
1.271	Temperat aethyopum stagnis refluetibus vnrfas . 
1.272	Tertius hinc rapido percurrens gurgite Tygris 
1.273	It comes Euphrati, iuncta quos mole ruentes 
1.274	Tellus uicta cauo sorbet patefacta baratro: 
1.275	Donec in Armeniae saltus ac Medica Tempe 
1.276	Quos no sustinuit, nec iam capit, euomat amnes. 
1.277	Sed Tygris, nigro tanqua indignatus auerno , 
1.278	Prosilit ęthereas motu maiore sub auras. 
1.279	Et rursum spelaea subit, mersusq; cauernis 
1.280	Intus agit fremitus: & fortior obice factus 
1.281	Multiplicatur aquis, atfroq ; citatior antro 
1.282	Exit, & Assyrios celeri secat agmine campos. 
1.283	 Iustior Euphrates, diti qui gurgite largus 
1.284	Irrigat arentes subiectae Persidis agros: 
1.285	Mollibus elicitus riuis: atq; omnibus aeque 
1.286	Seruit, & humanos totum se praebet in vsus: 
1.287	Donec siccus aquis, nome quoq; prodigus ipsum 
1.288	Consummat terris, pelagi quod debuit vndis. 
1.289	Haec igitur cuncto naturae ditia foetu 
1.290	Imperia, & tanta virtutum dote refertae 
1.291	Delitiae, prima est hominis possessio primi, 
1.292	In quam deductus vita exultare perenni 
1.293	Accola iussus erat: tales ergo ille locatus 
1.294	* Inter delitias, t6 longe pinguia Tempe:
1.295	Dum fit adhuc dignus discitq; labore mereri, \') 
1.296	Expers moerorum curaeq; ignarus agebat. 
1.297	Tantu apud autore est meriti pro nomine summi 
1.298	Nodu aliquid meruisse mali: Quatu ergo putamus 
1.299	Soluere posse patrem rediturae in tempora vitae: 
1.300	Cuius apud famulos iam tum largitio pura 
1.301	Non merces Paradisus erat? quodq; illa seuerae 
1.302	Legis scita tulit, libertatisq ; periclum 
1.303	*Facturus, vitam seruanti iussa recepit:
1.304	Spondet adhuc maiora bonis, & praemia seruat : 
1.305	Qui causam meritis statuit, dum vesccre dixit 
1.306	Arboribus cuctis: hanc tatum horrere memeto . 
1.307	Quae diuersarum gestans examina rerum, 
1.308	Notitiam recti atq; mali sub cortice gestat . 
1.309	Nam trdsgressores mors cruda (6 dire sequetur. 
1.310	Tali lege data ratio docet optima, quod non 
1.311	Mortalem Deus in primaeuo tempore fecit 
1.312	Primū homine: quin ille sibi morte attulit vltro . 
1.313	Nãq ; & in hoc e magne Dei indulgetia summi: 
1.314	Dum quod no meritis sed tantu sponte benigna 
1.315	Largitur famulis, nostri cupit esse laboris. 
1.316	Et se quod donat mauult debere videri. 
1.317	At tu quem sacri nectit custodia iuris. 
1.318	Ne querere angustis quod clausa licentia metis 
1.319	Parte sit orba sui: nil hac tibi lege recisum est . 
1.320	Ante potestatem tantum terraeq; marisq; 
1.321	Nactus eras, nunc iam regni vitaeq; perennis, 
1.322	Porro & mortis habes. Tuc vt sibi cuncta parete 
1.323	Indulsisse pium rudis incola crederet orbis. 
1.324	Omne animal quod iam tellus dare iussa crearat 
1.325	Ejfundens tacito vernans b corpore semen,
1.326	Iussit adesse Deus: proprioq; obedire tyranno: 
1.327	Scilicet vt cunctis bene congrua nomina rebus 
1.328	Inderet: atq; suo factum vnumquodq; vocaret
1.329	Nomine, natura quod natum est suapte moueri. 
1.330	Nec mora viuentum parendi haud nescia sistit 
1.331	Omne genus natura Deo: quacunq; vocatur 
1.332	Mundi parte noui coeunt animalia in ipso 
1.333	Temporis articulo modici: siue illa fuissent 
1.334	Molli lenta gradu, aut rapido proptissima cursu, 
1.335	Impete vel subito consueta per aera labi 
1.336	Aut innare vndis, aut pondere lubrica ferri: 
1.337	His Deus omnipotens Adam praesente vocatis,
1.338	* Vnumquodq; suo donauit munere largus . 
1.339	Armauitq; manu, cornu, pede, dente, veneno, 
1.340	Atq; alijs quibus artis inops animiq; minoris 
1.341	* Et ratione carens animal se protegat, & se 
1.342	Seruet ab aduersis rebus: sed nullu animantum 
1.343	Aequa homini specie vultuq; habituq; vigebat: 
1.344	Ast homini prope diuinos addebat honore . 
1.345	Totq; inter duplici vitam illustrantia sexu 
1.346	Impar solus erat, dudum qui coniugis aptam 
1.347	In se materiem gignendae ignaras habebat. 
1.348	Ergo opus aggreditur notu Deus: ictaq; raptim 
1.349	Corda viri tanto dissoluit languida somno, 
1.350	Mentis ut experti costam subduceret imam : 
1.351	Vnde caro fit iussa sequi: nam sponte recedens 
1.352	Pellis, iter planum costae praebebat eunti:
1.353	Illęsis prorsum membris, & corpore sano. 
1.354	Quae varios operante Deo digesta per artus 
1.355	Accepit formam, calidisq ; animata medullis 
1.356	Versa in opus vitae est, sexu iam grata secundo. 
1.357	Sic permissa suo formata est Eua marito. 
1.358	Hoc nunc turba loco stolidissima desine tandem 
1.359	Quaesitis animum vanis torquere: nec isthic 
1.360	Quaerere quur hois confecta est foemina mebris : 
1.361	Quum iam a principio molli de puluere fingi 
1.362	Posset, & ex nihilo: (6 causa desiste latentes 
1.363	Scrutari: quaqua si coniectare licebit*) 
1.364	Ex homine effecta est mulier, cognatio quaedam 
1.365	Mutuū cE alternū inter se vt misceret amore: 
1.366	Semet in alternis cogens agnoscere membris. 
1.367	Hinc Euam partem esse sui mox protinus Ada 
1.368	Sensit vt exaltans, tetigit noua gratia mentem, 
1.369	Mentis dr affectus in viscera nota receptus, 
1.370	Irruit: & tanto penetrauit in ossa calore, 
1.371	Vt iam scire daret, quid coniunx esset, & vxor , 
1.372	Quid dulces nati, postponendiq; parentes 
1.373	Coniugibus, quidna vna ambos in carne manere, 
1.374	Aeternam pariter vitam ducentibus esset. 
1.375	Porro dum mundi vitijs & tabe carebant 
1.376	Diuinis viguere animis, nullius egeni: 
1.377	* Quū penes hos esset mundi substantia, & omnes 
1.378	Quas dabat orbis opes: nec prorsum obnoxia morbis 
1.379	Corpora gestabat: nõ hos cogebat ad esum 
