pr.1	Summe & sancte Deus, cunctae virtutis origo, 
2.361	Antiquae laxantur aquae,\' iamq; aethere aperto 
2.362	In nubes vacuas coelum pluit: & reserata 
2.363	Defluit in lymphas mundus coelestis abysso:
2.364	Atq; nouos pandit fontes torrentibus aequos. 
2.365	Dumq; vno immixtum raptim se gurgite iungit 
2.366	Quod coelu , quod terra vomit, quod nubila fudut , 
2.367	Inuoluit mersos mixtis cultoribus agros, 
2.368	Implicitosq; greges stabulis, cum ciuibus vrbes, 
2.369	Obruit inter aquas: populiq; natantd ruina 
2.370	Nulla manet rerum facies: tegit omnia flumen: 
2.371	Crescendoq; suum perdunt & flumina nomen. 
2.372	Mox etiam cursum, nullis satiabilis vnquam 
2.373	Amnibus oceanus: tam magna mole ruentes 
2.374	Iam persentit aquas: aucto quas gurgite maior 
2.375	Pellit, & in cumulum redeuntes surgere cogit. 
2.376	Donec contractis aestum attollente profundo 
2.377	Vndiq; littoribus summo se circite iungit 
2.378	Fluctus, & oppressis concurrunt aequora terris. 
2.379	Et iam terquinis super omnia celsior vlnis 
2.380	Archa ferebatur: namq; hęc mensura supremos 
2.381	Excessit montes, cum quadraginta diebus 
2.382	 Vnius pluuiae furor, & mors vna fuisset. 
2.383	Ter quinquagenis dehinc solibus aere sudo 
2.384	Consimilis ponti modus & mensura remansit. 
2.385	Dum pater omnipotes iamdudU in carcere ggtis
2.386	*Conclusae miserens, terris abscedere magnum 
2.387	Paulatim iussit pelagus, sensimq; relabi: 
2.388	Ne raptim fugiens terras subuertere omnes: 1) 
2.389	Et stabilem in sedem tellus vt sicca mearet. 
2.390	Deniq; diffuso planus mox aere vertex 
2.391	Prodere se coepit: pedetentim t6 summa videri 
2.392	Posse iuga, ac planos scopulis descedQre fluctus: 
2.393	Cumq; residenti sensim prorumpere syluas 
2.394	Aequore, & occultos paulatim surgere colles. 
2.395	Iamq; niger patula speculator missus ab archa 
2.396	Aera reppererat placidum, praedaq; reperta 
2.397	Non iam curabat consueta in claustra reuerti: 
2.398	* E1\'go emissa semel vitali e sede columba 
2.399	Nil referens certi, rursum dimissa reportat, 
2.400	Paciferae frugis paruum libamen oliuae. 
2.401	Tantus ad indicii hoc magni cu laude parentis 
2.402	Captiuúm fletus, quo se gaudere reuelant 
2.403	Exoritur: quantus muris quu victor acerbus 
2.404	Insultat subitum obsessis, si forte feratur 
2.405	Auxilium: quantus quu iudice missa modesto 
2.406	Addictos rursum vitae sententia reddit: 
2.407	Quantus in ambigui funus quu vita recurrit 
2.408	Inter lugentum lachrymas & gaudia fletus: 
2.409	Postea qua rursum speculatrix arua patere 
2.410	Nunciat, hoc ipso terris quod missa receptis 
2.411	Non redijt, taedet pigras perferre latebras: 
2.412	Et iuuat ad coeli ventos spirare patenti : 
2.413	Atq; animam aetherio laxatam pascere sensu. 
2.414	Sed nulli claustro fas est exire patenti, 
2.415	Donec relliquias illuc qui iusserat orbis is 2) 
2.416	Ingredier , iubeat sacris excedere claustris, 
2.417	* Coclitus admonitum fida cum coniuge Noe, 
2.418	Cuq ; domo, & natis pariter nuribusq; pudicis: 
2.419	Et noua deductis iterum dare rara colonis: 
2.420	Cunctaq; succiduae seruata animantia proli, 
2.421	* Iam captiua diu claustris emittere apertis,
2.422	Quae bonus humanos opifex seruarat in vsus: 
2.423	Quę postqua data porta, ruunt: pars aera pennis, 
2.424	Pars saltus, syluasq; petunt: pars mersa cauernis 
2.425	Infoditur, patulis: terrae pars libera campis, 
2.426	Exultat siccis, & prato vernat aperto. 
2.427	At vero mundi sortitus regna secundi 
2.428	Cuncta oculis Noe lustrans, ac mente capaci 
2.429	Accipiens, animum ; volens saturare replendo: 
2.430	Cuncta haurit, rapido perlustrans omnia visu. 
2.431	Miraturq; nouum solito fulgentior orbem 
2.432	Tum mage sol rutilus: ridet maiore sereno 
2.433	Laeta poli facies: & desperata virescunt 
2.434	Foetibus arua nouis: sed adhuc versatur imago 
2.435	Ante oculos, tantae semper memoranda ruinae, 
2.436	Inter aquas quid pertulerint: quid munere sacro 
2.437	Non etiam tulerint, fremeret quu verbere saeno 
2.438	Pontus: & illisas contemneret archa procellas. 
2.439	Cumq; suis Noe qua prompta & lata reuoluit 
2.440	Se circum summi fuerit largito patris. 
2.441	Cogit (6 attonitos mirari ac voluere secum, 
2.442	 Vnde tot esca animis toto suffecerit anno: 
2.443	Quis potus, namq; hoc constat si caetera vitae 
2.444	Suppeterent, clausos dum fluctuat archa perire 
2.445	Inter aquas potuisse siti: nisi rector olympi 
2.446	Humano prorsum auxilio, donoq; carentes 
2.447	Sustinuisset, eo quo condidit omnia nutu. 
2.448	Ille etenim longe perituros carcere noctis 
2.449	Affectu lucis spolians, virtute repleuit, 
2.450	Ille vt tam segnem possint perferre quietem, 
2.451	Infudit pigri placidum torporis amorem: 
2.452	Iam quid enim nõ omnipotZs sua dextera possit, 
2.453	Qui gelidi raptim mersos sub gurgitis vndas 
2.454	Quū visum est ardere facit: flamasq ; sub ipsas 
2.455	Algere inuectos: & qui nunc tempore paruo 
2.456	Posse perire homines docuit mergentibus vndis
2.457	Ostendet flammis atq; vndis posse renasci. 
2.458	Finis lib. secundi. 
3.1	Talia mente gerens ventnraq ; secula cernens 
3.2	No prius officij quidqua seruatus inire 
3.3	Costituit : quam sacra Deo laude ; rependat, 
3.4	* Gratcsq ; euaso referat discrimine Noe. 
3.5	 Mox niueo sacra exurgunt altaria saxo: 
3.6	Agnovitq ; haec prima recens altaria mundus:
3.7	 Antea totus enim conuexo tramite coeli 
3.8	Templu mudus erat, tū dudu ad sacra paratis 
3.9	Affuit e gregibus septenis hostia praeceps: 
3.10	 *Seu volucru ex specie, mollis quas sustinet aer: 
3.11	*Siue ex ijs quae terra parit: nil septima quaeq; 
3.12	 Aris sternuntur deuota animalia sacris, 
3.13	 Aethereo tum mox ignis demissus olympo 
3.14	Libat odoratos ad sacra altaria foetus: 
3.15	Ambrosiumq; Deo flagrant holocausta vapore . 
3.16	Et quanquam nostri nil muneris indiget ille 
3.17	 Totius mundi dominusq; Deusq;: suorum
3.18	 Attamen officijs venerari cE munere gaudet: 
3.19	 Qui lymphis tandem sic Noe affatur ademptis:
3.20	Et si parua fuit tanto pro crimine poenae 
3.21	 Vitio , vindicibus pluuijs, coeloq; refuso 
3.22	Tot scelerum damnasse reos, sedemq; nocentem 
3.23	Terrarum mage diffuso purgasse profundo: 
3.24	Non tamen offensi feriemus verbere tali * 
3.25	Vlterius mortale genus: quauis ruituras 
3.26	Per varium facinus, per crimina pristina rursum 
3.27	Humanas mentes videam, gentesque profanas: 
3.28	Non tamen interea cessabit dextera vindex 
3.29	 Supplicia iniustis quę reddat, prquia iustis. 
3.30	 1708 igitur quos vita probat iustissima nobis . 
3.31	Crescite securi, et foecunda prole referte 
3.32	Arua, nouosq; greges longis distendite terris: 
3.33	Seruabunt elementa vices, cunctisq ; diebus 
3.34	Sparsis seminibus reddetur debita messis. 
3.35	Curret opus mundi compar, discordibus horis: 
3.36	Aestati certabit hyems : ac tempora librans 
3.37	Veris & autumni fugiens replicabitur annus. 
3.38	Yosq ; (quibus regnum solidi permisimus orbis) 
3.39	Tota tremet, metuet ; ampli substantia mundi . 
3.40	Imperifl ecce damus vobis res prorsus in omnes: 1)
3.41	Totq; inter species rerum quae sponte mouentur 
3.42	Camea mSbra quidem vestros largimur in vsus. 
3.43	Quanquã interdictum vobis a sanguine vini 
3.44	 Esse volo: quS si quisqud ederit, haud secus acris 
3.45	Illum iudicij plectet sententia: quam si 
3.46	Hauserit humana fluidum de caede cruorem 
3.47	Quem repeta semper vindex, adeoq; requiram, 
3.48	Vt mihi non solus pendat rationis habundans 
3.49	Supplicium, sed bruta etia, cruor omnibus aeque 
3.50	Sit sacer humanus: verum ne postea quisquam2 ) 
3.51	Diluuium metuat, tali sit foedere tutus . 
3.52	Quum leuis in nebulas pedcs se verterit humor, 
3.53	Et nigras cumularit aquas in cocaua nubes, 
3.54	Effundam radios, & pulchrum circite summo 
3.55	Arcum componet mihi solis imago recuruum: 
3.56	Fingentem connexa poli, qui luce colores 
3.57	Exhibeat varios, & in aera dissipet imbres.3) 
3.58	Quod sibi venturi specimen praesumere signi 
3.59	Posteritas secura potest: vt foedere tali
3.60	* Post haec diluuium credat non esse timendum . 
3.61	Talibus attenti imperijs ctt cdiuge Noe 
3.62	 Post habitas domino grates, laudesq; repensas,
3.63	Certatim cE limo dulciq; vligine laeta 
3.64	Arua pater natiq; simul, queis firmius aeuum, 
3.65	Mox subigwnt rastris, & semine rura maritant. 
3.66	Tum vere effusis late densissima campis 
3.67	Herba virens, flauas qua durauisset aristas,
3.68	 *Solis ob ardores in frugem lacte gelato 
3.69	Reddit multiplicem cumulato foenore messem. 
3.70	Et noua praegrauido iam palmite vinea, diti 
3.71	Luxuriat fructu, tortaq; ex arbore nectar 
3.72	Parturit, < duro nascentia pocula ligno. 
3.73	Forte Deo Noe celebrabat laetus honores 
3.74	 Indulgens sacris epulis, vinuq ; propinans 
3.75	Prima e vite noua : quo demum largius hausto 
3.76	Hinc alto grauidus somno mebrisq ; solutis 
3.77	 Non bene cdposita qua veste iaceret, humiq;
3.78	 *Prostratus spectanda daret genitalia natis 
3.79	Mebra suis: vni tibi Cham deterrime risum 
3.80	 Mouit origo tui: nec iam peccasse sat vni 
3.81	* Esse tibi credens, fratre aspergine culpae 
3.82	Contendis maculare tuae: sententia multo
3.83	 Quos melior, melior ; animus detecta parentis 
3.84	 Obiecta docuit cejare virilia palla: 1) 
3.85	Nam patrium auersis manibus texere pudorem 
3.86	Sem simul atq; Iaphet, tali dignissima patre
3.87	 Pignora, quos ideo fratris dedit esse minoris
3.88	 Iure pater dominos somno vinoq; solutus. 
3.89	 * Qui mox natorum euigilans benefacta suorum 
3.90	 Et Cham demeritum tali mercede rependit. 
3.91	Cham tu inquit, maledictus eris, seruusq; tuoru
3.92	 Aeternum fies ventura in secula fratrum . 
3.93	Sem vero benedictus erit: fratremq; minorem 
3.94	Participem secum cdmuni sede bonorum 
3.95	 Efficiet, quorum late possessio currat.2)
3.96	Haec fatus senior, quum ia decurreret annos 
3.97	Mille minus decies quinos: in pace quieuit. 
3.98	 Interea domini dum sancta in lege vigeret
3.99	 Posteritas multis iamq; aucta nepotibus, & se
3.100	Coelorum ac terr domino cdmitteret vni: 3) 
3.101	 Tunc sanctis hominum parebant omnia iussis: 
3.102	 Terra grauis, liquidum pelagus, vegetabilis aer. 
3.103	* Non opus arte illis, coelesti namq; magistro 
3.104	 *Omnia discebant: sed postqud in crimina mudus 
3.105	 Exijt (6 late vicijs sese abdidit imis, 
3.106	Perdidit insigne hoc munus danata propago: 
3.107	Oblitamq; Dei plures effingere diuos 
3.108	 Non puduit: tanti est supremi obliuio patris .
3.109	Tum grauis inuentor loeti cessare capacem 
3.110	 Fraudis materiem non passus, cuncta maligno 
3.111	Subdidit arbitrio, quo fatum induceret orbi,
3.112	 Suaderetq; Deum vel iam non esse, vel ista 
3.113	Inferiora huius cotemnere munia mundi. 
3.114	Ergo res hominu cunctas euentaq; rerum 
3.115	Quae domino fuerat par assignare supremo, 4) 
3.116	 Assignare vagis persuasit subdolus astris: 5) 
3.117	Atq ; auium spectare fibras , motusq; volantum, 6) 
3.118	 Et studio ingenti magice scelus intulit artis. 
3.119	Et plures creare Deos, idolaq; muta 
3.120	 Aut magis idolis latitantem semet in ipsis 
3.121	*Suasit adorari: multo mage dignus aduri. 
3.122	 Inq; nephanda prior descSdit crimina Nemroth 
3.123	*Impietatis apex, Cham seruo è semine natus,
3.124	Mole & mete gigas, Babylonia regna gubernas 
3.125	Persarum hic animos capiens venator iniquus, 
3.126	A veris domini sacris traduxit ad ignem. 
3.127	Nec modo plus aequo cupidis hac arte sagaci 
3.128	Ille caput sceleru , mundi infensissimvLS hostis 
3.129	Illusit curis hominu, sed mentibus ipsis, 
3.130	Irruit: & sensus penitus descendit in omnes: . 
3.131	Mox & in affectus: nã quu patris vnica proles 
3.132	Spem generis loeto secum traxisset accerbo 
3.133	Infoelix Nemroth lachrymas noctesq; diesq; 
3.134	Continuans hebetiq; trahens plangore querelas 
3.135	Du furit, & raptum quaerit per singula natum,\') 
3.136	Effecta moestum solatur imagine luctum:2) 
3.137	Et pario effecta filij de marmore formam 
3.138	 Credidi infoelix incluso viuere sensu: 
3.139	Et questus audire suos, mox inde dicatis 
3.140	Erectisq; aris diuinos addit honores: 3) 
3.141	 Inq; loco iubet esse Dei, tum protinus omnes 
3.142	Amplex§ gentes scelus hoc, crimenq; sequutae,4) 
3.143	Pro dijs quęq ; suis charos habuere parentes. 
3.144	Post etiam simili reges in honore locarunt 
3.145	 *Dixeruntq; Deos: quorū sub nomine mendax 
3.146	Graecia, dum veris falsa insinuare laborat: 
3.147	Addidit obscuras vanis rationibus vmbras, 
3.148	Excusans tumulos atq; indita nomina bustis: 
3.149	Donec per species sese dementia cunctas 
3.150	/Voderet, & minimis rebus mebrisq ; pudendis 
3.151	Nomen inane Dei mundo ridente daretur . 
3.152	Talibus errorum salebris fomenta daturus 
3.153	 Ambigua inuentor loeti responsa ciebat: 
3.154	Vsus ad insidias aut igni, aut fonte calenti, 
3.155	Aut terra ex antris ventos spirante loquaces: 
3.156	Et falsum vani sibi nomen Apollinis indens. 
3.157	Talibus a domino gentes trux ille remotas 
3.158	 Captabat laqueis, quo ducens quumq; volebat: 
3.159	 Tanti est a sancto domini discedere cultu. 5) 
3.160	 At vero egressi vnde sumus, redeamus ad illam
3.161	Maiorum seriem: quae paucos aucta per annos
3.162	 Vsque adeo excreuit, quod mox oriente relicto 
3.163	 Inde nouas alio compulsi quaerere sedes,
3.164	*In campum (Semnaar veteres dixere) patentem 
3.165	 * Perueniunt: quumq; his etiam discedere terris
3.166	Cogitur, in varias partes spargenda iuuentus: 
3.167	Coepit in haec moestas trissima uerba querelas. 
3.168	Heu quam non certus vitae status ordine coepto ; 
3.169	Fert homines? quamq ; ignaros - vel prospera fallut 
3.170	Per varios casus? quam voti summa petiti 
3.171	Tendit in aduersum? iam nos (si dicere fas est) 
3.172	Quod sperata patru precibus numerosa nepotvi 
3.173	Creuit turba, piget: quod iam spargeda per orbe 
3.174	Exilio cumulata manus, perituraq ; longe 
3.175	 Finibus a patrijs: nos ergo siccine tandem I) 
3.176	 Longa pauperie defecta, inhonoraq; mebra
3.177	Ignotis dabimus passim tumulanda sepulchris? 
3.178	* Ncc saltem miseri tumulis claudemur auitis?\' 
3.179	 * Nullaq ; erit nostri post mortem fama superstes ? 
3.180	Quare agite o iuuenes du vires turba ministrat 
3.181	Quae vobis superest, quae finem nesciat vflum 
3.182	 Egregiam aeternis fama dimittite facies : 
3.183	Vrbem condamus, cuius sub moenia turrem 
3.184	Vsq; attollamus, donec pingentia coelum 
3.185	Sidera, & excelsi conuexa attingat olympi. 
3.186	Nescia posteritas vt nos hinc orbe relicto 
3.187	In coelum migrasse putet: sic mota iuuentus 
3.188	Contemnunt cautes, & quidquid monte reciso 
3.189	Defluit: ac domitae fictos de viscere terrae 
3.190	Constringunt igni lateres, operisq; futuri 
3.191	Materiam proprio malunt debere labori: 
3.192	Hanc interstratu sic nectit vtrinq; bitumen, 
3.193	Vt solidas simulent circundata moenia cautes. 
3.194	Mox turris properata subit, mox vertice nubes 
3.195	Transilit, ac fruitur coeli propiore sereno. 
3.196	Tum pater omnipotens caelesti voce senatum
3.197	 *Congregat angelicum: turbeq ; insana superbe
3.198	 *Facta stupens, isthęc regni consortibus infit. 
3.199	En terrena phalanx quo iam temeraria pergit 
3.200	 *Cernitis, c6 quantos imprudens tendit in ausus . 
3.201	Mortali quae structa manu contigere celsos 
3.202	Credit posse polos, & ad aethera ducere nostrum. 
3.203	Quu nemo indutus terreno corpore coelum 
3.204	Ascendat, nisi qui coelo descenderit alto. 
3.205	Sed quia gens vna est, eade quoq; forma loquedi 
3.206	In cdponenda persistent turre: nec ante 
3.207	 Desistent quam mutua opus consensio coeptum 
3.208	 Finierit: tanta est humanae insania mentis.i) 
3.209	 Ergo agite, ( vt vetitu norint quod posse negata est) 
3.210	Iam descedamus , tumefactaq; corda superbo 
3.211	Consensu varij turbemus vocibus oris: 
3.212	Vt quod peccartmt concordis crimine metis, 
3.213	Confusae damnet melior discordia linguae. 
3.214	Dixit, & intentos operi molemq; leuantes 
3.215	Mentibus attonitis subiecta obliuio primum 
3.216	Intrat, & ignotae subijt perfectio linguae. 
3.217	Increpitant operis studio cessante magistri 
3.218	Cunctantes socios, sed vocem nemo remittit 
3.219	Non intellectis, quod siquis tentat, inane 
3.220	Sibilat, aut rupti fremitu sermonis anhelat:2) 
3.221	Sic vanum praua susceptum mente laborem 
3.222	Destituit frustrata manus: iam nemo propinqua 
3.223	Nemo patre sequitur: qu quisq; intelligit, addit 
3.224	Adglomeratq; sibi, sociumq; adiungere curat. 
3.225	 * Dumq ,\' perit diuisa huius cognatio gentis, 
3.226	Gentem lingua facit: sparguntur classibus aequis 
3.227	Diductasq; petunt vario sub sidere terras. 
3.228	Haud aliter volucres campi per mollia plana 
3.229	Quas gregibus mixtis errare & quaerere victum 
3.230	Persuasit secura dies, quum nocte propinqua 
3.231	Frondea tecta petat : exempto cum grege turba 
3.232	Vulgus quaeq; suum sequitur, rapidoq; volatu 
3.233	Miscetur similis qua duxerit aut color, aut vox: 
3.234	Sic tunc in partes populus se dissecat vnus: 
3.235	Et species fit quaeq; genus, longeq; remotis 
3.236	Considunt terris, atq; orbem gentibus implent 
3.237	Nec tamen hoc sacri (quum sit sua poena nocetu ) 
3.238	Muneris est vacuum: nam quamuis vltio iusta 
3.239	Haec fuerit, quos non tetigit reuerentia coeli 
3.240	Quae sedes propria est mundi rerumque parenti, 
3.241	Vt nec se agnoscant verba inconsueta loquetes : 
3.242	 * AttamS id multu quod rapto hoc foedere cantu est 
3.243	 Ne quam paucorU attulerat persuasio culpam, 
3.244	Cunctorum assensu rursus contingeret omnes: 
3.245	Et faceret comune nefas: ne praelia, dura 
3.246	Et rabido populis mors arcessenda furore 
3.247	Bellum illis cinile foret: sic profuit illis
3.248	Inq ; bonum versa est primae diuisio linguae. 
3.249	QuaqucL nec prorsum sublata Hebraea loquendi1 )
3.250	 Consuetudo fuit: quum tunc permanserit oris 
3.251	Hebraei sonitus, sermo ; antiquus, in illis 
3.252	Qui culpae expertes pars non iniusta fuerunt 
3.253	Natoru quos Sem genuit, custodia iusti 
3.254	 Quos tenuit: dominiq; etid reuerentia surnmi . 
3.255	Sed postqua toto dementia percita mundo 
3.256	(Vt taceam magici scelus intolerabile monstri) 
3.257	In truncos & saxa etiam duriq; metalli 
3.258	Arte cauas species, d; cassas luce figuras 
3.259	Impegit mortale genus: mentesq; supernis 
3.260	 Intentas fregit: terraeq; addixit inerti, 
3.261	Conuoluitq; simul foedae contagio labis, 
3.262	Non secus aethiopum feruentibus excita terris 
3.263	Nubila, morborum corrupto tramite coeli 2) 
3.264	Dum currunt, quisquis percussum fulmine loeti 
3.265	Ingemuit, simul ipse ruit, quicunq; cadentem 
3.266	Conspexit, cecidit congestaq; funera passim 
3.267	Dira lues strauit, camposgwe reliquit manes . 
3.268	Sic tunc praecipiti complexos mole furoris 
3.269	* Ne nihil infectum toto dimitteret orbe 
3.270	 Cdprendit repetens, quos iam dimiserat error. 
3.271	Donec Chaldaei generis de semine Thare3 ) 
3.272	 Vir iustus metuensq; Dei cum stii-pe suorum 
3.273	Vrbem aliam moresq; nouos, sedemq; requirens 
3.274	Mansit in Assyrijs demu nouus accola Carris. 
3.275	Qui quadragenis lustris vbi vixit & vno 
3.276	 *Infaustam hanc vitam foelici morte redemit. 
3.277	 *Huic meritis patre & sanctis virtutibus aequans, 
3.278	 Aut longb superans, successit filius Abram. 
3.279	Vir coelo dignus, nam primo a lumine vitae 
3.280	Verum mente Deum venerans, gentilia sacra 
3.281	Auersatus erat, qu postqua morte parentis 
3.282	Iussa sequi iam posse Dei, sine fraude liquebat: 
3.283	His dominus famulu meritis dignatus adire est. 
3.284	Quadoquidem toto te solum inuenimus orbe 
3.285	Quem sincera fides iuuat, & reuerentia nostri: 
3.286	Linque procul sedes patrias, terramq; nocentem, 
3.287	Pollutamq; domum: cognatio tota prophana est 
3.288	Et fugienda tibi: terrae melioris in agros 
3.289	Me duce peruenies: ne sis pars gentis iniquae 
3.290	Qui sanctae caput esse potes: tum sacra dicabo 
3.291	Quae maneant benedicta tibi, nomenq; per omnes 
3.292	Magnificu redda populos, bona cuncta repedes : 
3.293	Et benedictus erit tibi qui benedixerit: atqui 
3.294	 \'* Qui maledicta tibi conuiciaq; ingeret, ille. 
3.295	 Confestim maledictus erit, benedictio per te 
3.296	Spargetur tribubus cunctis, aeuoq; futuro . 
3.297	Dixit, & imperijs mente quae pareat indit, 
3.298	Promissisq; pijs credat, mora nulla repente 
3.299	 : *Dicto intercedit domini: sed protinus Abram
3.300	Cu gregibus varij generis, famulisq; paternis, 
3.301	Coniuge cu fida, chari cum pignore fratris, 
3.302	Cui Loth nomen erat, digressus, limite recto 
3.303	Ignotum sibi carpit iter: mollissima laetas 
3.304	\'Praebent arua vias, blandumq; fauetibus austris 
3.305	Arridens nullis turbatur motibus aer: 
3.306	In Chanaam terras & regna vberrima Sichem1 ) 
3.307	*Donec perueniens, didicit soboliq; sibiq; \' 
3.308	 Isthaec in sortem imperij cessura futuri: 
3.309	Vnde Deo supplex deuotas extruit aras, 
3.310	Et veteres reuocas, cultor nouus auget honores. 
3.311	Inde petit Bethel sedes quae lecta beati 
3.312	Hospitijs sacrata Dei: cunctasq; superbis 
3.313	Excessit meritis terras, quandoq; secundo 
3.314	Post coelū numeranda loco: nam sede superna 
3.315	Dignior ista Dei, quae pignus lege salutis 
3.316	Emissum mundo tantum mirante paratum, 
3.317	Exciperet visa est, hominemq; remitteret astris. 
3.318	Hic quoq; solennes Abram pater extruit avuis . 
3.319	Et linquenda nouis habitacula ponit in aruis. 
3.320	Namq; fame rursum sedem mutare coactus 
3.321	Castra mouet, totaq ; domu famulosq; gregesq;: 
3.322	Secum agit, & rebus comercia iusta rependens 
3.323	Intrat in Aegyptum: & Sarai appellare sororem
3.324	 Mauult\' quam vxore , ne barbara pectora sancti 
3.325	Hospitis, in caedem stimulet furiosa libido. 
3.326	Vnde <6 mox Pharao radiantis imagine formae 
3.327	Ictus inardescit, thalamosq; & foedera certa 
3.328	Lege parat: longos isthaec connubia in annos • 
3.329	* Ducturus, ni longi aliter disponeret ille
3.330	* Autor coniugij: cui quu minus ista placerent 
3.331	*Ecce pauor regi mersa formidine mixtus 
3.332	Ingruit, & subito quatit iproba corda tumultu: 
3.333	Exterretq; animos niger horror & iplicat artus. 
3.334	Vt rex sacrilegae gentis tam tristia vota 
3.335	Sentiret damnasse Deum, qui tale profecto 
3.336	Consiliu infudit famulis, vt barbarus hostis 
3.337	Esse virum Sarai securum agnosceret Abram, 
3.338	Quu foret expertus qua no impune prophano - 
3.339	Appeteret ferro, quam nec uiduare liceret. 
3.340	Sponte igitur nulla violatam labe marito 1) 
3.341	Reddit cE ingenti cumulatum fruge remittit 
3.342	In Sichem, Bethelemque sua: quo deinde recepti 
3.343	* Cum gregibusq; domoq; pater, cu coiuge salua,
3.344	Exercent campos, & pinguia pascua late 
3.345	Immixtis carpunt gregibus: dum iurgia crebra. 
3.346	Inter pastores patrui nata atq; nepotis: 
3.347	 * Dum non sufficerent capiendis arua duorum 
3.348	 Armentis angusta nimis: plenissimus ergo 
3.349	Abram iustitiae atq; obseruantissimus aequi 
3.350	Quo dirimat lites, & iurgia tollat auara, 
3.351	Vt natu maior, concessos diuidit agros:. 
3.352	Iunior elegit qua dulcibus vndiq; fusis 
3.353	Rura maritat aquis, ripisq; vmbrantibus inter 
3.354	Labitur, & teretes saltus Iordanis amoenat. 
3.355	Ergo quo fugiat pastorum iurgia ab Abram
3.356	Declinas, iuctos Sodomae Loth migrat in agros. 
3.357	Quu Deus hac Abra moesti spe pectora firmas, 
3.358	Ne mouearis ait. fratris quod prole relicta 
3.359	Nunc solus videare tibi: innumerabile vulgus 
3.360	Tu mihi solus eris, populiq; idem autor amici 
3.361	Suspice quadrifidi partes intentus ad orbis: 
3.362	 Inspice nunc austrum versus, septemq; triones,
3.363	 Qua sol exoritur, qua vespere concidit imo,
3.364	Haec tibimet, proliq; tuae, populisq; tuorum, 
3.365	Concedam, aeternos illis habitanda per annos . 
3.366	Queis tu etiam terris longfc lateq; fruaris: 
3.367	Surge, & quid pateat gressu prius hospite lustra. 
3.368	Haec ait. Ille libens paret sedemq; relinquens 
3.369	Emigrat, Chebronq; subit, subq; ilice nigra 
3.370	 Ad Mamre querceta pater tentoria figit: 2)
3.371	Hic quoque solennes domino struit ce colit aras. 
3.372	Interea magno circum turbante tumultu 
3.373	Hostis adest, auidus, varia quem dote referta 
3.374	Solicitat tellus, campis illisa resultat 
3.375	Vngula, & effusis errat populator habenis 
3.376	*Aduersum Sodomę, ptguissima pascua gentis:
3.377	Loth vero portis cum rege erumpit apertis, 
3.378	Et vicina manus regum socia arma ferentum, 
3.379	Secu equites peditesq; trahunt, distenditur agme 
3.380	Confligunt acies pariter, sternuntq; caduntq;:1) 
3.381	Sed turpi Sodomae luxu emollita iuuentus 
3.382	Vt rursum exarsit repetitus clamor in iras, 
3.383	Vertunt terga metu: rapido pars moenia cursu, 
3.384	Pars montes, syluasq; petunt, pars septa cateruis 
3.385	Porrigit ignauas ad tristia vincula palmas. 
3.386	Vt . vero patruus captum Loth audijt Abram, 
3.387	Non fletu, quid enim fletus conferret inanis? 
3.388	Sed virtute parat fratri succurrere capto .
3.389	*Instructos igitur tercentum deligit omni 
3.390	De grege bisq; noue famulos, quos an praeeutes 
3.391	Insequitur sensim, qua lentum prodidit hostem 
3.392	Tendere praeda grauis: quorum de nocte silenti
3.393	 Corpora ( confluctu dum iam languentia duro 
3.394	Irrigat, & fessos dulcis sopor alligat artus) 
3.395	* Aggreditur , nil venturum sibi tale jJlltantmn : 
3.396	Vt quum ieiuni rabies vesana leonis 
3.397	In pecudum saltu penetrauit septa volucri, 
3.398	Et dente atq; pede exanimat, cupidamq; vorandi 
3.399	Ira famem superat, dum meta doloris acerbi 
3.400	Iamq ; ouibus vacuas effecerit vltima caulas. 
3.401	Haud secus ille duces somno vinoq; sepultos 
3.402	Stertentesq ; Abram populos, regesq; trucidat 
3.403	Sic tamen vt nullus confundat castra tumultus. 
3.404	Nemo gradu sentit, nisi que mens deficit & vox . 
3.405	Nemo sonum caedis, nisi que more excitat audit. 
3.406	Sanguine cuncta madent: sicco resoluta sereno 
3.407	Tellus tabe coit, gressumq; morante cruore 
3.408	Lubrica stagnanti titubant vestigia campo. 
3.409	Nec tam omne animos gladijs occubit apertis, 
